Keyword,Search Volume,CPC ($),PPC Budget Cost ($/mo)
"air conditioning repair Palm Desert",260,12.84,1002
"Palm Desert air conditioning repair",260,12.87,1004
"air conditioning repair Rancho Mirage",40,0.00,0
"Rancho Mirage air conditioning repair",0,0.00,0
"air conditioning repair La Quinta",70,16.40,344
"La Quinta air conditioning repair",10,0.00,0
"air conditioning repair Cathedral City",20,0.00,0
"Cathedral City air conditioning repair",0,0.00,0
"air conditioning repair Indio",140,5.00,210
"Indio air conditioning repair",10,0.00,0
"air conditioning repair Coachella",30,16.51,149
"Coachella air conditioning repair",0,0.00,0
"air conditioning repair Palm Springs",390,1.38,161
"Palm Springs air conditioning repair",390,1.38,161
"air conditioning repair Thermal",10,0.00,0
"Thermal air conditioning repair",0,0.00,0
"air conditioning repair Ribbonwood",0,0.00,0
"Ribbonwood air conditioning repair",0,0.00,0
"air conditioning repair Pinyon Pines",0,0.00,0
"Pinyon Pines air conditioning repair",0,0.00,0
"air conditioning repair Desert Hot Springs",70,14.68,308
"Desert Hot Springs air conditioning repair",0,0.00,0
"air conditioning repair Garnet",0,0.00,0
"Garnet air conditioning repair",0,0.00,0
"air conditioning repair North Palm Springs",0,0.00,0
"North Palm Springs air conditioning repair",0,0.00,0
"air conditioning repair Mountain Center",0,0.00,0
"Mountain Center air conditioning repair",0,0.00,0
"emergency air conditioner repair Palm Desert",0,0.00,0
"Palm Desert emergency air conditioner repair",0,0.00,0
"emergency air conditioner repair Rancho Mirage",0,0.00,0
"Rancho Mirage emergency air conditioner repair",0,0.00,0
"emergency air conditioner repair La Quinta",0,0.00,0
"La Quinta emergency air conditioner repair",0,0.00,0
"emergency air conditioner repair Cathedral City",0,0.00,0
"Cathedral City emergency air conditioner repair",0,0.00,0
"emergency air conditioner repair Indio",0,0.00,0
"Indio emergency air conditioner repair",0,0.00,0
"emergency air conditioner repair Coachella",0,0.00,0
"Coachella emergency air conditioner repair",0,0.00,0
"emergency air conditioner repair Palm Springs",0,0.00,0
"Palm Springs emergency air conditioner repair",0,0.00,0
"emergency air conditioner repair Thermal",0,0.00,0
"Thermal emergency air conditioner repair",0,0.00,0
"emergency air conditioner repair Ribbonwood",0,0.00,0
"Ribbonwood emergency air conditioner repair",0,0.00,0
"emergency air conditioner repair Pinyon Pines",0,0.00,0
"Pinyon Pines emergency air conditioner repair",0,0.00,0
"emergency air conditioner repair Desert Hot Springs",0,0.00,0
"Desert Hot Springs emergency air conditioner repair",0,0.00,0
"emergency air conditioner repair Garnet",0,0.00,0
"Garnet emergency air conditioner repair",0,0.00,0
"emergency air conditioner repair North Palm Springs",0,0.00,0
"North Palm Springs emergency air conditioner repair",0,0.00,0
"emergency air conditioner repair Mountain Center",0,0.00,0
"Mountain Center emergency air conditioner repair",0,0.00,0
"emergency ac repair Palm Desert",0,0.00,0
"Palm Desert emergency ac repair",0,0.00,0
"emergency ac repair Rancho Mirage",0,0.00,0
"Rancho Mirage emergency ac repair",0,0.00,0
"emergency ac repair La Quinta",0,0.00,0
"La Quinta emergency ac repair",0,0.00,0
"emergency ac repair Cathedral City",0,0.00,0
"Cathedral City emergency ac repair",0,0.00,0
"emergency ac repair Indio",0,0.00,0
"Indio emergency ac repair",0,0.00,0
"emergency ac repair Coachella",0,0.00,0
"Coachella emergency ac repair",0,0.00,0
"emergency ac repair Palm Springs",0,0.00,0
"Palm Springs emergency ac repair",0,0.00,0
"emergency ac repair Thermal",0,0.00,0
"Thermal emergency ac repair",0,0.00,0
"emergency ac repair Ribbonwood",0,0.00,0
"Ribbonwood emergency ac repair",0,0.00,0
"emergency ac repair Pinyon Pines",0,0.00,0
"Pinyon Pines emergency ac repair",0,0.00,0
"emergency ac repair Desert Hot Springs",0,0.00,0
"Desert Hot Springs emergency ac repair",0,0.00,0
"emergency ac repair Garnet",0,0.00,0
"Garnet emergency ac repair",0,0.00,0
"emergency ac repair North Palm Springs",0,0.00,0
"North Palm Springs emergency ac repair",0,0.00,0
"emergency ac repair Mountain Center",0,0.00,0
"Mountain Center emergency ac repair",0,0.00,0
"hvac companies Palm Desert",0,0.00,0
"Palm Desert hvac companies",0,0.00,0
"hvac companies Rancho Mirage",0,0.00,0
"Rancho Mirage hvac companies",0,0.00,0
"hvac companies La Quinta",0,0.00,0
"La Quinta hvac companies",0,0.00,0
"hvac companies Cathedral City",0,0.00,0
"Cathedral City hvac companies",0,0.00,0
"hvac companies Indio",0,0.00,0
"Indio hvac companies",0,0.00,0
"hvac companies Coachella",0,0.00,0
"Coachella hvac companies",0,0.00,0
"hvac companies Palm Springs",0,0.00,0
"Palm Springs hvac companies",0,0.00,0
"hvac companies Thermal",0,0.00,0
"Thermal hvac companies",0,0.00,0
"hvac companies Ribbonwood",0,0.00,0
"Ribbonwood hvac companies",0,0.00,0
"hvac companies Pinyon Pines",0,0.00,0
"Pinyon Pines hvac companies",0,0.00,0
"hvac companies Desert Hot Springs",0,0.00,0
"Desert Hot Springs hvac companies",0,0.00,0
"hvac companies Garnet",0,0.00,0
"Garnet hvac companies",0,0.00,0
"hvac companies North Palm Springs",0,0.00,0
"North Palm Springs hvac companies",0,0.00,0
"hvac companies Mountain Center",0,0.00,0
"Mountain Center hvac companies",0,0.00,0
"air conditioning service Palm Desert",0,0.00,0
"Palm Desert air conditioning service",0,0.00,0
"air conditioning service Rancho Mirage",0,0.00,0
"Rancho Mirage air conditioning service",0,0.00,0
"air conditioning service La Quinta",0,0.00,0
"La Quinta air conditioning service",0,0.00,0
"air conditioning service Cathedral City",0,0.00,0
"Cathedral City air conditioning service",0,0.00,0
"air conditioning service Indio",0,0.00,0
"Indio air conditioning service",0,0.00,0
"air conditioning service Coachella",0,0.00,0
"Coachella air conditioning service",0,0.00,0
"air conditioning service Palm Springs",0,0.00,0
"Palm Springs air conditioning service",0,0.00,0
"air conditioning service Thermal",0,0.00,0
"Thermal air conditioning service",0,0.00,0
"air conditioning service Ribbonwood",0,0.00,0
"Ribbonwood air conditioning service",0,0.00,0
"air conditioning service Pinyon Pines",0,0.00,0
"Pinyon Pines air conditioning service",0,0.00,0
"air conditioning service Desert Hot Springs",0,0.00,0
"Desert Hot Springs air conditioning service",0,0.00,0
"air conditioning service Garnet",0,0.00,0
"Garnet air conditioning service",0,0.00,0
"air conditioning service North Palm Springs",0,0.00,0
"North Palm Springs air conditioning service",0,0.00,0
"air conditioning service Mountain Center",0,0.00,0
"Mountain Center air conditioning service",0,0.00,0
"ac service Palm Desert",0,0.00,0
"Palm Desert ac service",0,0.00,0
"ac service Rancho Mirage",0,0.00,0
"Rancho Mirage ac service",0,0.00,0
"ac service La Quinta",0,0.00,0
"La Quinta ac service",0,0.00,0
"ac service Cathedral City",0,0.00,0
"Cathedral City ac service",0,0.00,0
"ac service Indio",0,0.00,0
"Indio ac service",0,0.00,0
"ac service Coachella",0,0.00,0
"Coachella ac service",0,0.00,0
"ac service Palm Springs",0,0.00,0
"Palm Springs ac service",0,0.00,0
"ac service Thermal",0,0.00,0
"Thermal ac service",0,0.00,0
"ac service Ribbonwood",0,0.00,0
"Ribbonwood ac service",0,0.00,0
"ac service Pinyon Pines",0,0.00,0
"Pinyon Pines ac service",0,0.00,0
"ac service Desert Hot Springs",0,0.00,0
"Desert Hot Springs ac service",0,0.00,0
"ac service Garnet",0,0.00,0
"Garnet ac service",0,0.00,0
"ac service North Palm Springs",0,0.00,0
"North Palm Springs ac service",0,0.00,0
"ac service Mountain Center",0,0.00,0
"Mountain Center ac service",0,0.00,0
"air conditioning Palm Desert",0,0.00,0
"Palm Desert air conditioning",0,0.00,0
"air conditioning Rancho Mirage",0,0.00,0
"Rancho Mirage air conditioning",0,0.00,0
"air conditioning La Quinta",0,0.00,0
"La Quinta air conditioning",0,0.00,0
"air conditioning Cathedral City",0,0.00,0
"Cathedral City air conditioning",0,0.00,0
"air conditioning Indio",0,0.00,0
"Indio air conditioning",0,0.00,0
"air conditioning Coachella",0,0.00,0
"Coachella air conditioning",0,0.00,0
"air conditioning Palm Springs",0,0.00,0
"Palm Springs air conditioning",0,0.00,0
"air conditioning Thermal",0,0.00,0
"Thermal air conditioning",0,0.00,0
"air conditioning Ribbonwood",0,0.00,0
"Ribbonwood air conditioning",0,0.00,0
"air conditioning Pinyon Pines",0,0.00,0
"Pinyon Pines air conditioning",0,0.00,0
"air conditioning Desert Hot Springs",0,0.00,0
"Desert Hot Springs air conditioning",0,0.00,0
"air conditioning Garnet",0,0.00,0
"Garnet air conditioning",0,0.00,0
"air conditioning North Palm Springs",0,0.00,0
"North Palm Springs air conditioning",0,0.00,0
"air conditioning Mountain Center",0,0.00,0
"Mountain Center air conditioning",0,0.00,0
"emergency ac service Palm Desert",0,0.00,0
"Palm Desert emergency ac service",0,0.00,0
"emergency ac service Rancho Mirage",0,0.00,0
"Rancho Mirage emergency ac service",0,0.00,0
"emergency ac service La Quinta",0,0.00,0
"La Quinta emergency ac service",0,0.00,0
"emergency ac service Cathedral City",0,0.00,0
"Cathedral City emergency ac service",0,0.00,0
"emergency ac service Indio",0,0.00,0
"Indio emergency ac service",0,0.00,0
"emergency ac service Coachella",0,0.00,0
"Coachella emergency ac service",0,0.00,0
"emergency ac service Palm Springs",0,0.00,0
"Palm Springs emergency ac service",0,0.00,0
"emergency ac service Thermal",0,0.00,0
"Thermal emergency ac service",0,0.00,0
"emergency ac service Ribbonwood",0,0.00,0
"Ribbonwood emergency ac service",0,0.00,0
"emergency ac service Pinyon Pines",0,0.00,0
"Pinyon Pines emergency ac service",0,0.00,0
"emergency ac service Desert Hot Springs",0,0.00,0
"Desert Hot Springs emergency ac service",0,0.00,0
"emergency ac service Garnet",0,0.00,0
"Garnet emergency ac service",0,0.00,0
"emergency ac service North Palm Springs",0,0.00,0
"North Palm Springs emergency ac service",0,0.00,0
"emergency ac service Mountain Center",0,0.00,0
"Mountain Center emergency ac service",0,0.00,0
"ac installation Palm Desert",0,0.00,0
"Palm Desert ac installation",0,0.00,0
"ac installation Rancho Mirage",0,0.00,0
"Rancho Mirage ac installation",0,0.00,0
"ac installation La Quinta",0,0.00,0
"La Quinta ac installation",0,0.00,0
"ac installation Cathedral City",0,0.00,0
"Cathedral City ac installation",0,0.00,0
"ac installation Indio",0,0.00,0
"Indio ac installation",0,0.00,0
"ac installation Coachella",0,0.00,0
"Coachella ac installation",0,0.00,0
"ac installation Palm Springs",0,0.00,0
"Palm Springs ac installation",0,0.00,0
"ac installation Thermal",0,0.00,0
"Thermal ac installation",0,0.00,0
"ac installation Ribbonwood",0,0.00,0
"Ribbonwood ac installation",0,0.00,0
"ac installation Pinyon Pines",0,0.00,0
"Pinyon Pines ac installation",0,0.00,0
"ac installation Desert Hot Springs",0,0.00,0
"Desert Hot Springs ac installation",0,0.00,0
"ac installation Garnet",0,0.00,0
"Garnet ac installation",0,0.00,0
"ac installation North Palm Springs",0,0.00,0
"North Palm Springs ac installation",0,0.00,0
"ac installation Mountain Center",0,0.00,0
"Mountain Center ac installation",0,0.00,0
"furnace replacement Palm Desert",0,0.00,0
"Palm Desert furnace replacement",0,0.00,0
"furnace replacement Rancho Mirage",0,0.00,0
"Rancho Mirage furnace replacement",0,0.00,0
"furnace replacement La Quinta",0,0.00,0
"La Quinta furnace replacement",0,0.00,0
"furnace replacement Cathedral City",0,0.00,0
"Cathedral City furnace replacement",0,0.00,0
"furnace replacement Indio",0,0.00,0
"Indio furnace replacement",0,0.00,0
"furnace replacement Coachella",0,0.00,0
"Coachella furnace replacement",0,0.00,0
"furnace replacement Palm Springs",0,0.00,0
"Palm Springs furnace replacement",0,0.00,0
"furnace replacement Thermal",0,0.00,0
"Thermal furnace replacement",0,0.00,0
"furnace replacement Ribbonwood",0,0.00,0
"Ribbonwood furnace replacement",0,0.00,0
"furnace replacement Pinyon Pines",0,0.00,0
"Pinyon Pines furnace replacement",0,0.00,0
"furnace replacement Desert Hot Springs",0,0.00,0
"Desert Hot Springs furnace replacement",0,0.00,0
"furnace replacement Garnet",0,0.00,0
"Garnet furnace replacement",0,0.00,0
"furnace replacement North Palm Springs",0,0.00,0
"North Palm Springs furnace replacement",0,0.00,0
"furnace replacement Mountain Center",0,0.00,0
"Mountain Center furnace replacement",0,0.00,0
"hvac contractor Palm Desert",0,0.00,0
"Palm Desert hvac contractor",0,0.00,0
"hvac contractor Rancho Mirage",0,0.00,0
"Rancho Mirage hvac contractor",0,0.00,0
"hvac contractor La Quinta",0,0.00,0
"La Quinta hvac contractor",0,0.00,0
"hvac contractor Cathedral City",0,0.00,0
"Cathedral City hvac contractor",0,0.00,0
"hvac contractor Indio",0,0.00,0
"Indio hvac contractor",0,0.00,0
"hvac contractor Coachella",0,0.00,0
"Coachella hvac contractor",0,0.00,0
"hvac contractor Palm Springs",0,0.00,0
"Palm Springs hvac contractor",0,0.00,0
"hvac contractor Thermal",0,0.00,0
"Thermal hvac contractor",0,0.00,0
"hvac contractor Ribbonwood",0,0.00,0
"Ribbonwood hvac contractor",0,0.00,0
"hvac contractor Pinyon Pines",0,0.00,0
"Pinyon Pines hvac contractor",0,0.00,0
"hvac contractor Desert Hot Springs",0,0.00,0
"Desert Hot Springs hvac contractor",0,0.00,0
"hvac contractor Garnet",0,0.00,0
"Garnet hvac contractor",0,0.00,0
"hvac contractor North Palm Springs",0,0.00,0
"North Palm Springs hvac contractor",0,0.00,0
"hvac contractor Mountain Center",0,0.00,0
"Mountain Center hvac contractor",0,0.00,0
"hvac services Palm Desert",0,0.00,0
"Palm Desert hvac services",0,0.00,0
"hvac services Rancho Mirage",0,0.00,0
"Rancho Mirage hvac services",0,0.00,0
"hvac services La Quinta",0,0.00,0
"La Quinta hvac services",0,0.00,0
"hvac services Cathedral City",0,0.00,0
"Cathedral City hvac services",0,0.00,0
"hvac services Indio",0,0.00,0
"Indio hvac services",0,0.00,0
"hvac services Coachella",0,0.00,0
"Coachella hvac services",0,0.00,0
"hvac services Palm Springs",0,0.00,0
"Palm Springs hvac services",0,0.00,0
"hvac services Thermal",0,0.00,0
"Thermal hvac services",0,0.00,0
"hvac services Ribbonwood",0,0.00,0
"Ribbonwood hvac services",0,0.00,0
"hvac services Pinyon Pines",0,0.00,0
"Pinyon Pines hvac services",0,0.00,0
"hvac services Desert Hot Springs",0,0.00,0
"Desert Hot Springs hvac services",0,0.00,0
"hvac services Garnet",0,0.00,0
"Garnet hvac services",0,0.00,0
"hvac services North Palm Springs",0,0.00,0
"North Palm Springs hvac services",0,0.00,0
"hvac services Mountain Center",0,0.00,0
"Mountain Center hvac services",0,0.00,0
"heating and cooling repair Palm Desert",0,0.00,0
"Palm Desert heating and cooling repair",0,0.00,0
"heating and cooling repair Rancho Mirage",0,0.00,0
"Rancho Mirage heating and cooling repair",0,0.00,0
"heating and cooling repair La Quinta",0,0.00,0
"La Quinta heating and cooling repair",0,0.00,0
"heating and cooling repair Cathedral City",0,0.00,0
"Cathedral City heating and cooling repair",0,0.00,0
"heating and cooling repair Indio",0,0.00,0
"Indio heating and cooling repair",0,0.00,0
"heating and cooling repair Coachella",0,0.00,0
"Coachella heating and cooling repair",0,0.00,0
"heating and cooling repair Palm Springs",0,0.00,0
"Palm Springs heating and cooling repair",0,0.00,0
"heating and cooling repair Thermal",0,0.00,0
"Thermal heating and cooling repair",0,0.00,0
"heating and cooling repair Ribbonwood",0,0.00,0
"Ribbonwood heating and cooling repair",0,0.00,0
"heating and cooling repair Pinyon Pines",0,0.00,0
"Pinyon Pines heating and cooling repair",0,0.00,0
"heating and cooling repair Desert Hot Springs",0,0.00,0
"Desert Hot Springs heating and cooling repair",0,0.00,0
"heating and cooling repair Garnet",0,0.00,0
"Garnet heating and cooling repair",0,0.00,0
"heating and cooling repair North Palm Springs",0,0.00,0
"North Palm Springs heating and cooling repair",0,0.00,0
"heating and cooling repair Mountain Center",0,0.00,0
"Mountain Center heating and cooling repair",0,0.00,0
"air duct cleaning Palm Desert",0,0.00,0
"Palm Desert air duct cleaning",0,0.00,0
"air duct cleaning Rancho Mirage",0,0.00,0
"Rancho Mirage air duct cleaning",0,0.00,0
"air duct cleaning La Quinta",0,0.00,0
"La Quinta air duct cleaning",0,0.00,0
"air duct cleaning Cathedral City",0,0.00,0
"Cathedral City air duct cleaning",0,0.00,0
"air duct cleaning Indio",0,0.00,0
"Indio air duct cleaning",0,0.00,0
"air duct cleaning Coachella",0,0.00,0
"Coachella air duct cleaning",0,0.00,0
"air duct cleaning Palm Springs",0,0.00,0
"Palm Springs air duct cleaning",0,0.00,0
"air duct cleaning Thermal",0,0.00,0
"Thermal air duct cleaning",0,0.00,0
"air duct cleaning Ribbonwood",0,0.00,0
"Ribbonwood air duct cleaning",0,0.00,0
"air duct cleaning Pinyon Pines",0,0.00,0
"Pinyon Pines air duct cleaning",0,0.00,0
"air duct cleaning Desert Hot Springs",0,0.00,0
"Desert Hot Springs air duct cleaning",0,0.00,0
"air duct cleaning Garnet",0,0.00,0
"Garnet air duct cleaning",0,0.00,0
"air duct cleaning North Palm Springs",0,0.00,0
"North Palm Springs air duct cleaning",0,0.00,0
"air duct cleaning Mountain Center",0,0.00,0
"Mountain Center air duct cleaning",0,0.00,0
"hvac repair near me Palm Desert",0,0.00,0
"Palm Desert hvac repair near me",0,0.00,0
"hvac repair near me Rancho Mirage",0,0.00,0
"Rancho Mirage hvac repair near me",0,0.00,0
"hvac repair near me La Quinta",0,0.00,0
"La Quinta hvac repair near me",0,0.00,0
"hvac repair near me Cathedral City",0,0.00,0
"Cathedral City hvac repair near me",0,0.00,0
"hvac repair near me Indio",0,0.00,0
"Indio hvac repair near me",0,0.00,0
"hvac repair near me Coachella",0,0.00,0
"Coachella hvac repair near me",0,0.00,0
"hvac repair near me Palm Springs",0,0.00,0
"Palm Springs hvac repair near me",0,0.00,0
"hvac repair near me Thermal",0,0.00,0
"Thermal hvac repair near me",0,0.00,0
"hvac repair near me Ribbonwood",0,0.00,0
"Ribbonwood hvac repair near me",0,0.00,0
"hvac repair near me Pinyon Pines",0,0.00,0
"Pinyon Pines hvac repair near me",0,0.00,0
"hvac repair near me Desert Hot Springs",0,0.00,0
"Desert Hot Springs hvac repair near me",0,0.00,0
"hvac repair near me Garnet",0,0.00,0
"Garnet hvac repair near me",0,0.00,0
"hvac repair near me North Palm Springs",0,0.00,0
"North Palm Springs hvac repair near me",0,0.00,0
"hvac repair near me Mountain Center",0,0.00,0
"Mountain Center hvac repair near me",0,0.00,0
"furnace repair near me Palm Desert",0,0.00,0
"Palm Desert furnace repair near me",0,0.00,0
"furnace repair near me Rancho Mirage",0,0.00,0
"Rancho Mirage furnace repair near me",0,0.00,0
"furnace repair near me La Quinta",0,0.00,0
"La Quinta furnace repair near me",0,0.00,0
"furnace repair near me Cathedral City",0,0.00,0
"Cathedral City furnace repair near me",0,0.00,0
"furnace repair near me Indio",0,0.00,0
"Indio furnace repair near me",0,0.00,0
"furnace repair near me Coachella",0,0.00,0
"Coachella furnace repair near me",0,0.00,0
"furnace repair near me Palm Springs",0,0.00,0
"Palm Springs furnace repair near me",0,0.00,0
"furnace repair near me Thermal",0,0.00,0
"Thermal furnace repair near me",0,0.00,0
"furnace repair near me Ribbonwood",0,0.00,0
"Ribbonwood furnace repair near me",0,0.00,0
"furnace repair near me Pinyon Pines",0,0.00,0
"Pinyon Pines furnace repair near me",0,0.00,0
"furnace repair near me Desert Hot Springs",0,0.00,0
"Desert Hot Springs furnace repair near me",0,0.00,0
"furnace repair near me Garnet",0,0.00,0
"Garnet furnace repair near me",0,0.00,0
"furnace repair near me North Palm Springs",0,0.00,0
"North Palm Springs furnace repair near me",0,0.00,0
"furnace repair near me Mountain Center",0,0.00,0
"Mountain Center furnace repair near me",0,0.00,0
"heating and cooling near me Palm Desert",0,0.00,0
"Palm Desert heating and cooling near me",0,0.00,0
"heating and cooling near me Rancho Mirage",0,0.00,0
"Rancho Mirage heating and cooling near me",0,0.00,0
"heating and cooling near me La Quinta",0,0.00,0
"La Quinta heating and cooling near me",0,0.00,0
"heating and cooling near me Cathedral City",0,0.00,0
"Cathedral City heating and cooling near me",0,0.00,0
"heating and cooling near me Indio",0,0.00,0
"Indio heating and cooling near me",0,0.00,0
"heating and cooling near me Coachella",0,0.00,0
"Coachella heating and cooling near me",0,0.00,0
"heating and cooling near me Palm Springs",0,0.00,0
"Palm Springs heating and cooling near me",0,0.00,0
"heating and cooling near me Thermal",0,0.00,0
"Thermal heating and cooling near me",0,0.00,0
"heating and cooling near me Ribbonwood",0,0.00,0
"Ribbonwood heating and cooling near me",0,0.00,0
"heating and cooling near me Pinyon Pines",0,0.00,0
"Pinyon Pines heating and cooling near me",0,0.00,0
"heating and cooling near me Desert Hot Springs",0,0.00,0
"Desert Hot Springs heating and cooling near me",0,0.00,0
"heating and cooling near me Garnet",0,0.00,0
"Garnet heating and cooling near me",0,0.00,0
"heating and cooling near me North Palm Springs",0,0.00,0
"North Palm Springs heating and cooling near me",0,0.00,0
"heating and cooling near me Mountain Center",0,0.00,0
"Mountain Center heating and cooling near me",0,0.00,0
"ac installation near me Palm Desert",0,0.00,0
"Palm Desert ac installation near me",0,0.00,0
"ac installation near me Rancho Mirage",0,0.00,0
"Rancho Mirage ac installation near me",0,0.00,0
"ac installation near me La Quinta",0,0.00,0
"La Quinta ac installation near me",0,0.00,0
"ac installation near me Cathedral City",0,0.00,0
"Cathedral City ac installation near me",0,0.00,0
"ac installation near me Indio",0,0.00,0
"Indio ac installation near me",0,0.00,0
"ac installation near me Coachella",0,0.00,0
"Coachella ac installation near me",0,0.00,0
"ac installation near me Palm Springs",0,0.00,0
"Palm Springs ac installation near me",0,0.00,0
"ac installation near me Thermal",0,0.00,0
"Thermal ac installation near me",0,0.00,0
"ac installation near me Ribbonwood",0,0.00,0
"Ribbonwood ac installation near me",0,0.00,0
"ac installation near me Pinyon Pines",0,0.00,0
"Pinyon Pines ac installation near me",0,0.00,0
"ac installation near me Desert Hot Springs",0,0.00,0
"Desert Hot Springs ac installation near me",0,0.00,0
"ac installation near me Garnet",0,0.00,0
"Garnet ac installation near me",0,0.00,0
"ac installation near me North Palm Springs",0,0.00,0
"North Palm Springs ac installation near me",0,0.00,0
"ac installation near me Mountain Center",0,0.00,0
"Mountain Center ac installation near me",0,0.00,0
"emergency hvac repair Palm Desert",0,0.00,0
"Palm Desert emergency hvac repair",0,0.00,0
"emergency hvac repair Rancho Mirage",0,0.00,0
"Rancho Mirage emergency hvac repair",0,0.00,0
"emergency hvac repair La Quinta",0,0.00,0
"La Quinta emergency hvac repair",0,0.00,0
"emergency hvac repair Cathedral City",0,0.00,0
"Cathedral City emergency hvac repair",0,0.00,0
"emergency hvac repair Indio",0,0.00,0
"Indio emergency hvac repair",0,0.00,0
"emergency hvac repair Coachella",0,0.00,0
"Coachella emergency hvac repair",0,0.00,0
"emergency hvac repair Palm Springs",0,0.00,0
"Palm Springs emergency hvac repair",0,0.00,0
"emergency hvac repair Thermal",0,0.00,0
"Thermal emergency hvac repair",0,0.00,0
"emergency hvac repair Ribbonwood",0,0.00,0
"Ribbonwood emergency hvac repair",0,0.00,0
"emergency hvac repair Pinyon Pines",0,0.00,0
"Pinyon Pines emergency hvac repair",0,0.00,0
"emergency hvac repair Desert Hot Springs",0,0.00,0
"Desert Hot Springs emergency hvac repair",0,0.00,0
"emergency hvac repair Garnet",0,0.00,0
"Garnet emergency hvac repair",0,0.00,0
"emergency hvac repair North Palm Springs",0,0.00,0
"North Palm Springs emergency hvac repair",0,0.00,0
"emergency hvac repair Mountain Center",0,0.00,0
"Mountain Center emergency hvac repair",0,0.00,0
"24/7 hvac repair Palm Desert",0,0.00,0
"Palm Desert 24/7 hvac repair",0,0.00,0
"24/7 hvac repair Rancho Mirage",0,0.00,0
"Rancho Mirage 24/7 hvac repair",0,0.00,0
"24/7 hvac repair La Quinta",0,0.00,0
"La Quinta 24/7 hvac repair",0,0.00,0
"24/7 hvac repair Cathedral City",0,0.00,0
"Cathedral City 24/7 hvac repair",0,0.00,0
"24/7 hvac repair Indio",0,0.00,0
"Indio 24/7 hvac repair",0,0.00,0
"24/7 hvac repair Coachella",0,0.00,0
"Coachella 24/7 hvac repair",0,0.00,0
"24/7 hvac repair Palm Springs",0,0.00,0
"Palm Springs 24/7 hvac repair",0,0.00,0
"24/7 hvac repair Thermal",0,0.00,0
"Thermal 24/7 hvac repair",0,0.00,0
"24/7 hvac repair Ribbonwood",0,0.00,0
"Ribbonwood 24/7 hvac repair",0,0.00,0
"24/7 hvac repair Pinyon Pines",0,0.00,0
"Pinyon Pines 24/7 hvac repair",0,0.00,0
"24/7 hvac repair Desert Hot Springs",0,0.00,0
"Desert Hot Springs 24/7 hvac repair",0,0.00,0
"24/7 hvac repair Garnet",0,0.00,0
"Garnet 24/7 hvac repair",0,0.00,0
"24/7 hvac repair North Palm Springs",0,0.00,0
"North Palm Springs 24/7 hvac repair",0,0.00,0
"24/7 hvac repair Mountain Center",0,0.00,0
"Mountain Center 24/7 hvac repair",0,0.00,0
"same-day hvac service Palm Desert",0,0.00,0
"Palm Desert same-day hvac service",0,0.00,0
"same-day hvac service Rancho Mirage",0,0.00,0
"Rancho Mirage same-day hvac service",0,0.00,0
"same-day hvac service La Quinta",0,0.00,0
"La Quinta same-day hvac service",0,0.00,0
"same-day hvac service Cathedral City",0,0.00,0
"Cathedral City same-day hvac service",0,0.00,0
"same-day hvac service Indio",0,0.00,0
"Indio same-day hvac service",0,0.00,0
"same-day hvac service Coachella",0,0.00,0
"Coachella same-day hvac service",0,0.00,0
"same-day hvac service Palm Springs",0,0.00,0
"Palm Springs same-day hvac service",0,0.00,0
"same-day hvac service Thermal",0,0.00,0
"Thermal same-day hvac service",0,0.00,0
"same-day hvac service Ribbonwood",0,0.00,0
"Ribbonwood same-day hvac service",0,0.00,0
"same-day hvac service Pinyon Pines",0,0.00,0
"Pinyon Pines same-day hvac service",0,0.00,0
"same-day hvac service Desert Hot Springs",0,0.00,0
"Desert Hot Springs same-day hvac service",0,0.00,0
"same-day hvac service Garnet",0,0.00,0
"Garnet same-day hvac service",0,0.00,0
"same-day hvac service North Palm Springs",0,0.00,0
"North Palm Springs same-day hvac service",0,0.00,0
"same-day hvac service Mountain Center",0,0.00,0
"Mountain Center same-day hvac service",0,0.00,0
"after-hours hvac repair Palm Desert",0,0.00,0
