Keyword,Search Volume,CPC ($),PPC Budget Cost ($/mo)
"HVAC repair open now Pinyon Pines",0,0.00,0
"Pinyon Pines HVAC repair open now",0,0.00,0
"HVAC repair open now Desert Hot Springs",0,0.00,0
"Desert Hot Springs HVAC repair open now",0,0.00,0
"HVAC repair open now Garnet",0,0.00,0
"Garnet HVAC repair open now",0,0.00,0
"HVAC repair open now North Palm Springs",0,0.00,0
"North Palm Springs HVAC repair open now",0,0.00,0
"HVAC repair open now Mountain Center",0,0.00,0
"Mountain Center HVAC repair open now",0,0.00,0
"quick furnace repair Palm Desert",0,0.00,0
"Palm Desert quick furnace repair",0,0.00,0
"quick furnace repair Rancho Mirage",0,0.00,0
"Rancho Mirage quick furnace repair",0,0.00,0
"quick furnace repair La Quinta",0,0.00,0
"La Quinta quick furnace repair",0,0.00,0
"quick furnace repair Cathedral City",0,0.00,0
"Cathedral City quick furnace repair",0,0.00,0
"quick furnace repair Indio",0,0.00,0
"Indio quick furnace repair",0,0.00,0
"quick furnace repair Coachella",0,0.00,0
"Coachella quick furnace repair",0,0.00,0
"quick furnace repair Palm Springs",0,0.00,0
"Palm Springs quick furnace repair",0,0.00,0
"quick furnace repair Thermal",0,0.00,0
"Thermal quick furnace repair",0,0.00,0
"quick furnace repair Ribbonwood",0,0.00,0
"Ribbonwood quick furnace repair",0,0.00,0
"quick furnace repair Pinyon Pines",0,0.00,0
"Pinyon Pines quick furnace repair",0,0.00,0
"quick furnace repair Desert Hot Springs",0,0.00,0
"Desert Hot Springs quick furnace repair",0,0.00,0
"quick furnace repair Garnet",0,0.00,0
"Garnet quick furnace repair",0,0.00,0
"quick furnace repair North Palm Springs",0,0.00,0
"North Palm Springs quick furnace repair",0,0.00,0
"quick furnace repair Mountain Center",0,0.00,0
"Mountain Center quick furnace repair",0,0.00,0
"HVAC repair for storm damage Palm Desert",0,0.00,0
"Palm Desert HVAC repair for storm damage",0,0.00,0
"HVAC repair for storm damage Rancho Mirage",0,0.00,0
"Rancho Mirage HVAC repair for storm damage",0,0.00,0
"HVAC repair for storm damage La Quinta",0,0.00,0
"La Quinta HVAC repair for storm damage",0,0.00,0
"HVAC repair for storm damage Cathedral City",0,0.00,0
"Cathedral City HVAC repair for storm damage",0,0.00,0
"HVAC repair for storm damage Indio",0,0.00,0
"Indio HVAC repair for storm damage",0,0.00,0
"HVAC repair for storm damage Coachella",0,0.00,0
"Coachella HVAC repair for storm damage",0,0.00,0
"HVAC repair for storm damage Palm Springs",0,0.00,0
"Palm Springs HVAC repair for storm damage",0,0.00,0
"HVAC repair for storm damage Thermal",0,0.00,0
"Thermal HVAC repair for storm damage",0,0.00,0
"HVAC repair for storm damage Ribbonwood",0,0.00,0
"Ribbonwood HVAC repair for storm damage",0,0.00,0
"HVAC repair for storm damage Pinyon Pines",0,0.00,0
"Pinyon Pines HVAC repair for storm damage",0,0.00,0
"HVAC repair for storm damage Desert Hot Springs",0,0.00,0
"Desert Hot Springs HVAC repair for storm damage",0,0.00,0
"HVAC repair for storm damage Garnet",0,0.00,0
"Garnet HVAC repair for storm damage",0,0.00,0
"HVAC repair for storm damage North Palm Springs",0,0.00,0
"North Palm Springs HVAC repair for storm damage",0,0.00,0
"HVAC repair for storm damage Mountain Center",0,0.00,0
"Mountain Center HVAC repair for storm damage",0,0.00,0
"furnace not working during snowstorm Palm Desert",0,0.00,0
"Palm Desert furnace not working during snowstorm",0,0.00,0
"furnace not working during snowstorm Rancho Mirage",0,0.00,0
"Rancho Mirage furnace not working during snowstorm",0,0.00,0
"furnace not working during snowstorm La Quinta",0,0.00,0
"La Quinta furnace not working during snowstorm",0,0.00,0
"furnace not working during snowstorm Cathedral City",0,0.00,0
"Cathedral City furnace not working during snowstorm",0,0.00,0
"furnace not working during snowstorm Indio",0,0.00,0
"Indio furnace not working during snowstorm",0,0.00,0
"furnace not working during snowstorm Coachella",0,0.00,0
"Coachella furnace not working during snowstorm",0,0.00,0
"furnace not working during snowstorm Palm Springs",0,0.00,0
"Palm Springs furnace not working during snowstorm",0,0.00,0
"furnace not working during snowstorm Thermal",0,0.00,0
"Thermal furnace not working during snowstorm",0,0.00,0
"furnace not working during snowstorm Ribbonwood",0,0.00,0
"Ribbonwood furnace not working during snowstorm",0,0.00,0
"furnace not working during snowstorm Pinyon Pines",0,0.00,0
"Pinyon Pines furnace not working during snowstorm",0,0.00,0
"furnace not working during snowstorm Desert Hot Springs",0,0.00,0
"Desert Hot Springs furnace not working during snowstorm",0,0.00,0
"furnace not working during snowstorm Garnet",0,0.00,0
"Garnet furnace not working during snowstorm",0,0.00,0
"furnace not working during snowstorm North Palm Springs",0,0.00,0
"North Palm Springs furnace not working during snowstorm",0,0.00,0
"furnace not working during snowstorm Mountain Center",0,0.00,0
"Mountain Center furnace not working during snowstorm",0,0.00,0
"emergency air conditioning repair heat wave Palm Desert",0,0.00,0
"Palm Desert emergency air conditioning repair heat wave",0,0.00,0
"emergency air conditioning repair heat wave Rancho Mirage",0,0.00,0
"Rancho Mirage emergency air conditioning repair heat wave",0,0.00,0
"emergency air conditioning repair heat wave La Quinta",0,0.00,0
"La Quinta emergency air conditioning repair heat wave",0,0.00,0
"emergency air conditioning repair heat wave Cathedral City",0,0.00,0
"Cathedral City emergency air conditioning repair heat wave",0,0.00,0
"emergency air conditioning repair heat wave Indio",0,0.00,0
"Indio emergency air conditioning repair heat wave",0,0.00,0
"emergency air conditioning repair heat wave Coachella",0,0.00,0
"Coachella emergency air conditioning repair heat wave",0,0.00,0
"emergency air conditioning repair heat wave Palm Springs",0,0.00,0
"Palm Springs emergency air conditioning repair heat wave",0,0.00,0
"emergency air conditioning repair heat wave Thermal",0,0.00,0
"Thermal emergency air conditioning repair heat wave",0,0.00,0
"emergency air conditioning repair heat wave Ribbonwood",0,0.00,0
"Ribbonwood emergency air conditioning repair heat wave",0,0.00,0
"emergency air conditioning repair heat wave Pinyon Pines",0,0.00,0
"Pinyon Pines emergency air conditioning repair heat wave",0,0.00,0
"emergency air conditioning repair heat wave Desert Hot Springs",0,0.00,0
"Desert Hot Springs emergency air conditioning repair heat wave",0,0.00,0
"emergency air conditioning repair heat wave Garnet",0,0.00,0
"Garnet emergency air conditioning repair heat wave",0,0.00,0
"emergency air conditioning repair heat wave North Palm Springs",0,0.00,0
"North Palm Springs emergency air conditioning repair heat wave",0,0.00,0
"emergency air conditioning repair heat wave Mountain Center",0,0.00,0
"Mountain Center emergency air conditioning repair heat wave",0,0.00,0
"emergency heating repair in Palm Desert",0,0.00,0
"Palm Desert emergency heating repair in",0,0.00,0
"emergency heating repair in Rancho Mirage",0,0.00,0
"Rancho Mirage emergency heating repair in",0,0.00,0
"emergency heating repair in La Quinta",0,0.00,0
"La Quinta emergency heating repair in",0,0.00,0
"emergency heating repair in Cathedral City",0,0.00,0
"Cathedral City emergency heating repair in",0,0.00,0
"emergency heating repair in Indio",0,0.00,0
"Indio emergency heating repair in",0,0.00,0
"emergency heating repair in Coachella",0,0.00,0
"Coachella emergency heating repair in",0,0.00,0
"emergency heating repair in Palm Springs",0,0.00,0
"Palm Springs emergency heating repair in",0,0.00,0
"emergency heating repair in Thermal",0,0.00,0
"Thermal emergency heating repair in",0,0.00,0
"emergency heating repair in Ribbonwood",0,0.00,0
"Ribbonwood emergency heating repair in",0,0.00,0
"emergency heating repair in Pinyon Pines",0,0.00,0
"Pinyon Pines emergency heating repair in",0,0.00,0
"emergency heating repair in Desert Hot Springs",0,0.00,0
"Desert Hot Springs emergency heating repair in",0,0.00,0
"emergency heating repair in Garnet",0,0.00,0
"Garnet emergency heating repair in",0,0.00,0
"emergency heating repair in North Palm Springs",0,0.00,0
"North Palm Springs emergency heating repair in",0,0.00,0
"emergency heating repair in Mountain Center",0,0.00,0
"Mountain Center emergency heating repair in",0,0.00,0
"24/7 HVAC service near me Palm Desert",0,0.00,0
"Palm Desert 24/7 HVAC service near me",0,0.00,0
"24/7 HVAC service near me Rancho Mirage",0,0.00,0
"Rancho Mirage 24/7 HVAC service near me",0,0.00,0
"24/7 HVAC service near me La Quinta",0,0.00,0
"La Quinta 24/7 HVAC service near me",0,0.00,0
"24/7 HVAC service near me Cathedral City",0,0.00,0
"Cathedral City 24/7 HVAC service near me",0,0.00,0
"24/7 HVAC service near me Indio",0,0.00,0
"Indio 24/7 HVAC service near me",0,0.00,0
"24/7 HVAC service near me Coachella",0,0.00,0
"Coachella 24/7 HVAC service near me",0,0.00,0
"24/7 HVAC service near me Palm Springs",0,0.00,0
"Palm Springs 24/7 HVAC service near me",0,0.00,0
"24/7 HVAC service near me Thermal",0,0.00,0
"Thermal 24/7 HVAC service near me",0,0.00,0
"24/7 HVAC service near me Ribbonwood",0,0.00,0
"Ribbonwood 24/7 HVAC service near me",0,0.00,0
"24/7 HVAC service near me Pinyon Pines",0,0.00,0
"Pinyon Pines 24/7 HVAC service near me",0,0.00,0
"24/7 HVAC service near me Desert Hot Springs",0,0.00,0
"Desert Hot Springs 24/7 HVAC service near me",0,0.00,0
"24/7 HVAC service near me Garnet",0,0.00,0
"Garnet 24/7 HVAC service near me",0,0.00,0
"24/7 HVAC service near me North Palm Springs",0,0.00,0
"North Palm Springs 24/7 HVAC service near me",0,0.00,0
"24/7 HVAC service near me Mountain Center",0,0.00,0
"Mountain Center 24/7 HVAC service near me",0,0.00,0
"same day air conditioning repair Palm Desert",0,0.00,0
"Palm Desert same day air conditioning repair",0,0.00,0
"same day air conditioning repair Rancho Mirage",0,0.00,0
"Rancho Mirage same day air conditioning repair",0,0.00,0
"same day air conditioning repair La Quinta",0,0.00,0
"La Quinta same day air conditioning repair",0,0.00,0
"same day air conditioning repair Cathedral City",0,0.00,0
"Cathedral City same day air conditioning repair",0,0.00,0
"same day air conditioning repair Indio",0,0.00,0
"Indio same day air conditioning repair",0,0.00,0
"same day air conditioning repair Coachella",0,0.00,0
"Coachella same day air conditioning repair",0,0.00,0
"same day air conditioning repair Palm Springs",0,0.00,0
"Palm Springs same day air conditioning repair",0,0.00,0
"same day air conditioning repair Thermal",0,0.00,0
"Thermal same day air conditioning repair",0,0.00,0
"same day air conditioning repair Ribbonwood",0,0.00,0
"Ribbonwood same day air conditioning repair",0,0.00,0
"same day air conditioning repair Pinyon Pines",0,0.00,0
"Pinyon Pines same day air conditioning repair",0,0.00,0
"same day air conditioning repair Desert Hot Springs",0,0.00,0
"Desert Hot Springs same day air conditioning repair",0,0.00,0
"same day air conditioning repair Garnet",0,0.00,0
"Garnet same day air conditioning repair",0,0.00,0
"same day air conditioning repair North Palm Springs",0,0.00,0
"North Palm Springs same day air conditioning repair",0,0.00,0
"same day air conditioning repair Mountain Center",0,0.00,0
"Mountain Center same day air conditioning repair",0,0.00,0
"urgent furnace repair Palm Desert",0,0.00,0
"Palm Desert urgent furnace repair",0,0.00,0
"urgent furnace repair Rancho Mirage",0,0.00,0
"Rancho Mirage urgent furnace repair",0,0.00,0
"urgent furnace repair La Quinta",0,0.00,0
"La Quinta urgent furnace repair",0,0.00,0
"urgent furnace repair Cathedral City",0,0.00,0
"Cathedral City urgent furnace repair",0,0.00,0
"urgent furnace repair Indio",0,0.00,0
"Indio urgent furnace repair",0,0.00,0
"urgent furnace repair Coachella",0,0.00,0
"Coachella urgent furnace repair",0,0.00,0
"urgent furnace repair Palm Springs",0,0.00,0
"Palm Springs urgent furnace repair",0,0.00,0
"urgent furnace repair Thermal",0,0.00,0
"Thermal urgent furnace repair",0,0.00,0
"urgent furnace repair Ribbonwood",0,0.00,0
"Ribbonwood urgent furnace repair",0,0.00,0
"urgent furnace repair Pinyon Pines",0,0.00,0
"Pinyon Pines urgent furnace repair",0,0.00,0
"urgent furnace repair Desert Hot Springs",0,0.00,0
"Desert Hot Springs urgent furnace repair",0,0.00,0
"urgent furnace repair Garnet",0,0.00,0
"Garnet urgent furnace repair",0,0.00,0
"urgent furnace repair North Palm Springs",0,0.00,0
"North Palm Springs urgent furnace repair",0,0.00,0
"urgent furnace repair Mountain Center",0,0.00,0
"Mountain Center urgent furnace repair",0,0.00,0
"immediate AC service Palm Desert",0,0.00,0
"Palm Desert immediate AC service",0,0.00,0
"immediate AC service Rancho Mirage",0,0.00,0
"Rancho Mirage immediate AC service",0,0.00,0
"immediate AC service La Quinta",0,0.00,0
"La Quinta immediate AC service",0,0.00,0
"immediate AC service Cathedral City",0,0.00,0
"Cathedral City immediate AC service",0,0.00,0
"immediate AC service Indio",0,0.00,0
"Indio immediate AC service",0,0.00,0
"immediate AC service Coachella",0,0.00,0
"Coachella immediate AC service",0,0.00,0
"immediate AC service Palm Springs",0,0.00,0
"Palm Springs immediate AC service",0,0.00,0
"immediate AC service Thermal",0,0.00,0
"Thermal immediate AC service",0,0.00,0
"immediate AC service Ribbonwood",0,0.00,0
"Ribbonwood immediate AC service",0,0.00,0
"immediate AC service Pinyon Pines",0,0.00,0
"Pinyon Pines immediate AC service",0,0.00,0
"immediate AC service Desert Hot Springs",0,0.00,0
"Desert Hot Springs immediate AC service",0,0.00,0
"immediate AC service Garnet",0,0.00,0
"Garnet immediate AC service",0,0.00,0
"immediate AC service North Palm Springs",0,0.00,0
"North Palm Springs immediate AC service",0,0.00,0
"immediate AC service Mountain Center",0,0.00,0
"Mountain Center immediate AC service",0,0.00,0
"emergency HVAC contractor Palm Desert",0,0.00,0
"Palm Desert emergency HVAC contractor",0,0.00,0
"emergency HVAC contractor Rancho Mirage",0,0.00,0
"Rancho Mirage emergency HVAC contractor",0,0.00,0
"emergency HVAC contractor La Quinta",0,0.00,0
"La Quinta emergency HVAC contractor",0,0.00,0
"emergency HVAC contractor Cathedral City",0,0.00,0
"Cathedral City emergency HVAC contractor",0,0.00,0
"emergency HVAC contractor Indio",0,0.00,0
"Indio emergency HVAC contractor",0,0.00,0
"emergency HVAC contractor Coachella",0,0.00,0
"Coachella emergency HVAC contractor",0,0.00,0
"emergency HVAC contractor Palm Springs",0,0.00,0
"Palm Springs emergency HVAC contractor",0,0.00,0
"emergency HVAC contractor Thermal",0,0.00,0
"Thermal emergency HVAC contractor",0,0.00,0
"emergency HVAC contractor Ribbonwood",0,0.00,0
"Ribbonwood emergency HVAC contractor",0,0.00,0
"emergency HVAC contractor Pinyon Pines",0,0.00,0
"Pinyon Pines emergency HVAC contractor",0,0.00,0
"emergency HVAC contractor Desert Hot Springs",0,0.00,0
"Desert Hot Springs emergency HVAC contractor",0,0.00,0
"emergency HVAC contractor Garnet",0,0.00,0
"Garnet emergency HVAC contractor",0,0.00,0
"emergency HVAC contractor North Palm Springs",0,0.00,0
"North Palm Springs emergency HVAC contractor",0,0.00,0
"emergency HVAC contractor Mountain Center",0,0.00,0
"Mountain Center emergency HVAC contractor",0,0.00,0
"emergency HVAC repair near me Palm Desert",0,0.00,0
"Palm Desert emergency HVAC repair near me",0,0.00,0
"emergency HVAC repair near me Rancho Mirage",0,0.00,0
"Rancho Mirage emergency HVAC repair near me",0,0.00,0
"emergency HVAC repair near me La Quinta",0,0.00,0
"La Quinta emergency HVAC repair near me",0,0.00,0
"emergency HVAC repair near me Cathedral City",0,0.00,0
"Cathedral City emergency HVAC repair near me",0,0.00,0
"emergency HVAC repair near me Indio",0,0.00,0
"Indio emergency HVAC repair near me",0,0.00,0
"emergency HVAC repair near me Coachella",0,0.00,0
"Coachella emergency HVAC repair near me",0,0.00,0
"emergency HVAC repair near me Palm Springs",0,0.00,0
"Palm Springs emergency HVAC repair near me",0,0.00,0
"emergency HVAC repair near me Thermal",0,0.00,0
"Thermal emergency HVAC repair near me",0,0.00,0
"emergency HVAC repair near me Ribbonwood",0,0.00,0
"Ribbonwood emergency HVAC repair near me",0,0.00,0
"emergency HVAC repair near me Pinyon Pines",0,0.00,0
"Pinyon Pines emergency HVAC repair near me",0,0.00,0
"emergency HVAC repair near me Desert Hot Springs",0,0.00,0
"Desert Hot Springs emergency HVAC repair near me",0,0.00,0
"emergency HVAC repair near me Garnet",0,0.00,0
"Garnet emergency HVAC repair near me",0,0.00,0
"emergency HVAC repair near me North Palm Springs",0,0.00,0
"North Palm Springs emergency HVAC repair near me",0,0.00,0
"emergency HVAC repair near me Mountain Center",0,0.00,0
"Mountain Center emergency HVAC repair near me",0,0.00,0
"after hours furnace repair Palm Desert",0,0.00,0
"Palm Desert after hours furnace repair",0,0.00,0
"after hours furnace repair Rancho Mirage",0,0.00,0
"Rancho Mirage after hours furnace repair",0,0.00,0
"after hours furnace repair La Quinta",0,0.00,0
"La Quinta after hours furnace repair",0,0.00,0
"after hours furnace repair Cathedral City",0,0.00,0
"Cathedral City after hours furnace repair",0,0.00,0
"after hours furnace repair Indio",0,0.00,0
"Indio after hours furnace repair",0,0.00,0
"after hours furnace repair Coachella",0,0.00,0
"Coachella after hours furnace repair",0,0.00,0
"after hours furnace repair Palm Springs",0,0.00,0
"Palm Springs after hours furnace repair",0,0.00,0
"after hours furnace repair Thermal",0,0.00,0
"Thermal after hours furnace repair",0,0.00,0
"after hours furnace repair Ribbonwood",0,0.00,0
"Ribbonwood after hours furnace repair",0,0.00,0
"after hours furnace repair Pinyon Pines",0,0.00,0
"Pinyon Pines after hours furnace repair",0,0.00,0
"after hours furnace repair Desert Hot Springs",0,0.00,0
"Desert Hot Springs after hours furnace repair",0,0.00,0
"after hours furnace repair Garnet",0,0.00,0
"Garnet after hours furnace repair",0,0.00,0
"after hours furnace repair North Palm Springs",0,0.00,0
"North Palm Springs after hours furnace repair",0,0.00,0
"after hours furnace repair Mountain Center",0,0.00,0
"Mountain Center after hours furnace repair",0,0.00,0
"HVAC repair open now Palm Desert",0,0.00,0
"Palm Desert HVAC repair open now",0,0.00,0
"HVAC repair open now Rancho Mirage",0,0.00,0
"Rancho Mirage HVAC repair open now",0,0.00,0
"HVAC repair open now La Quinta",0,0.00,0
"La Quinta HVAC repair open now",0,0.00,0
"HVAC repair open now Cathedral City",0,0.00,0
"Cathedral City HVAC repair open now",0,0.00,0
"HVAC repair open now Indio",0,0.00,0
"Indio HVAC repair open now",0,0.00,0
"HVAC repair open now Coachella",0,0.00,0
"Coachella HVAC repair open now",0,0.00,0
"HVAC repair open now Palm Springs",0,0.00,0
"Palm Springs HVAC repair open now",0,0.00,0
"HVAC repair open now Thermal",0,0.00,0
"Thermal HVAC repair open now",0,0.00,0
"HVAC repair open now Ribbonwood",0,0.00,0
"Ribbonwood HVAC repair open now",0,0.00,0
"HVAC repair open now Pinyon Pines",0,0.00,0
"Pinyon Pines HVAC repair open now",0,0.00,0
"HVAC repair open now Desert Hot Springs",0,0.00,0
"Desert Hot Springs HVAC repair open now",0,0.00,0
"HVAC repair open now Garnet",0,0.00,0
"Garnet HVAC repair open now",0,0.00,0
"HVAC repair open now North Palm Springs",0,0.00,0
"North Palm Springs HVAC repair open now",0,0.00,0
"HVAC repair open now Mountain Center",0,0.00,0
"Mountain Center HVAC repair open now",0,0.00,0
"no heat emergency service Palm Desert",0,0.00,0
"Palm Desert no heat emergency service",0,0.00,0
"no heat emergency service Rancho Mirage",0,0.00,0
"Rancho Mirage no heat emergency service",0,0.00,0
"no heat emergency service La Quinta",0,0.00,0
"La Quinta no heat emergency service",0,0.00,0
"no heat emergency service Cathedral City",0,0.00,0
"Cathedral City no heat emergency service",0,0.00,0
"no heat emergency service Indio",0,0.00,0
"Indio no heat emergency service",0,0.00,0
"no heat emergency service Coachella",0,0.00,0
"Coachella no heat emergency service",0,0.00,0
"no heat emergency service Palm Springs",0,0.00,0
"Palm Springs no heat emergency service",0,0.00,0
"no heat emergency service Thermal",0,0.00,0
"Thermal no heat emergency service",0,0.00,0
"no heat emergency service Ribbonwood",0,0.00,0
"Ribbonwood no heat emergency service",0,0.00,0
"no heat emergency service Pinyon Pines",0,0.00,0
"Pinyon Pines no heat emergency service",0,0.00,0
"no heat emergency service Desert Hot Springs",0,0.00,0
"Desert Hot Springs no heat emergency service",0,0.00,0
"no heat emergency service Garnet",0,0.00,0
"Garnet no heat emergency service",0,0.00,0
"no heat emergency service North Palm Springs",0,0.00,0
"North Palm Springs no heat emergency service",0,0.00,0
"no heat emergency service Mountain Center",0,0.00,0
"Mountain Center no heat emergency service",0,0.00,0
"AC stopped working Palm Desert",0,0.00,0
"Palm Desert AC stopped working",0,0.00,0
"AC stopped working Rancho Mirage",0,0.00,0
"Rancho Mirage AC stopped working",0,0.00,0
"AC stopped working La Quinta",0,0.00,0
"La Quinta AC stopped working",0,0.00,0
"AC stopped working Cathedral City",0,0.00,0
"Cathedral City AC stopped working",0,0.00,0
"AC stopped working Indio",0,0.00,0
"Indio AC stopped working",0,0.00,0
"AC stopped working Coachella",0,0.00,0
"Coachella AC stopped working",0,0.00,0
"AC stopped working Palm Springs",0,0.00,0
"Palm Springs AC stopped working",0,0.00,0
"AC stopped working Thermal",0,0.00,0
"Thermal AC stopped working",0,0.00,0
"AC stopped working Ribbonwood",0,0.00,0
"Ribbonwood AC stopped working",0,0.00,0
"AC stopped working Pinyon Pines",0,0.00,0
"Pinyon Pines AC stopped working",0,0.00,0
"AC stopped working Desert Hot Springs",0,0.00,0
"Desert Hot Springs AC stopped working",0,0.00,0
"AC stopped working Garnet",0,0.00,0
"Garnet AC stopped working",0,0.00,0
"AC stopped working North Palm Springs",0,0.00,0
"North Palm Springs AC stopped working",0,0.00,0
"AC stopped working Mountain Center",0,0.00,0
"Mountain Center AC stopped working",0,0.00,0
"furnace repair during snowstorm Palm Desert",0,0.00,0
"Palm Desert furnace repair during snowstorm",0,0.00,0
"furnace repair during snowstorm Rancho Mirage",0,0.00,0
"Rancho Mirage furnace repair during snowstorm",0,0.00,0
"furnace repair during snowstorm La Quinta",0,0.00,0
"La Quinta furnace repair during snowstorm",0,0.00,0
"furnace repair during snowstorm Cathedral City",0,0.00,0
"Cathedral City furnace repair during snowstorm",0,0.00,0
"furnace repair during snowstorm Indio",0,0.00,0
"Indio furnace repair during snowstorm",0,0.00,0
"furnace repair during snowstorm Coachella",0,0.00,0
"Coachella furnace repair during snowstorm",0,0.00,0
"furnace repair during snowstorm Palm Springs",0,0.00,0
"Palm Springs furnace repair during snowstorm",0,0.00,0
"furnace repair during snowstorm Thermal",0,0.00,0
"Thermal furnace repair during snowstorm",0,0.00,0
"furnace repair during snowstorm Ribbonwood",0,0.00,0
"Ribbonwood furnace repair during snowstorm",0,0.00,0
"furnace repair during snowstorm Pinyon Pines",0,0.00,0
"Pinyon Pines furnace repair during snowstorm",0,0.00,0
"furnace repair during snowstorm Desert Hot Springs",0,0.00,0
"Desert Hot Springs furnace repair during snowstorm",0,0.00,0
"furnace repair during snowstorm Garnet",0,0.00,0
"Garnet furnace repair during snowstorm",0,0.00,0
"furnace repair during snowstorm North Palm Springs",0,0.00,0
"North Palm Springs furnace repair during snowstorm",0,0.00,0
"furnace repair during snowstorm Mountain Center",0,0.00,0
"Mountain Center furnace repair during snowstorm",0,0.00,0
"quick AC repair near me Palm Desert",0,0.00,0
"Palm Desert quick AC repair near me",0,0.00,0
"quick AC repair near me Rancho Mirage",0,0.00,0
"Rancho Mirage quick AC repair near me",0,0.00,0
"quick AC repair near me La Quinta",0,0.00,0
"La Quinta quick AC repair near me",0,0.00,0
"quick AC repair near me Cathedral City",0,0.00,0
"Cathedral City quick AC repair near me",0,0.00,0
"quick AC repair near me Indio",0,0.00,0
"Indio quick AC repair near me",0,0.00,0
"quick AC repair near me Coachella",0,0.00,0
"Coachella quick AC repair near me",0,0.00,0
"quick AC repair near me Palm Springs",0,0.00,0
"Palm Springs quick AC repair near me",0,0.00,0
"quick AC repair near me Thermal",0,0.00,0
"Thermal quick AC repair near me",0,0.00,0
"quick AC repair near me Ribbonwood",0,0.00,0
"Ribbonwood quick AC repair near me",0,0.00,0
"quick AC repair near me Pinyon Pines",0,0.00,0
"Pinyon Pines quick AC repair near me",0,0.00,0
"quick AC repair near me Desert Hot Springs",0,0.00,0
"Desert Hot Springs quick AC repair near me",0,0.00,0
"quick AC repair near me Garnet",0,0.00,0
"Garnet quick AC repair near me",0,0.00,0
"quick AC repair near me North Palm Springs",0,0.00,0
"North Palm Springs quick AC repair near me",0,0.00,0
"quick AC repair near me Mountain Center",0,0.00,0
"Mountain Center quick AC repair near me",0,0.00,0
"heating repair Palm Desert",0,0.00,0
"Palm Desert heating repair",0,0.00,0
"heating repair Rancho Mirage",0,0.00,0
"Rancho Mirage heating repair",0,0.00,0
"heating repair La Quinta",0,0.00,0
"La Quinta heating repair",0,0.00,0
"heating repair Cathedral City",0,0.00,0
"Cathedral City heating repair",0,0.00,0
"heating repair Indio",0,0.00,0
"Indio heating repair",0,0.00,0
"heating repair Coachella",0,0.00,0
"Coachella heating repair",0,0.00,0
"heating repair Palm Springs",0,0.00,0
"Palm Springs heating repair",0,0.00,0
"heating repair Thermal",0,0.00,0
"Thermal heating repair",0,0.00,0
"heating repair Ribbonwood",0,0.00,0
"Ribbonwood heating repair",0,0.00,0
"heating repair Pinyon Pines",0,0.00,0
"Pinyon Pines heating repair",0,0.00,0
"heating repair Desert Hot Springs",0,0.00,0
"Desert Hot Springs heating repair",0,0.00,0
"heating repair Garnet",0,0.00,0
"Garnet heating repair",0,0.00,0
"heating repair North Palm Springs",0,0.00,0
"North Palm Springs heating repair",0,0.00,0
"heating repair Mountain Center",0,0.00,0
"Mountain Center heating repair",0,0.00,0
"HVAC installation Palm Desert",0,0.00,0
"Palm Desert HVAC installation",0,0.00,0
"HVAC installation Rancho Mirage",0,0.00,0
"Rancho Mirage HVAC installation",0,0.00,0
"HVAC installation La Quinta",0,0.00,0
