Keyword,Search Volume,CPC ($),PPC Budget Cost ($/mo)
"Palm Desert after-hours hvac repair",0,0.00,0
"after-hours hvac repair Rancho Mirage",0,0.00,0
"Rancho Mirage after-hours hvac repair",0,0.00,0
"after-hours hvac repair La Quinta",0,0.00,0
"La Quinta after-hours hvac repair",0,0.00,0
"after-hours hvac repair Cathedral City",0,0.00,0
"Cathedral City after-hours hvac repair",0,0.00,0
"after-hours hvac repair Indio",0,0.00,0
"Indio after-hours hvac repair",0,0.00,0
"after-hours hvac repair Coachella",0,0.00,0
"Coachella after-hours hvac repair",0,0.00,0
"after-hours hvac repair Palm Springs",0,0.00,0
"Palm Springs after-hours hvac repair",0,0.00,0
"after-hours hvac repair Thermal",0,0.00,0
"Thermal after-hours hvac repair",0,0.00,0
"after-hours hvac repair Ribbonwood",0,0.00,0
"Ribbonwood after-hours hvac repair",0,0.00,0
"after-hours hvac repair Pinyon Pines",0,0.00,0
"Pinyon Pines after-hours hvac repair",0,0.00,0
"after-hours hvac repair Desert Hot Springs",0,0.00,0
"Desert Hot Springs after-hours hvac repair",0,0.00,0
"after-hours hvac repair Garnet",0,0.00,0
"Garnet after-hours hvac repair",0,0.00,0
"after-hours hvac repair North Palm Springs",0,0.00,0
"North Palm Springs after-hours hvac repair",0,0.00,0
"after-hours hvac repair Mountain Center",0,0.00,0
"Mountain Center after-hours hvac repair",0,0.00,0
"furnace installation Palm Desert",0,0.00,0
"Palm Desert furnace installation",0,0.00,0
"furnace installation Rancho Mirage",0,0.00,0
"Rancho Mirage furnace installation",0,0.00,0
"furnace installation La Quinta",0,0.00,0
"La Quinta furnace installation",0,0.00,0
"furnace installation Cathedral City",0,0.00,0
"Cathedral City furnace installation",0,0.00,0
"furnace installation Indio",0,0.00,0
"Indio furnace installation",0,0.00,0
"furnace installation Coachella",0,0.00,0
"Coachella furnace installation",0,0.00,0
"furnace installation Palm Springs",0,0.00,0
"Palm Springs furnace installation",0,0.00,0
"furnace installation Thermal",0,0.00,0
"Thermal furnace installation",0,0.00,0
"furnace installation Ribbonwood",0,0.00,0
"Ribbonwood furnace installation",0,0.00,0
"furnace installation Pinyon Pines",0,0.00,0
"Pinyon Pines furnace installation",0,0.00,0
"furnace installation Desert Hot Springs",0,0.00,0
"Desert Hot Springs furnace installation",0,0.00,0
"furnace installation Garnet",0,0.00,0
"Garnet furnace installation",0,0.00,0
"furnace installation North Palm Springs",0,0.00,0
"North Palm Springs furnace installation",0,0.00,0
"furnace installation Mountain Center",0,0.00,0
"Mountain Center furnace installation",0,0.00,0
"hvac system replacement Palm Desert",0,0.00,0
"Palm Desert hvac system replacement",0,0.00,0
"hvac system replacement Rancho Mirage",0,0.00,0
"Rancho Mirage hvac system replacement",0,0.00,0
"hvac system replacement La Quinta",0,0.00,0
"La Quinta hvac system replacement",0,0.00,0
"hvac system replacement Cathedral City",0,0.00,0
"Cathedral City hvac system replacement",0,0.00,0
"hvac system replacement Indio",0,0.00,0
"Indio hvac system replacement",0,0.00,0
"hvac system replacement Coachella",0,0.00,0
"Coachella hvac system replacement",0,0.00,0
"hvac system replacement Palm Springs",0,0.00,0
"Palm Springs hvac system replacement",0,0.00,0
"hvac system replacement Thermal",0,0.00,0
"Thermal hvac system replacement",0,0.00,0
"hvac system replacement Ribbonwood",0,0.00,0
"Ribbonwood hvac system replacement",0,0.00,0
"hvac system replacement Pinyon Pines",0,0.00,0
"Pinyon Pines hvac system replacement",0,0.00,0
"hvac system replacement Desert Hot Springs",0,0.00,0
"Desert Hot Springs hvac system replacement",0,0.00,0
"hvac system replacement Garnet",0,0.00,0
"Garnet hvac system replacement",0,0.00,0
"hvac system replacement North Palm Springs",0,0.00,0
"North Palm Springs hvac system replacement",0,0.00,0
"hvac system replacement Mountain Center",0,0.00,0
"Mountain Center hvac system replacement",0,0.00,0
"central air installation Palm Desert",0,0.00,0
"Palm Desert central air installation",0,0.00,0
"central air installation Rancho Mirage",0,0.00,0
"Rancho Mirage central air installation",0,0.00,0
"central air installation La Quinta",0,0.00,0
"La Quinta central air installation",0,0.00,0
"central air installation Cathedral City",0,0.00,0
"Cathedral City central air installation",0,0.00,0
"central air installation Indio",0,0.00,0
"Indio central air installation",0,0.00,0
"central air installation Coachella",0,0.00,0
"Coachella central air installation",0,0.00,0
"central air installation Palm Springs",0,0.00,0
"Palm Springs central air installation",0,0.00,0
"central air installation Thermal",0,0.00,0
"Thermal central air installation",0,0.00,0
"central air installation Ribbonwood",0,0.00,0
"Ribbonwood central air installation",0,0.00,0
"central air installation Pinyon Pines",0,0.00,0
"Pinyon Pines central air installation",0,0.00,0
"central air installation Desert Hot Springs",0,0.00,0
"Desert Hot Springs central air installation",0,0.00,0
"central air installation Garnet",0,0.00,0
"Garnet central air installation",0,0.00,0
"central air installation North Palm Springs",0,0.00,0
"North Palm Springs central air installation",0,0.00,0
"central air installation Mountain Center",0,0.00,0
"Mountain Center central air installation",0,0.00,0
"hvac maintenance Palm Desert",0,0.00,0
"Palm Desert hvac maintenance",0,0.00,0
"hvac maintenance Rancho Mirage",0,0.00,0
"Rancho Mirage hvac maintenance",0,0.00,0
"hvac maintenance La Quinta",0,0.00,0
"La Quinta hvac maintenance",0,0.00,0
"hvac maintenance Cathedral City",0,0.00,0
"Cathedral City hvac maintenance",0,0.00,0
"hvac maintenance Indio",0,0.00,0
"Indio hvac maintenance",0,0.00,0
"hvac maintenance Coachella",0,0.00,0
"Coachella hvac maintenance",0,0.00,0
"hvac maintenance Palm Springs",0,0.00,0
"Palm Springs hvac maintenance",0,0.00,0
"hvac maintenance Thermal",0,0.00,0
"Thermal hvac maintenance",0,0.00,0
"hvac maintenance Ribbonwood",0,0.00,0
"Ribbonwood hvac maintenance",0,0.00,0
"hvac maintenance Pinyon Pines",0,0.00,0
"Pinyon Pines hvac maintenance",0,0.00,0
"hvac maintenance Desert Hot Springs",0,0.00,0
"Desert Hot Springs hvac maintenance",0,0.00,0
"hvac maintenance Garnet",0,0.00,0
"Garnet hvac maintenance",0,0.00,0
"hvac maintenance North Palm Springs",0,0.00,0
"North Palm Springs hvac maintenance",0,0.00,0
"hvac maintenance Mountain Center",0,0.00,0
"Mountain Center hvac maintenance",0,0.00,0
"furnace maintenance Palm Desert",0,0.00,0
"Palm Desert furnace maintenance",0,0.00,0
"furnace maintenance Rancho Mirage",0,0.00,0
"Rancho Mirage furnace maintenance",0,0.00,0
"furnace maintenance La Quinta",0,0.00,0
"La Quinta furnace maintenance",0,0.00,0
"furnace maintenance Cathedral City",0,0.00,0
"Cathedral City furnace maintenance",0,0.00,0
"furnace maintenance Indio",0,0.00,0
"Indio furnace maintenance",0,0.00,0
"furnace maintenance Coachella",0,0.00,0
"Coachella furnace maintenance",0,0.00,0
"furnace maintenance Palm Springs",0,0.00,0
"Palm Springs furnace maintenance",0,0.00,0
"furnace maintenance Thermal",0,0.00,0
"Thermal furnace maintenance",0,0.00,0
"furnace maintenance Ribbonwood",0,0.00,0
"Ribbonwood furnace maintenance",0,0.00,0
"furnace maintenance Pinyon Pines",0,0.00,0
"Pinyon Pines furnace maintenance",0,0.00,0
"furnace maintenance Desert Hot Springs",0,0.00,0
"Desert Hot Springs furnace maintenance",0,0.00,0
"furnace maintenance Garnet",0,0.00,0
"Garnet furnace maintenance",0,0.00,0
"furnace maintenance North Palm Springs",0,0.00,0
"North Palm Springs furnace maintenance",0,0.00,0
"furnace maintenance Mountain Center",0,0.00,0
"Mountain Center furnace maintenance",0,0.00,0
"ac tune-up Palm Desert",0,0.00,0
"Palm Desert ac tune-up",0,0.00,0
"ac tune-up Rancho Mirage",0,0.00,0
"Rancho Mirage ac tune-up",0,0.00,0
"ac tune-up La Quinta",0,0.00,0
"La Quinta ac tune-up",0,0.00,0
"ac tune-up Cathedral City",0,0.00,0
"Cathedral City ac tune-up",0,0.00,0
"ac tune-up Indio",0,0.00,0
"Indio ac tune-up",0,0.00,0
"ac tune-up Coachella",0,0.00,0
"Coachella ac tune-up",0,0.00,0
"ac tune-up Palm Springs",0,0.00,0
"Palm Springs ac tune-up",0,0.00,0
"ac tune-up Thermal",0,0.00,0
"Thermal ac tune-up",0,0.00,0
"ac tune-up Ribbonwood",0,0.00,0
"Ribbonwood ac tune-up",0,0.00,0
"ac tune-up Pinyon Pines",0,0.00,0
"Pinyon Pines ac tune-up",0,0.00,0
"ac tune-up Desert Hot Springs",0,0.00,0
"Desert Hot Springs ac tune-up",0,0.00,0
"ac tune-up Garnet",0,0.00,0
"Garnet ac tune-up",0,0.00,0
"ac tune-up North Palm Springs",0,0.00,0
"North Palm Springs ac tune-up",0,0.00,0
"ac tune-up Mountain Center",0,0.00,0
"Mountain Center ac tune-up",0,0.00,0
"spring hvac maintenance Palm Desert",0,0.00,0
"Palm Desert spring hvac maintenance",0,0.00,0
"spring hvac maintenance Rancho Mirage",0,0.00,0
"Rancho Mirage spring hvac maintenance",0,0.00,0
"spring hvac maintenance La Quinta",0,0.00,0
"La Quinta spring hvac maintenance",0,0.00,0
"spring hvac maintenance Cathedral City",0,0.00,0
"Cathedral City spring hvac maintenance",0,0.00,0
"spring hvac maintenance Indio",0,0.00,0
"Indio spring hvac maintenance",0,0.00,0
"spring hvac maintenance Coachella",0,0.00,0
"Coachella spring hvac maintenance",0,0.00,0
"spring hvac maintenance Palm Springs",0,0.00,0
"Palm Springs spring hvac maintenance",0,0.00,0
"spring hvac maintenance Thermal",0,0.00,0
"Thermal spring hvac maintenance",0,0.00,0
"spring hvac maintenance Ribbonwood",0,0.00,0
"Ribbonwood spring hvac maintenance",0,0.00,0
"spring hvac maintenance Pinyon Pines",0,0.00,0
"Pinyon Pines spring hvac maintenance",0,0.00,0
"spring hvac maintenance Desert Hot Springs",0,0.00,0
"Desert Hot Springs spring hvac maintenance",0,0.00,0
"spring hvac maintenance Garnet",0,0.00,0
"Garnet spring hvac maintenance",0,0.00,0
"spring hvac maintenance North Palm Springs",0,0.00,0
"North Palm Springs spring hvac maintenance",0,0.00,0
"spring hvac maintenance Mountain Center",0,0.00,0
"Mountain Center spring hvac maintenance",0,0.00,0
"ac not cooling Palm Desert",0,0.00,0
"Palm Desert ac not cooling",0,0.00,0
"ac not cooling Rancho Mirage",0,0.00,0
"Rancho Mirage ac not cooling",0,0.00,0
"ac not cooling La Quinta",0,0.00,0
"La Quinta ac not cooling",0,0.00,0
"ac not cooling Cathedral City",0,0.00,0
"Cathedral City ac not cooling",0,0.00,0
"ac not cooling Indio",0,0.00,0
"Indio ac not cooling",0,0.00,0
"ac not cooling Coachella",0,0.00,0
"Coachella ac not cooling",0,0.00,0
"ac not cooling Palm Springs",0,0.00,0
"Palm Springs ac not cooling",0,0.00,0
"ac not cooling Thermal",0,0.00,0
"Thermal ac not cooling",0,0.00,0
"ac not cooling Ribbonwood",0,0.00,0
"Ribbonwood ac not cooling",0,0.00,0
"ac not cooling Pinyon Pines",0,0.00,0
"Pinyon Pines ac not cooling",0,0.00,0
"ac not cooling Desert Hot Springs",0,0.00,0
"Desert Hot Springs ac not cooling",0,0.00,0
"ac not cooling Garnet",0,0.00,0
"Garnet ac not cooling",0,0.00,0
"ac not cooling North Palm Springs",0,0.00,0
"North Palm Springs ac not cooling",0,0.00,0
"ac not cooling Mountain Center",0,0.00,0
"Mountain Center ac not cooling",0,0.00,0
"heater not working Palm Desert",0,0.00,0
"Palm Desert heater not working",0,0.00,0
"heater not working Rancho Mirage",0,0.00,0
"Rancho Mirage heater not working",0,0.00,0
"heater not working La Quinta",0,0.00,0
"La Quinta heater not working",0,0.00,0
"heater not working Cathedral City",0,0.00,0
"Cathedral City heater not working",0,0.00,0
"heater not working Indio",0,0.00,0
"Indio heater not working",0,0.00,0
"heater not working Coachella",0,0.00,0
"Coachella heater not working",0,0.00,0
"heater not working Palm Springs",0,0.00,0
"Palm Springs heater not working",0,0.00,0
"heater not working Thermal",0,0.00,0
"Thermal heater not working",0,0.00,0
"heater not working Ribbonwood",0,0.00,0
"Ribbonwood heater not working",0,0.00,0
"heater not working Pinyon Pines",0,0.00,0
"Pinyon Pines heater not working",0,0.00,0
"heater not working Desert Hot Springs",0,0.00,0
"Desert Hot Springs heater not working",0,0.00,0
"heater not working Garnet",0,0.00,0
"Garnet heater not working",0,0.00,0
"heater not working North Palm Springs",0,0.00,0
"North Palm Springs heater not working",0,0.00,0
"heater not working Mountain Center",0,0.00,0
"Mountain Center heater not working",0,0.00,0
"why is my ac blowing warm air Palm Desert",0,0.00,0
"Palm Desert why is my ac blowing warm air",0,0.00,0
"why is my ac blowing warm air Rancho Mirage",0,0.00,0
"Rancho Mirage why is my ac blowing warm air",0,0.00,0
"why is my ac blowing warm air La Quinta",0,0.00,0
"La Quinta why is my ac blowing warm air",0,0.00,0
"why is my ac blowing warm air Cathedral City",0,0.00,0
"Cathedral City why is my ac blowing warm air",0,0.00,0
"why is my ac blowing warm air Indio",0,0.00,0
"Indio why is my ac blowing warm air",0,0.00,0
"why is my ac blowing warm air Coachella",0,0.00,0
"Coachella why is my ac blowing warm air",0,0.00,0
"why is my ac blowing warm air Palm Springs",0,0.00,0
"Palm Springs why is my ac blowing warm air",0,0.00,0
"why is my ac blowing warm air Thermal",0,0.00,0
"Thermal why is my ac blowing warm air",0,0.00,0
"why is my ac blowing warm air Ribbonwood",0,0.00,0
"Ribbonwood why is my ac blowing warm air",0,0.00,0
"why is my ac blowing warm air Pinyon Pines",0,0.00,0
"Pinyon Pines why is my ac blowing warm air",0,0.00,0
"why is my ac blowing warm air Desert Hot Springs",0,0.00,0
"Desert Hot Springs why is my ac blowing warm air",0,0.00,0
"why is my ac blowing warm air Garnet",0,0.00,0
"Garnet why is my ac blowing warm air",0,0.00,0
"why is my ac blowing warm air North Palm Springs",0,0.00,0
"North Palm Springs why is my ac blowing warm air",0,0.00,0
"why is my ac blowing warm air Mountain Center",0,0.00,0
"Mountain Center why is my ac blowing warm air",0,0.00,0
"HVAC repair Palm Desert",0,0.00,0
"Palm Desert HVAC repair",0,0.00,0
"HVAC repair Rancho Mirage",0,0.00,0
"Rancho Mirage HVAC repair",0,0.00,0
"HVAC repair La Quinta",0,0.00,0
"La Quinta HVAC repair",0,0.00,0
"HVAC repair Cathedral City",0,0.00,0
"Cathedral City HVAC repair",0,0.00,0
"HVAC repair Indio",0,0.00,0
"Indio HVAC repair",0,0.00,0
"HVAC repair Coachella",0,0.00,0
"Coachella HVAC repair",0,0.00,0
"HVAC repair Palm Springs",0,0.00,0
"Palm Springs HVAC repair",0,0.00,0
"HVAC repair Thermal",0,0.00,0
"Thermal HVAC repair",0,0.00,0
"HVAC repair Ribbonwood",0,0.00,0
"Ribbonwood HVAC repair",0,0.00,0
"HVAC repair Pinyon Pines",0,0.00,0
"Pinyon Pines HVAC repair",0,0.00,0
"HVAC repair Desert Hot Springs",0,0.00,0
"Desert Hot Springs HVAC repair",0,0.00,0
"HVAC repair Garnet",0,0.00,0
"Garnet HVAC repair",0,0.00,0
"HVAC repair North Palm Springs",0,0.00,0
"North Palm Springs HVAC repair",0,0.00,0
"HVAC repair Mountain Center",0,0.00,0
"Mountain Center HVAC repair",0,0.00,0
"ac repair Palm Desert",0,0.00,0
"Palm Desert ac repair",0,0.00,0
"ac repair Rancho Mirage",0,0.00,0
"Rancho Mirage ac repair",0,0.00,0
"ac repair La Quinta",0,0.00,0
"La Quinta ac repair",0,0.00,0
"ac repair Cathedral City",0,0.00,0
"Cathedral City ac repair",0,0.00,0
"ac repair Indio",0,0.00,0
"Indio ac repair",0,0.00,0
"ac repair Coachella",0,0.00,0
"Coachella ac repair",0,0.00,0
"ac repair Palm Springs",0,0.00,0
"Palm Springs ac repair",0,0.00,0
"ac repair Thermal",0,0.00,0
"Thermal ac repair",0,0.00,0
"ac repair Ribbonwood",0,0.00,0
"Ribbonwood ac repair",0,0.00,0
"ac repair Pinyon Pines",0,0.00,0
"Pinyon Pines ac repair",0,0.00,0
"ac repair Desert Hot Springs",0,0.00,0
"Desert Hot Springs ac repair",0,0.00,0
"ac repair Garnet",0,0.00,0
"Garnet ac repair",0,0.00,0
"ac repair North Palm Springs",0,0.00,0
"North Palm Springs ac repair",0,0.00,0
"ac repair Mountain Center",0,0.00,0
"Mountain Center ac repair",0,0.00,0
"air conditioner service Palm Desert",0,0.00,0
"Palm Desert air conditioner service",0,0.00,0
"air conditioner service Rancho Mirage",0,0.00,0
"Rancho Mirage air conditioner service",0,0.00,0
"air conditioner service La Quinta",0,0.00,0
"La Quinta air conditioner service",0,0.00,0
"air conditioner service Cathedral City",0,0.00,0
"Cathedral City air conditioner service",0,0.00,0
"air conditioner service Indio",0,0.00,0
"Indio air conditioner service",0,0.00,0
"air conditioner service Coachella",0,0.00,0
"Coachella air conditioner service",0,0.00,0
"air conditioner service Palm Springs",0,0.00,0
"Palm Springs air conditioner service",0,0.00,0
"air conditioner service Thermal",0,0.00,0
"Thermal air conditioner service",0,0.00,0
"air conditioner service Ribbonwood",0,0.00,0
"Ribbonwood air conditioner service",0,0.00,0
"air conditioner service Pinyon Pines",0,0.00,0
"Pinyon Pines air conditioner service",0,0.00,0
"air conditioner service Desert Hot Springs",0,0.00,0
"Desert Hot Springs air conditioner service",0,0.00,0
"air conditioner service Garnet",0,0.00,0
"Garnet air conditioner service",0,0.00,0
"air conditioner service North Palm Springs",0,0.00,0
"North Palm Springs air conditioner service",0,0.00,0
"air conditioner service Mountain Center",0,0.00,0
"Mountain Center air conditioner service",0,0.00,0
"air conditioner repair Palm Desert",0,0.00,0
"Palm Desert air conditioner repair",0,0.00,0
"air conditioner repair Rancho Mirage",0,0.00,0
"Rancho Mirage air conditioner repair",0,0.00,0
"air conditioner repair La Quinta",0,0.00,0
"La Quinta air conditioner repair",0,0.00,0
"air conditioner repair Cathedral City",0,0.00,0
"Cathedral City air conditioner repair",0,0.00,0
"air conditioner repair Indio",0,0.00,0
"Indio air conditioner repair",0,0.00,0
"air conditioner repair Coachella",0,0.00,0
"Coachella air conditioner repair",0,0.00,0
"air conditioner repair Palm Springs",0,0.00,0
"Palm Springs air conditioner repair",0,0.00,0
"air conditioner repair Thermal",0,0.00,0
"Thermal air conditioner repair",0,0.00,0
"air conditioner repair Ribbonwood",0,0.00,0
"Ribbonwood air conditioner repair",0,0.00,0
"air conditioner repair Pinyon Pines",0,0.00,0
"Pinyon Pines air conditioner repair",0,0.00,0
"air conditioner repair Desert Hot Springs",0,0.00,0
"Desert Hot Springs air conditioner repair",0,0.00,0
"air conditioner repair Garnet",0,0.00,0
"Garnet air conditioner repair",0,0.00,0
"air conditioner repair North Palm Springs",0,0.00,0
"North Palm Springs air conditioner repair",0,0.00,0
"air conditioner repair Mountain Center",0,0.00,0
"Mountain Center air conditioner repair",0,0.00,0
"duct cleaning Palm Desert",0,0.00,0
"Palm Desert duct cleaning",0,0.00,0
"duct cleaning Rancho Mirage",0,0.00,0
"Rancho Mirage duct cleaning",0,0.00,0
"duct cleaning La Quinta",0,0.00,0
"La Quinta duct cleaning",0,0.00,0
"duct cleaning Cathedral City",0,0.00,0
"Cathedral City duct cleaning",0,0.00,0
"duct cleaning Indio",0,0.00,0
"Indio duct cleaning",0,0.00,0
"duct cleaning Coachella",0,0.00,0
"Coachella duct cleaning",0,0.00,0
"duct cleaning Palm Springs",0,0.00,0
"Palm Springs duct cleaning",0,0.00,0
"duct cleaning Thermal",0,0.00,0
"Thermal duct cleaning",0,0.00,0
"duct cleaning Ribbonwood",0,0.00,0
"Ribbonwood duct cleaning",0,0.00,0
"duct cleaning Pinyon Pines",0,0.00,0
"Pinyon Pines duct cleaning",0,0.00,0
"duct cleaning Desert Hot Springs",0,0.00,0
"Desert Hot Springs duct cleaning",0,0.00,0
"duct cleaning Garnet",0,0.00,0
"Garnet duct cleaning",0,0.00,0
"duct cleaning North Palm Springs",0,0.00,0
"North Palm Springs duct cleaning",0,0.00,0
"duct cleaning Mountain Center",0,0.00,0
"Mountain Center duct cleaning",0,0.00,0
"furnace repair Palm Desert",0,0.00,0
"Palm Desert furnace repair",0,0.00,0
"furnace repair Rancho Mirage",0,0.00,0
"Rancho Mirage furnace repair",0,0.00,0
"furnace repair La Quinta",0,0.00,0
"La Quinta furnace repair",0,0.00,0
"furnace repair Cathedral City",0,0.00,0
"Cathedral City furnace repair",0,0.00,0
"furnace repair Indio",0,0.00,0
"Indio furnace repair",0,0.00,0
"furnace repair Coachella",0,0.00,0
"Coachella furnace repair",0,0.00,0
"furnace repair Palm Springs",0,0.00,0
"Palm Springs furnace repair",0,0.00,0
"furnace repair Thermal",0,0.00,0
"Thermal furnace repair",0,0.00,0
"furnace repair Ribbonwood",0,0.00,0
"Ribbonwood furnace repair",0,0.00,0
"furnace repair Pinyon Pines",0,0.00,0
"Pinyon Pines furnace repair",0,0.00,0
"furnace repair Desert Hot Springs",0,0.00,0
"Desert Hot Springs furnace repair",0,0.00,0
"furnace repair Garnet",0,0.00,0
"Garnet furnace repair",0,0.00,0
"furnace repair North Palm Springs",0,0.00,0
"North Palm Springs furnace repair",0,0.00,0
"furnace repair Mountain Center",0,0.00,0
"Mountain Center furnace repair",0,0.00,0
"emergency HVAC services Palm Desert",0,0.00,0
"Palm Desert emergency HVAC services",0,0.00,0
"emergency HVAC services Rancho Mirage",0,0.00,0
"Rancho Mirage emergency HVAC services",0,0.00,0
"emergency HVAC services La Quinta",0,0.00,0
"La Quinta emergency HVAC services",0,0.00,0
"emergency HVAC services Cathedral City",0,0.00,0
"Cathedral City emergency HVAC services",0,0.00,0
"emergency HVAC services Indio",0,0.00,0
"Indio emergency HVAC services",0,0.00,0
"emergency HVAC services Coachella",0,0.00,0
"Coachella emergency HVAC services",0,0.00,0
"emergency HVAC services Palm Springs",0,0.00,0
"Palm Springs emergency HVAC services",0,0.00,0
"emergency HVAC services Thermal",0,0.00,0
"Thermal emergency HVAC services",0,0.00,0
"emergency HVAC services Ribbonwood",0,0.00,0
"Ribbonwood emergency HVAC services",0,0.00,0
"emergency HVAC services Pinyon Pines",0,0.00,0
"Pinyon Pines emergency HVAC services",0,0.00,0
"emergency HVAC services Desert Hot Springs",0,0.00,0
"Desert Hot Springs emergency HVAC services",0,0.00,0
"emergency HVAC services Garnet",0,0.00,0
"Garnet emergency HVAC services",0,0.00,0
"emergency HVAC services North Palm Springs",0,0.00,0
"North Palm Springs emergency HVAC services",0,0.00,0
"emergency HVAC services Mountain Center",0,0.00,0
"Mountain Center emergency HVAC services",0,0.00,0
"emergency AC repair Palm Desert",0,0.00,0
"Palm Desert emergency AC repair",0,0.00,0
"emergency AC repair Rancho Mirage",0,0.00,0
"Rancho Mirage emergency AC repair",0,0.00,0
"emergency AC repair La Quinta",0,0.00,0
"La Quinta emergency AC repair",0,0.00,0
"emergency AC repair Cathedral City",0,0.00,0
"Cathedral City emergency AC repair",0,0.00,0
"emergency AC repair Indio",0,0.00,0
"Indio emergency AC repair",0,0.00,0
"emergency AC repair Coachella",0,0.00,0
"Coachella emergency AC repair",0,0.00,0
"emergency AC repair Palm Springs",0,0.00,0
"Palm Springs emergency AC repair",0,0.00,0
"emergency AC repair Thermal",0,0.00,0
"Thermal emergency AC repair",0,0.00,0
"emergency AC repair Ribbonwood",0,0.00,0
"Ribbonwood emergency AC repair",0,0.00,0
"emergency AC repair Pinyon Pines",0,0.00,0
"Pinyon Pines emergency AC repair",0,0.00,0
"emergency AC repair Desert Hot Springs",0,0.00,0
"Desert Hot Springs emergency AC repair",0,0.00,0
"emergency AC repair Garnet",0,0.00,0
"Garnet emergency AC repair",0,0.00,0
"emergency AC repair North Palm Springs",0,0.00,0
"North Palm Springs emergency AC repair",0,0.00,0
"emergency AC repair Mountain Center",0,0.00,0
"Mountain Center emergency AC repair",0,0.00,0
"emergency heating repair Palm Desert",0,0.00,0
"Palm Desert emergency heating repair",0,0.00,0
"emergency heating repair Rancho Mirage",0,0.00,0
"Rancho Mirage emergency heating repair",0,0.00,0
"emergency heating repair La Quinta",0,0.00,0
"La Quinta emergency heating repair",0,0.00,0
"emergency heating repair Cathedral City",0,0.00,0
"Cathedral City emergency heating repair",0,0.00,0
"emergency heating repair Indio",0,0.00,0
"Indio emergency heating repair",0,0.00,0
"emergency heating repair Coachella",0,0.00,0
"Coachella emergency heating repair",0,0.00,0
"emergency heating repair Palm Springs",0,0.00,0
"Palm Springs emergency heating repair",0,0.00,0
"emergency heating repair Thermal",0,0.00,0
"Thermal emergency heating repair",0,0.00,0
"emergency heating repair Ribbonwood",0,0.00,0
"Ribbonwood emergency heating repair",0,0.00,0
"emergency heating repair Pinyon Pines",0,0.00,0
"Pinyon Pines emergency heating repair",0,0.00,0
"emergency heating repair Desert Hot Springs",0,0.00,0
"Desert Hot Springs emergency heating repair",0,0.00,0
"emergency heating repair Garnet",0,0.00,0
"Garnet emergency heating repair",0,0.00,0
"emergency heating repair North Palm Springs",0,0.00,0
"North Palm Springs emergency heating repair",0,0.00,0
"emergency heating repair Mountain Center",0,0.00,0
"Mountain Center emergency heating repair",0,0.00,0
"emergency air conditioning repair Palm Desert",0,0.00,0
"Palm Desert emergency air conditioning repair",0,0.00,0
"emergency air conditioning repair Rancho Mirage",0,0.00,0
"Rancho Mirage emergency air conditioning repair",0,0.00,0
"emergency air conditioning repair La Quinta",0,0.00,0
"La Quinta emergency air conditioning repair",0,0.00,0
"emergency air conditioning repair Cathedral City",0,0.00,0
"Cathedral City emergency air conditioning repair",0,0.00,0
"emergency air conditioning repair Indio",0,0.00,0
"Indio emergency air conditioning repair",0,0.00,0
"emergency air conditioning repair Coachella",0,0.00,0
"Coachella emergency air conditioning repair",0,0.00,0
"emergency air conditioning repair Palm Springs",0,0.00,0
"Palm Springs emergency air conditioning repair",0,0.00,0
"emergency air conditioning repair Thermal",0,0.00,0
"Thermal emergency air conditioning repair",0,0.00,0
"emergency air conditioning repair Ribbonwood",0,0.00,0
"Ribbonwood emergency air conditioning repair",0,0.00,0
"emergency air conditioning repair Pinyon Pines",0,0.00,0
"Pinyon Pines emergency air conditioning repair",0,0.00,0
"emergency air conditioning repair Desert Hot Springs",0,0.00,0
"Desert Hot Springs emergency air conditioning repair",0,0.00,0
"emergency air conditioning repair Garnet",0,0.00,0
"Garnet emergency air conditioning repair",0,0.00,0
"emergency air conditioning repair North Palm Springs",0,0.00,0
"North Palm Springs emergency air conditioning repair",0,0.00,0
"emergency air conditioning repair Mountain Center",0,0.00,0
"Mountain Center emergency air conditioning repair",0,0.00,0
"same day AC repair Palm Desert",0,0.00,0
"Palm Desert same day AC repair",0,0.00,0
"same day AC repair Rancho Mirage",0,0.00,0
"Rancho Mirage same day AC repair",0,0.00,0
