Keyword,Search Volume,CPC ($),PPC Budget Cost ($/mo)
"same day AC repair La Quinta",0,0.00,0
"La Quinta same day AC repair",0,0.00,0
"same day AC repair Cathedral City",0,0.00,0
"Cathedral City same day AC repair",0,0.00,0
"same day AC repair Indio",0,0.00,0
"Indio same day AC repair",0,0.00,0
"same day AC repair Coachella",0,0.00,0
"Coachella same day AC repair",0,0.00,0
"same day AC repair Palm Springs",0,0.00,0
"Palm Springs same day AC repair",0,0.00,0
"same day AC repair Thermal",0,0.00,0
"Thermal same day AC repair",0,0.00,0
"same day AC repair Ribbonwood",0,0.00,0
"Ribbonwood same day AC repair",0,0.00,0
"same day AC repair Pinyon Pines",0,0.00,0
"Pinyon Pines same day AC repair",0,0.00,0
"same day AC repair Desert Hot Springs",0,0.00,0
"Desert Hot Springs same day AC repair",0,0.00,0
"same day AC repair Garnet",0,0.00,0
"Garnet same day AC repair",0,0.00,0
"same day AC repair North Palm Springs",0,0.00,0
"North Palm Springs same day AC repair",0,0.00,0
"same day AC repair Mountain Center",0,0.00,0
"Mountain Center same day AC repair",0,0.00,0
"24/7 HVAC service Palm Desert",0,0.00,0
"Palm Desert 24/7 HVAC service",0,0.00,0
"24/7 HVAC service Rancho Mirage",0,0.00,0
"Rancho Mirage 24/7 HVAC service",0,0.00,0
"24/7 HVAC service La Quinta",0,0.00,0
"La Quinta 24/7 HVAC service",0,0.00,0
"24/7 HVAC service Cathedral City",0,0.00,0
"Cathedral City 24/7 HVAC service",0,0.00,0
"24/7 HVAC service Indio",0,0.00,0
"Indio 24/7 HVAC service",0,0.00,0
"24/7 HVAC service Coachella",0,0.00,0
"Coachella 24/7 HVAC service",0,0.00,0
"24/7 HVAC service Palm Springs",0,0.00,0
"Palm Springs 24/7 HVAC service",0,0.00,0
"24/7 HVAC service Thermal",0,0.00,0
"Thermal 24/7 HVAC service",0,0.00,0
"24/7 HVAC service Ribbonwood",0,0.00,0
"Ribbonwood 24/7 HVAC service",0,0.00,0
"24/7 HVAC service Pinyon Pines",0,0.00,0
"Pinyon Pines 24/7 HVAC service",0,0.00,0
"24/7 HVAC service Desert Hot Springs",0,0.00,0
"Desert Hot Springs 24/7 HVAC service",0,0.00,0
"24/7 HVAC service Garnet",0,0.00,0
"Garnet 24/7 HVAC service",0,0.00,0
"24/7 HVAC service North Palm Springs",0,0.00,0
"North Palm Springs 24/7 HVAC service",0,0.00,0
"24/7 HVAC service Mountain Center",0,0.00,0
"Mountain Center 24/7 HVAC service",0,0.00,0
"24-hour emergency HVAC service Palm Desert",0,0.00,0
"Palm Desert 24-hour emergency HVAC service",0,0.00,0
"24-hour emergency HVAC service Rancho Mirage",0,0.00,0
"Rancho Mirage 24-hour emergency HVAC service",0,0.00,0
"24-hour emergency HVAC service La Quinta",0,0.00,0
"La Quinta 24-hour emergency HVAC service",0,0.00,0
"24-hour emergency HVAC service Cathedral City",0,0.00,0
"Cathedral City 24-hour emergency HVAC service",0,0.00,0
"24-hour emergency HVAC service Indio",0,0.00,0
"Indio 24-hour emergency HVAC service",0,0.00,0
"24-hour emergency HVAC service Coachella",0,0.00,0
"Coachella 24-hour emergency HVAC service",0,0.00,0
"24-hour emergency HVAC service Palm Springs",0,0.00,0
"Palm Springs 24-hour emergency HVAC service",0,0.00,0
"24-hour emergency HVAC service Thermal",0,0.00,0
"Thermal 24-hour emergency HVAC service",0,0.00,0
"24-hour emergency HVAC service Ribbonwood",0,0.00,0
"Ribbonwood 24-hour emergency HVAC service",0,0.00,0
"24-hour emergency HVAC service Pinyon Pines",0,0.00,0
"Pinyon Pines 24-hour emergency HVAC service",0,0.00,0
"24-hour emergency HVAC service Desert Hot Springs",0,0.00,0
"Desert Hot Springs 24-hour emergency HVAC service",0,0.00,0
"24-hour emergency HVAC service Garnet",0,0.00,0
"Garnet 24-hour emergency HVAC service",0,0.00,0
"24-hour emergency HVAC service North Palm Springs",0,0.00,0
"North Palm Springs 24-hour emergency HVAC service",0,0.00,0
"24-hour emergency HVAC service Mountain Center",0,0.00,0
"Mountain Center 24-hour emergency HVAC service",0,0.00,0
"urgent HVAC repair Palm Desert",0,0.00,0
"Palm Desert urgent HVAC repair",0,0.00,0
"urgent HVAC repair Rancho Mirage",0,0.00,0
"Rancho Mirage urgent HVAC repair",0,0.00,0
"urgent HVAC repair La Quinta",0,0.00,0
"La Quinta urgent HVAC repair",0,0.00,0
"urgent HVAC repair Cathedral City",0,0.00,0
"Cathedral City urgent HVAC repair",0,0.00,0
"urgent HVAC repair Indio",0,0.00,0
"Indio urgent HVAC repair",0,0.00,0
"urgent HVAC repair Coachella",0,0.00,0
"Coachella urgent HVAC repair",0,0.00,0
"urgent HVAC repair Palm Springs",0,0.00,0
"Palm Springs urgent HVAC repair",0,0.00,0
"urgent HVAC repair Thermal",0,0.00,0
"Thermal urgent HVAC repair",0,0.00,0
"urgent HVAC repair Ribbonwood",0,0.00,0
"Ribbonwood urgent HVAC repair",0,0.00,0
"urgent HVAC repair Pinyon Pines",0,0.00,0
"Pinyon Pines urgent HVAC repair",0,0.00,0
"urgent HVAC repair Desert Hot Springs",0,0.00,0
"Desert Hot Springs urgent HVAC repair",0,0.00,0
"urgent HVAC repair Garnet",0,0.00,0
"Garnet urgent HVAC repair",0,0.00,0
"urgent HVAC repair North Palm Springs",0,0.00,0
"North Palm Springs urgent HVAC repair",0,0.00,0
"urgent HVAC repair Mountain Center",0,0.00,0
"Mountain Center urgent HVAC repair",0,0.00,0
"after-hours furnace repair Palm Desert",0,0.00,0
"Palm Desert after-hours furnace repair",0,0.00,0
"after-hours furnace repair Rancho Mirage",0,0.00,0
"Rancho Mirage after-hours furnace repair",0,0.00,0
"after-hours furnace repair La Quinta",0,0.00,0
"La Quinta after-hours furnace repair",0,0.00,0
"after-hours furnace repair Cathedral City",0,0.00,0
"Cathedral City after-hours furnace repair",0,0.00,0
"after-hours furnace repair Indio",0,0.00,0
"Indio after-hours furnace repair",0,0.00,0
"after-hours furnace repair Coachella",0,0.00,0
"Coachella after-hours furnace repair",0,0.00,0
"after-hours furnace repair Palm Springs",0,0.00,0
"Palm Springs after-hours furnace repair",0,0.00,0
"after-hours furnace repair Thermal",0,0.00,0
"Thermal after-hours furnace repair",0,0.00,0
"after-hours furnace repair Ribbonwood",0,0.00,0
"Ribbonwood after-hours furnace repair",0,0.00,0
"after-hours furnace repair Pinyon Pines",0,0.00,0
"Pinyon Pines after-hours furnace repair",0,0.00,0
"after-hours furnace repair Desert Hot Springs",0,0.00,0
"Desert Hot Springs after-hours furnace repair",0,0.00,0
"after-hours furnace repair Garnet",0,0.00,0
"Garnet after-hours furnace repair",0,0.00,0
"after-hours furnace repair North Palm Springs",0,0.00,0
"North Palm Springs after-hours furnace repair",0,0.00,0
"after-hours furnace repair Mountain Center",0,0.00,0
"Mountain Center after-hours furnace repair",0,0.00,0
"Immediate air conditioner fix Palm Desert",0,0.00,0
"Palm Desert Immediate air conditioner fix",0,0.00,0
"Immediate air conditioner fix Rancho Mirage",0,0.00,0
"Rancho Mirage Immediate air conditioner fix",0,0.00,0
"Immediate air conditioner fix La Quinta",0,0.00,0
"La Quinta Immediate air conditioner fix",0,0.00,0
"Immediate air conditioner fix Cathedral City",0,0.00,0
"Cathedral City Immediate air conditioner fix",0,0.00,0
"Immediate air conditioner fix Indio",0,0.00,0
"Indio Immediate air conditioner fix",0,0.00,0
"Immediate air conditioner fix Coachella",0,0.00,0
"Coachella Immediate air conditioner fix",0,0.00,0
"Immediate air conditioner fix Palm Springs",0,0.00,0
"Palm Springs Immediate air conditioner fix",0,0.00,0
"Immediate air conditioner fix Thermal",0,0.00,0
"Thermal Immediate air conditioner fix",0,0.00,0
"Immediate air conditioner fix Ribbonwood",0,0.00,0
"Ribbonwood Immediate air conditioner fix",0,0.00,0
"Immediate air conditioner fix Pinyon Pines",0,0.00,0
"Pinyon Pines Immediate air conditioner fix",0,0.00,0
"Immediate air conditioner fix Desert Hot Springs",0,0.00,0
"Desert Hot Springs Immediate air conditioner fix",0,0.00,0
"Immediate air conditioner fix Garnet",0,0.00,0
"Garnet Immediate air conditioner fix",0,0.00,0
"Immediate air conditioner fix North Palm Springs",0,0.00,0
"North Palm Springs Immediate air conditioner fix",0,0.00,0
"Immediate air conditioner fix Mountain Center",0,0.00,0
"Mountain Center Immediate air conditioner fix",0,0.00,0
"fast HVAC service Palm Desert",0,0.00,0
"Palm Desert fast HVAC service",0,0.00,0
"fast HVAC service Rancho Mirage",0,0.00,0
"Rancho Mirage fast HVAC service",0,0.00,0
"fast HVAC service La Quinta",0,0.00,0
"La Quinta fast HVAC service",0,0.00,0
"fast HVAC service Cathedral City",0,0.00,0
"Cathedral City fast HVAC service",0,0.00,0
"fast HVAC service Indio",0,0.00,0
"Indio fast HVAC service",0,0.00,0
"fast HVAC service Coachella",0,0.00,0
"Coachella fast HVAC service",0,0.00,0
"fast HVAC service Palm Springs",0,0.00,0
"Palm Springs fast HVAC service",0,0.00,0
"fast HVAC service Thermal",0,0.00,0
"Thermal fast HVAC service",0,0.00,0
"fast HVAC service Ribbonwood",0,0.00,0
"Ribbonwood fast HVAC service",0,0.00,0
"fast HVAC service Pinyon Pines",0,0.00,0
"Pinyon Pines fast HVAC service",0,0.00,0
"fast HVAC service Desert Hot Springs",0,0.00,0
"Desert Hot Springs fast HVAC service",0,0.00,0
"fast HVAC service Garnet",0,0.00,0
"Garnet fast HVAC service",0,0.00,0
"fast HVAC service North Palm Springs",0,0.00,0
"North Palm Springs fast HVAC service",0,0.00,0
"fast HVAC service Mountain Center",0,0.00,0
"Mountain Center fast HVAC service",0,0.00,0
"weekend furnace repair Palm Desert",0,0.00,0
"Palm Desert weekend furnace repair",0,0.00,0
"weekend furnace repair Rancho Mirage",0,0.00,0
"Rancho Mirage weekend furnace repair",0,0.00,0
"weekend furnace repair La Quinta",0,0.00,0
"La Quinta weekend furnace repair",0,0.00,0
"weekend furnace repair Cathedral City",0,0.00,0
"Cathedral City weekend furnace repair",0,0.00,0
"weekend furnace repair Indio",0,0.00,0
"Indio weekend furnace repair",0,0.00,0
"weekend furnace repair Coachella",0,0.00,0
"Coachella weekend furnace repair",0,0.00,0
"weekend furnace repair Palm Springs",0,0.00,0
"Palm Springs weekend furnace repair",0,0.00,0
"weekend furnace repair Thermal",0,0.00,0
"Thermal weekend furnace repair",0,0.00,0
"weekend furnace repair Ribbonwood",0,0.00,0
"Ribbonwood weekend furnace repair",0,0.00,0
"weekend furnace repair Pinyon Pines",0,0.00,0
"Pinyon Pines weekend furnace repair",0,0.00,0
"weekend furnace repair Desert Hot Springs",0,0.00,0
"Desert Hot Springs weekend furnace repair",0,0.00,0
"weekend furnace repair Garnet",0,0.00,0
"Garnet weekend furnace repair",0,0.00,0
"weekend furnace repair North Palm Springs",0,0.00,0
"North Palm Springs weekend furnace repair",0,0.00,0
"weekend furnace repair Mountain Center",0,0.00,0
"Mountain Center weekend furnace repair",0,0.00,0
"emergency HVAC near me Palm Desert",0,0.00,0
"Palm Desert emergency HVAC near me",0,0.00,0
"emergency HVAC near me Rancho Mirage",0,0.00,0
"Rancho Mirage emergency HVAC near me",0,0.00,0
"emergency HVAC near me La Quinta",0,0.00,0
"La Quinta emergency HVAC near me",0,0.00,0
"emergency HVAC near me Cathedral City",0,0.00,0
"Cathedral City emergency HVAC near me",0,0.00,0
"emergency HVAC near me Indio",0,0.00,0
"Indio emergency HVAC near me",0,0.00,0
"emergency HVAC near me Coachella",0,0.00,0
"Coachella emergency HVAC near me",0,0.00,0
"emergency HVAC near me Palm Springs",0,0.00,0
"Palm Springs emergency HVAC near me",0,0.00,0
"emergency HVAC near me Thermal",0,0.00,0
"Thermal emergency HVAC near me",0,0.00,0
"emergency HVAC near me Ribbonwood",0,0.00,0
"Ribbonwood emergency HVAC near me",0,0.00,0
"emergency HVAC near me Pinyon Pines",0,0.00,0
"Pinyon Pines emergency HVAC near me",0,0.00,0
"emergency HVAC near me Desert Hot Springs",0,0.00,0
"Desert Hot Springs emergency HVAC near me",0,0.00,0
"emergency HVAC near me Garnet",0,0.00,0
"Garnet emergency HVAC near me",0,0.00,0
"emergency HVAC near me North Palm Springs",0,0.00,0
"North Palm Springs emergency HVAC near me",0,0.00,0
"emergency HVAC near me Mountain Center",0,0.00,0
"Mountain Center emergency HVAC near me",0,0.00,0
"emergency HVAC contractor Palm Desert",0,0.00,0
"Palm Desert emergency HVAC contractor",0,0.00,0
"emergency HVAC contractor Rancho Mirage",0,0.00,0
"Rancho Mirage emergency HVAC contractor",0,0.00,0
"emergency HVAC contractor La Quinta",0,0.00,0
"La Quinta emergency HVAC contractor",0,0.00,0
"emergency HVAC contractor Cathedral City",0,0.00,0
"Cathedral City emergency HVAC contractor",0,0.00,0
"emergency HVAC contractor Indio",0,0.00,0
"Indio emergency HVAC contractor",0,0.00,0
"emergency HVAC contractor Coachella",0,0.00,0
"Coachella emergency HVAC contractor",0,0.00,0
"emergency HVAC contractor Palm Springs",0,0.00,0
"Palm Springs emergency HVAC contractor",0,0.00,0
"emergency HVAC contractor Thermal",0,0.00,0
"Thermal emergency HVAC contractor",0,0.00,0
"emergency HVAC contractor Ribbonwood",0,0.00,0
"Ribbonwood emergency HVAC contractor",0,0.00,0
"emergency HVAC contractor Pinyon Pines",0,0.00,0
"Pinyon Pines emergency HVAC contractor",0,0.00,0
"emergency HVAC contractor Desert Hot Springs",0,0.00,0
"Desert Hot Springs emergency HVAC contractor",0,0.00,0
"emergency HVAC contractor Garnet",0,0.00,0
"Garnet emergency HVAC contractor",0,0.00,0
"emergency HVAC contractor North Palm Springs",0,0.00,0
"North Palm Springs emergency HVAC contractor",0,0.00,0
"emergency HVAC contractor Mountain Center",0,0.00,0
"Mountain Center emergency HVAC contractor",0,0.00,0
"HVAC emergency service Palm Desert",0,0.00,0
"Palm Desert HVAC emergency service",0,0.00,0
"HVAC emergency service Rancho Mirage",0,0.00,0
"Rancho Mirage HVAC emergency service",0,0.00,0
"HVAC emergency service La Quinta",0,0.00,0
"La Quinta HVAC emergency service",0,0.00,0
"HVAC emergency service Cathedral City",0,0.00,0
"Cathedral City HVAC emergency service",0,0.00,0
"HVAC emergency service Indio",0,0.00,0
"Indio HVAC emergency service",0,0.00,0
"HVAC emergency service Coachella",0,0.00,0
"Coachella HVAC emergency service",0,0.00,0
"HVAC emergency service Palm Springs",0,0.00,0
"Palm Springs HVAC emergency service",0,0.00,0
"HVAC emergency service Thermal",0,0.00,0
"Thermal HVAC emergency service",0,0.00,0
"HVAC emergency service Ribbonwood",0,0.00,0
"Ribbonwood HVAC emergency service",0,0.00,0
"HVAC emergency service Pinyon Pines",0,0.00,0
"Pinyon Pines HVAC emergency service",0,0.00,0
"HVAC emergency service Desert Hot Springs",0,0.00,0
"Desert Hot Springs HVAC emergency service",0,0.00,0
"HVAC emergency service Garnet",0,0.00,0
"Garnet HVAC emergency service",0,0.00,0
"HVAC emergency service North Palm Springs",0,0.00,0
"North Palm Springs HVAC emergency service",0,0.00,0
"HVAC emergency service Mountain Center",0,0.00,0
"Mountain Center HVAC emergency service",0,0.00,0
"late-night emergency AC service Palm Desert",0,0.00,0
"Palm Desert late-night emergency AC service",0,0.00,0
"late-night emergency AC service Rancho Mirage",0,0.00,0
"Rancho Mirage late-night emergency AC service",0,0.00,0
"late-night emergency AC service La Quinta",0,0.00,0
"La Quinta late-night emergency AC service",0,0.00,0
"late-night emergency AC service Cathedral City",0,0.00,0
"Cathedral City late-night emergency AC service",0,0.00,0
"late-night emergency AC service Indio",0,0.00,0
"Indio late-night emergency AC service",0,0.00,0
"late-night emergency AC service Coachella",0,0.00,0
"Coachella late-night emergency AC service",0,0.00,0
"late-night emergency AC service Palm Springs",0,0.00,0
"Palm Springs late-night emergency AC service",0,0.00,0
"late-night emergency AC service Thermal",0,0.00,0
"Thermal late-night emergency AC service",0,0.00,0
"late-night emergency AC service Ribbonwood",0,0.00,0
"Ribbonwood late-night emergency AC service",0,0.00,0
"late-night emergency AC service Pinyon Pines",0,0.00,0
"Pinyon Pines late-night emergency AC service",0,0.00,0
"late-night emergency AC service Desert Hot Springs",0,0.00,0
"Desert Hot Springs late-night emergency AC service",0,0.00,0
"late-night emergency AC service Garnet",0,0.00,0
"Garnet late-night emergency AC service",0,0.00,0
"late-night emergency AC service North Palm Springs",0,0.00,0
"North Palm Springs late-night emergency AC service",0,0.00,0
"late-night emergency AC service Mountain Center",0,0.00,0
"Mountain Center late-night emergency AC service",0,0.00,0
"same day AC repair Palm Desert",0,0.00,0
"Palm Desert same day AC repair",0,0.00,0
"same day AC repair Rancho Mirage",0,0.00,0
"Rancho Mirage same day AC repair",0,0.00,0
"same day AC repair La Quinta",0,0.00,0
"La Quinta same day AC repair",0,0.00,0
"same day AC repair Cathedral City",0,0.00,0
"Cathedral City same day AC repair",0,0.00,0
"same day AC repair Indio",0,0.00,0
"Indio same day AC repair",0,0.00,0
"same day AC repair Coachella",0,0.00,0
"Coachella same day AC repair",0,0.00,0
"same day AC repair Palm Springs",0,0.00,0
"Palm Springs same day AC repair",0,0.00,0
"same day AC repair Thermal",0,0.00,0
"Thermal same day AC repair",0,0.00,0
"same day AC repair Ribbonwood",0,0.00,0
"Ribbonwood same day AC repair",0,0.00,0
"same day AC repair Pinyon Pines",0,0.00,0
"Pinyon Pines same day AC repair",0,0.00,0
"same day AC repair Desert Hot Springs",0,0.00,0
"Desert Hot Springs same day AC repair",0,0.00,0
"same day AC repair Garnet",0,0.00,0
"Garnet same day AC repair",0,0.00,0
"same day AC repair North Palm Springs",0,0.00,0
"North Palm Springs same day AC repair",0,0.00,0
"same day AC repair Mountain Center",0,0.00,0
"Mountain Center same day AC repair",0,0.00,0
"urgent furnace repair Palm Desert",0,0.00,0
"Palm Desert urgent furnace repair",0,0.00,0
"urgent furnace repair Rancho Mirage",0,0.00,0
"Rancho Mirage urgent furnace repair",0,0.00,0
"urgent furnace repair La Quinta",0,0.00,0
"La Quinta urgent furnace repair",0,0.00,0
"urgent furnace repair Cathedral City",0,0.00,0
"Cathedral City urgent furnace repair",0,0.00,0
"urgent furnace repair Indio",0,0.00,0
"Indio urgent furnace repair",0,0.00,0
"urgent furnace repair Coachella",0,0.00,0
"Coachella urgent furnace repair",0,0.00,0
"urgent furnace repair Palm Springs",0,0.00,0
"Palm Springs urgent furnace repair",0,0.00,0
"urgent furnace repair Thermal",0,0.00,0
"Thermal urgent furnace repair",0,0.00,0
"urgent furnace repair Ribbonwood",0,0.00,0
"Ribbonwood urgent furnace repair",0,0.00,0
"urgent furnace repair Pinyon Pines",0,0.00,0
"Pinyon Pines urgent furnace repair",0,0.00,0
"urgent furnace repair Desert Hot Springs",0,0.00,0
"Desert Hot Springs urgent furnace repair",0,0.00,0
"urgent furnace repair Garnet",0,0.00,0
"Garnet urgent furnace repair",0,0.00,0
"urgent furnace repair North Palm Springs",0,0.00,0
"North Palm Springs urgent furnace repair",0,0.00,0
"urgent furnace repair Mountain Center",0,0.00,0
"Mountain Center urgent furnace repair",0,0.00,0
"immediate HVAC service Palm Desert",0,0.00,0
"Palm Desert immediate HVAC service",0,0.00,0
"immediate HVAC service Rancho Mirage",0,0.00,0
"Rancho Mirage immediate HVAC service",0,0.00,0
"immediate HVAC service La Quinta",0,0.00,0
"La Quinta immediate HVAC service",0,0.00,0
"immediate HVAC service Cathedral City",0,0.00,0
"Cathedral City immediate HVAC service",0,0.00,0
"immediate HVAC service Indio",0,0.00,0
"Indio immediate HVAC service",0,0.00,0
"immediate HVAC service Coachella",0,0.00,0
"Coachella immediate HVAC service",0,0.00,0
"immediate HVAC service Palm Springs",0,0.00,0
"Palm Springs immediate HVAC service",0,0.00,0
"immediate HVAC service Thermal",0,0.00,0
"Thermal immediate HVAC service",0,0.00,0
"immediate HVAC service Ribbonwood",0,0.00,0
"Ribbonwood immediate HVAC service",0,0.00,0
"immediate HVAC service Pinyon Pines",0,0.00,0
"Pinyon Pines immediate HVAC service",0,0.00,0
"immediate HVAC service Desert Hot Springs",0,0.00,0
"Desert Hot Springs immediate HVAC service",0,0.00,0
"immediate HVAC service Garnet",0,0.00,0
"Garnet immediate HVAC service",0,0.00,0
"immediate HVAC service North Palm Springs",0,0.00,0
"North Palm Springs immediate HVAC service",0,0.00,0
"immediate HVAC service Mountain Center",0,0.00,0
"Mountain Center immediate HVAC service",0,0.00,0
"fast air conditioning repair near me Palm Desert",0,0.00,0
"Palm Desert fast air conditioning repair near me",0,0.00,0
"fast air conditioning repair near me Rancho Mirage",0,0.00,0
"Rancho Mirage fast air conditioning repair near me",0,0.00,0
"fast air conditioning repair near me La Quinta",0,0.00,0
"La Quinta fast air conditioning repair near me",0,0.00,0
"fast air conditioning repair near me Cathedral City",0,0.00,0
"Cathedral City fast air conditioning repair near me",0,0.00,0
"fast air conditioning repair near me Indio",0,0.00,0
"Indio fast air conditioning repair near me",0,0.00,0
"fast air conditioning repair near me Coachella",0,0.00,0
"Coachella fast air conditioning repair near me",0,0.00,0
"fast air conditioning repair near me Palm Springs",0,0.00,0
"Palm Springs fast air conditioning repair near me",0,0.00,0
"fast air conditioning repair near me Thermal",0,0.00,0
"Thermal fast air conditioning repair near me",0,0.00,0
"fast air conditioning repair near me Ribbonwood",0,0.00,0
"Ribbonwood fast air conditioning repair near me",0,0.00,0
"fast air conditioning repair near me Pinyon Pines",0,0.00,0
"Pinyon Pines fast air conditioning repair near me",0,0.00,0
"fast air conditioning repair near me Desert Hot Springs",0,0.00,0
"Desert Hot Springs fast air conditioning repair near me",0,0.00,0
"fast air conditioning repair near me Garnet",0,0.00,0
"Garnet fast air conditioning repair near me",0,0.00,0
"fast air conditioning repair near me North Palm Springs",0,0.00,0
"North Palm Springs fast air conditioning repair near me",0,0.00,0
"fast air conditioning repair near me Mountain Center",0,0.00,0
"Mountain Center fast air conditioning repair near me",0,0.00,0
"no heat emergency service Palm Desert",0,0.00,0
"Palm Desert no heat emergency service",0,0.00,0
"no heat emergency service Rancho Mirage",0,0.00,0
"Rancho Mirage no heat emergency service",0,0.00,0
"no heat emergency service La Quinta",0,0.00,0
"La Quinta no heat emergency service",0,0.00,0
"no heat emergency service Cathedral City",0,0.00,0
"Cathedral City no heat emergency service",0,0.00,0
"no heat emergency service Indio",0,0.00,0
"Indio no heat emergency service",0,0.00,0
"no heat emergency service Coachella",0,0.00,0
"Coachella no heat emergency service",0,0.00,0
"no heat emergency service Palm Springs",0,0.00,0
"Palm Springs no heat emergency service",0,0.00,0
"no heat emergency service Thermal",0,0.00,0
"Thermal no heat emergency service",0,0.00,0
"no heat emergency service Ribbonwood",0,0.00,0
"Ribbonwood no heat emergency service",0,0.00,0
"no heat emergency service Pinyon Pines",0,0.00,0
"Pinyon Pines no heat emergency service",0,0.00,0
"no heat emergency service Desert Hot Springs",0,0.00,0
"Desert Hot Springs no heat emergency service",0,0.00,0
"no heat emergency service Garnet",0,0.00,0
"Garnet no heat emergency service",0,0.00,0
"no heat emergency service North Palm Springs",0,0.00,0
"North Palm Springs no heat emergency service",0,0.00,0
"no heat emergency service Mountain Center",0,0.00,0
"Mountain Center no heat emergency service",0,0.00,0
"AC stopped working in Palm Desert",0,0.00,0
"Palm Desert AC stopped working in",0,0.00,0
"AC stopped working in Rancho Mirage",0,0.00,0
"Rancho Mirage AC stopped working in",0,0.00,0
"AC stopped working in La Quinta",0,0.00,0
"La Quinta AC stopped working in",0,0.00,0
"AC stopped working in Cathedral City",0,0.00,0
"Cathedral City AC stopped working in",0,0.00,0
"AC stopped working in Indio",0,0.00,0
"Indio AC stopped working in",0,0.00,0
"AC stopped working in Coachella",0,0.00,0
"Coachella AC stopped working in",0,0.00,0
"AC stopped working in Palm Springs",0,0.00,0
"Palm Springs AC stopped working in",0,0.00,0
"AC stopped working in Thermal",0,0.00,0
"Thermal AC stopped working in",0,0.00,0
"AC stopped working in Ribbonwood",0,0.00,0
"Ribbonwood AC stopped working in",0,0.00,0
"AC stopped working in Pinyon Pines",0,0.00,0
"Pinyon Pines AC stopped working in",0,0.00,0
"AC stopped working in Desert Hot Springs",0,0.00,0
"Desert Hot Springs AC stopped working in",0,0.00,0
"AC stopped working in Garnet",0,0.00,0
"Garnet AC stopped working in",0,0.00,0
"AC stopped working in North Palm Springs",0,0.00,0
"North Palm Springs AC stopped working in",0,0.00,0
"AC stopped working in Mountain Center",0,0.00,0
"Mountain Center AC stopped working in",0,0.00,0
"after hours AC service Palm Desert",0,0.00,0
"Palm Desert after hours AC service",0,0.00,0
"after hours AC service Rancho Mirage",0,0.00,0
"Rancho Mirage after hours AC service",0,0.00,0
"after hours AC service La Quinta",0,0.00,0
"La Quinta after hours AC service",0,0.00,0
"after hours AC service Cathedral City",0,0.00,0
"Cathedral City after hours AC service",0,0.00,0
"after hours AC service Indio",0,0.00,0
"Indio after hours AC service",0,0.00,0
"after hours AC service Coachella",0,0.00,0
"Coachella after hours AC service",0,0.00,0
"after hours AC service Palm Springs",0,0.00,0
"Palm Springs after hours AC service",0,0.00,0
"after hours AC service Thermal",0,0.00,0
"Thermal after hours AC service",0,0.00,0
"after hours AC service Ribbonwood",0,0.00,0
"Ribbonwood after hours AC service",0,0.00,0
"after hours AC service Pinyon Pines",0,0.00,0
"Pinyon Pines after hours AC service",0,0.00,0
"after hours AC service Desert Hot Springs",0,0.00,0
"Desert Hot Springs after hours AC service",0,0.00,0
"after hours AC service Garnet",0,0.00,0
"Garnet after hours AC service",0,0.00,0
"after hours AC service North Palm Springs",0,0.00,0
"North Palm Springs after hours AC service",0,0.00,0
"after hours AC service Mountain Center",0,0.00,0
"Mountain Center after hours AC service",0,0.00,0
"HVAC repair open now Palm Desert",0,0.00,0
"Palm Desert HVAC repair open now",0,0.00,0
"HVAC repair open now Rancho Mirage",0,0.00,0
"Rancho Mirage HVAC repair open now",0,0.00,0
"HVAC repair open now La Quinta",0,0.00,0
"La Quinta HVAC repair open now",0,0.00,0
"HVAC repair open now Cathedral City",0,0.00,0
"Cathedral City HVAC repair open now",0,0.00,0
"HVAC repair open now Indio",0,0.00,0
"Indio HVAC repair open now",0,0.00,0
"HVAC repair open now Coachella",0,0.00,0
"Coachella HVAC repair open now",0,0.00,0
"HVAC repair open now Palm Springs",0,0.00,0
"Palm Springs HVAC repair open now",0,0.00,0
"HVAC repair open now Thermal",0,0.00,0
"Thermal HVAC repair open now",0,0.00,0
"HVAC repair open now Ribbonwood",0,0.00,0
"Ribbonwood HVAC repair open now",0,0.00,0
