Keyword,Search Volume,CPC ($),PPC Budget Cost ($/mo)
"Rancho Mirage air conditioning repair",0,0.00,0
"Cathedral City air conditioning repair",0,0.00,0
"Coachella air conditioning repair",0,0.00,0
"air conditioning repair Pinyon Pines",0,0.00,0
"Pinyon Pines air conditioning repair",0,0.00,0
"Desert Hot Springs air conditioning repair",0,0.00,0
"emergency air conditioner repair Palm Desert",0,0.00,0
"Palm Desert emergency air conditioner repair",0,0.00,0
"emergency air conditioner repair Rancho Mirage",0,0.00,0
"Rancho Mirage emergency air conditioner repair",0,0.00,0
"emergency air conditioner repair La Quinta",0,0.00,0
"La Quinta emergency air conditioner repair",0,0.00,0
"emergency air conditioner repair Cathedral City",0,0.00,0
"Cathedral City emergency air conditioner repair",0,0.00,0
"emergency air conditioner repair Indio",0,0.00,0
"Indio emergency air conditioner repair",0,0.00,0
"emergency air conditioner repair Coachella",0,0.00,0
"Coachella emergency air conditioner repair",0,0.00,0
"emergency air conditioner repair Palm Springs",0,0.00,0
"Palm Springs emergency air conditioner repair",0,0.00,0
"emergency air conditioner repair Pinyon Pines",0,0.00,0
"Pinyon Pines emergency air conditioner repair",0,0.00,0
"emergency air conditioner repair Desert Hot Springs",0,0.00,0
"Desert Hot Springs emergency air conditioner repair",0,0.00,0
"emergency ac repair Palm Desert",0,0.00,0
"Palm Desert emergency ac repair",0,0.00,0
"emergency ac repair Rancho Mirage",0,0.00,0
"Rancho Mirage emergency ac repair",0,0.00,0
"emergency ac repair La Quinta",0,0.00,0
"La Quinta emergency ac repair",0,0.00,0
"emergency ac repair Cathedral City",0,0.00,0
"Cathedral City emergency ac repair",0,0.00,0
"emergency ac repair Indio",0,0.00,0
"Indio emergency ac repair",0,0.00,0
"emergency ac repair Coachella",0,0.00,0
"Coachella emergency ac repair",0,0.00,0
"emergency ac repair Palm Springs",0,0.00,0
"Palm Springs emergency ac repair",0,0.00,0
"emergency ac repair Pinyon Pines",0,0.00,0
"Pinyon Pines emergency ac repair",0,0.00,0
"emergency ac repair Desert Hot Springs",0,0.00,0
"Desert Hot Springs emergency ac repair",0,0.00,0
"hvac companies Palm Desert",0,0.00,0
"Palm Desert hvac companies",0,0.00,0
"hvac companies Rancho Mirage",0,0.00,0
"Rancho Mirage hvac companies",0,0.00,0
"hvac companies La Quinta",0,0.00,0
"La Quinta hvac companies",0,0.00,0
"hvac companies Cathedral City",0,0.00,0
"Cathedral City hvac companies",0,0.00,0
"hvac companies Indio",0,0.00,0
"Indio hvac companies",0,0.00,0
"hvac companies Coachella",0,0.00,0
"Coachella hvac companies",0,0.00,0
"hvac companies Palm Springs",0,0.00,0
"Palm Springs hvac companies",0,0.00,0
"hvac companies Pinyon Pines",0,0.00,0
"Pinyon Pines hvac companies",0,0.00,0
"hvac companies Desert Hot Springs",0,0.00,0
"Desert Hot Springs hvac companies",0,0.00,0
"Rancho Mirage air conditioning service",0,0.00,0
"air conditioning service La Quinta",0,0.00,0
"Cathedral City air conditioning service",0,0.00,0
"Indio air conditioning service",0,0.00,0
"air conditioning service Coachella",0,0.00,0
"Coachella air conditioning service",0,0.00,0
"air conditioning service Pinyon Pines",0,0.00,0
"Pinyon Pines air conditioning service",0,0.00,0
"Desert Hot Springs air conditioning service",0,0.00,0
"Palm Desert ac service",0,0.00,0
"Rancho Mirage ac service",0,0.00,0
"La Quinta ac service",0,0.00,0
"Cathedral City ac service",0,0.00,0
"Indio ac service",0,0.00,0
"ac service Coachella",0,0.00,0
"Coachella ac service",0,0.00,0
"ac service Palm Springs",0,0.00,0
"Palm Springs ac service",0,0.00,0
"ac service Pinyon Pines",0,0.00,0
"Pinyon Pines ac service",0,0.00,0
"ac service Desert Hot Springs",0,0.00,0
"Desert Hot Springs ac service",0,0.00,0
"air conditioning Palm Desert",0,0.00,0
"Palm Desert air conditioning",0,0.00,0
"air conditioning Rancho Mirage",0,0.00,0
"Rancho Mirage air conditioning",0,0.00,0
"air conditioning La Quinta",0,0.00,0
"La Quinta air conditioning",0,0.00,0
"air conditioning Cathedral City",0,0.00,0
"Cathedral City air conditioning",0,0.00,0
"air conditioning Indio",0,0.00,0
"Indio air conditioning",0,0.00,0
"air conditioning Coachella",0,0.00,0
"Coachella air conditioning",0,0.00,0
"air conditioning Palm Springs",0,0.00,0
"Palm Springs air conditioning",0,0.00,0
"air conditioning Pinyon Pines",0,0.00,0
"Pinyon Pines air conditioning",0,0.00,0
"air conditioning Desert Hot Springs",0,0.00,0
"Desert Hot Springs air conditioning",0,0.00,0
"emergency ac service Palm Desert",0,0.00,0
"Palm Desert emergency ac service",0,0.00,0
"emergency ac service Rancho Mirage",0,0.00,0
"Rancho Mirage emergency ac service",0,0.00,0
"emergency ac service La Quinta",0,0.00,0
"La Quinta emergency ac service",0,0.00,0
"emergency ac service Cathedral City",0,0.00,0
"Cathedral City emergency ac service",0,0.00,0
"emergency ac service Indio",0,0.00,0
"Indio emergency ac service",0,0.00,0
"emergency ac service Coachella",0,0.00,0
"Coachella emergency ac service",0,0.00,0
"emergency ac service Palm Springs",0,0.00,0
"Palm Springs emergency ac service",0,0.00,0
"emergency ac service Pinyon Pines",0,0.00,0
"Pinyon Pines emergency ac service",0,0.00,0
"emergency ac service Desert Hot Springs",0,0.00,0
"Desert Hot Springs emergency ac service",0,0.00,0
"ac installation Palm Desert",0,0.00,0
"Palm Desert ac installation",0,0.00,0
"ac installation Rancho Mirage",0,0.00,0
"Rancho Mirage ac installation",0,0.00,0
"ac installation La Quinta",0,0.00,0
"La Quinta ac installation",0,0.00,0
"ac installation Cathedral City",0,0.00,0
"Cathedral City ac installation",0,0.00,0
"ac installation Indio",0,0.00,0
"Indio ac installation",0,0.00,0
"ac installation Coachella",0,0.00,0
"Coachella ac installation",0,0.00,0
"ac installation Palm Springs",0,0.00,0
"Palm Springs ac installation",0,0.00,0
"ac installation Pinyon Pines",0,0.00,0
"Pinyon Pines ac installation",0,0.00,0
"ac installation Desert Hot Springs",0,0.00,0
"Desert Hot Springs ac installation",0,0.00,0
"furnace replacement Palm Desert",0,0.00,0
"Palm Desert furnace replacement",0,0.00,0
"furnace replacement Rancho Mirage",0,0.00,0
"Rancho Mirage furnace replacement",0,0.00,0
"furnace replacement La Quinta",0,0.00,0
"La Quinta furnace replacement",0,0.00,0
"furnace replacement Cathedral City",0,0.00,0
"Cathedral City furnace replacement",0,0.00,0
"furnace replacement Indio",0,0.00,0
"Indio furnace replacement",0,0.00,0
"furnace replacement Coachella",0,0.00,0
"Coachella furnace replacement",0,0.00,0
"furnace replacement Palm Springs",0,0.00,0
"Palm Springs furnace replacement",0,0.00,0
"furnace replacement Pinyon Pines",0,0.00,0
"Pinyon Pines furnace replacement",0,0.00,0
"furnace replacement Desert Hot Springs",0,0.00,0
"Desert Hot Springs furnace replacement",0,0.00,0
"hvac contractor Palm Desert",0,0.00,0
"Palm Desert hvac contractor",0,0.00,0
"hvac contractor Rancho Mirage",0,0.00,0
"Rancho Mirage hvac contractor",0,0.00,0
"hvac contractor La Quinta",0,0.00,0
"La Quinta hvac contractor",0,0.00,0
"hvac contractor Cathedral City",0,0.00,0
"Cathedral City hvac contractor",0,0.00,0
"hvac contractor Indio",0,0.00,0
"Indio hvac contractor",0,0.00,0
"hvac contractor Coachella",0,0.00,0
"Coachella hvac contractor",0,0.00,0
"hvac contractor Palm Springs",0,0.00,0
"Palm Springs hvac contractor",0,0.00,0
"hvac contractor Pinyon Pines",0,0.00,0
"Pinyon Pines hvac contractor",0,0.00,0
"hvac contractor Desert Hot Springs",0,0.00,0
"Desert Hot Springs hvac contractor",0,0.00,0
"hvac services Palm Desert",0,0.00,0
"Palm Desert hvac services",0,0.00,0
"hvac services Rancho Mirage",0,0.00,0
"Rancho Mirage hvac services",0,0.00,0
"hvac services La Quinta",0,0.00,0
"La Quinta hvac services",0,0.00,0
"hvac services Cathedral City",0,0.00,0
"Cathedral City hvac services",0,0.00,0
"hvac services Indio",0,0.00,0
"Indio hvac services",0,0.00,0
"hvac services Coachella",0,0.00,0
"Coachella hvac services",0,0.00,0
"hvac services Palm Springs",0,0.00,0
"Palm Springs hvac services",0,0.00,0
"hvac services Pinyon Pines",0,0.00,0
"Pinyon Pines hvac services",0,0.00,0
"hvac services Desert Hot Springs",0,0.00,0
"Desert Hot Springs hvac services",0,0.00,0
"heating and cooling repair Palm Desert",0,0.00,0
"Palm Desert heating and cooling repair",0,0.00,0
"heating and cooling repair Rancho Mirage",0,0.00,0
"Rancho Mirage heating and cooling repair",0,0.00,0
"heating and cooling repair La Quinta",0,0.00,0
"La Quinta heating and cooling repair",0,0.00,0
"heating and cooling repair Cathedral City",0,0.00,0
"Cathedral City heating and cooling repair",0,0.00,0
"heating and cooling repair Indio",0,0.00,0
"Indio heating and cooling repair",0,0.00,0
"heating and cooling repair Coachella",0,0.00,0
"Coachella heating and cooling repair",0,0.00,0
"heating and cooling repair Palm Springs",0,0.00,0
"Palm Springs heating and cooling repair",0,0.00,0
"heating and cooling repair Pinyon Pines",0,0.00,0
"Pinyon Pines heating and cooling repair",0,0.00,0
"heating and cooling repair Desert Hot Springs",0,0.00,0
"Desert Hot Springs heating and cooling repair",0,0.00,0
"air duct cleaning Palm Desert",0,0.00,0
"Palm Desert air duct cleaning",0,0.00,0
"air duct cleaning Rancho Mirage",0,0.00,0
"Rancho Mirage air duct cleaning",0,0.00,0
"air duct cleaning La Quinta",0,0.00,0
"La Quinta air duct cleaning",0,0.00,0
"air duct cleaning Cathedral City",0,0.00,0
"Cathedral City air duct cleaning",0,0.00,0
"air duct cleaning Indio",0,0.00,0
"Indio air duct cleaning",0,0.00,0
"air duct cleaning Coachella",0,0.00,0
"Coachella air duct cleaning",0,0.00,0
"air duct cleaning Palm Springs",0,0.00,0
"Palm Springs air duct cleaning",0,0.00,0
"air duct cleaning Pinyon Pines",0,0.00,0
"Pinyon Pines air duct cleaning",0,0.00,0
"air duct cleaning Desert Hot Springs",0,0.00,0
"Desert Hot Springs air duct cleaning",0,0.00,0
"hvac repair near me Palm Desert",0,0.00,0
"Palm Desert hvac repair near me",0,0.00,0
"hvac repair near me Rancho Mirage",0,0.00,0
"Rancho Mirage hvac repair near me",0,0.00,0
"hvac repair near me La Quinta",0,0.00,0
"La Quinta hvac repair near me",0,0.00,0
"hvac repair near me Cathedral City",0,0.00,0
"Cathedral City hvac repair near me",0,0.00,0
"hvac repair near me Indio",0,0.00,0
"Indio hvac repair near me",0,0.00,0
"hvac repair near me Coachella",0,0.00,0
"Coachella hvac repair near me",0,0.00,0
"hvac repair near me Palm Springs",0,0.00,0
"Palm Springs hvac repair near me",0,0.00,0
"hvac repair near me Pinyon Pines",0,0.00,0
"Pinyon Pines hvac repair near me",0,0.00,0
"hvac repair near me Desert Hot Springs",0,0.00,0
"Desert Hot Springs hvac repair near me",0,0.00,0
"furnace repair near me Palm Desert",0,0.00,0
"Palm Desert furnace repair near me",0,0.00,0
"furnace repair near me Rancho Mirage",0,0.00,0
"Rancho Mirage furnace repair near me",0,0.00,0
"furnace repair near me La Quinta",0,0.00,0
"La Quinta furnace repair near me",0,0.00,0
"furnace repair near me Cathedral City",0,0.00,0
"Cathedral City furnace repair near me",0,0.00,0
"furnace repair near me Indio",0,0.00,0
"Indio furnace repair near me",0,0.00,0
"furnace repair near me Coachella",0,0.00,0
"Coachella furnace repair near me",0,0.00,0
"furnace repair near me Palm Springs",0,0.00,0
"Palm Springs furnace repair near me",0,0.00,0
"furnace repair near me Pinyon Pines",0,0.00,0
"Pinyon Pines furnace repair near me",0,0.00,0
"furnace repair near me Desert Hot Springs",0,0.00,0
"Desert Hot Springs furnace repair near me",0,0.00,0
"heating and cooling near me Palm Desert",0,0.00,0
"Palm Desert heating and cooling near me",0,0.00,0
"heating and cooling near me Rancho Mirage",0,0.00,0
"Rancho Mirage heating and cooling near me",0,0.00,0
"heating and cooling near me La Quinta",0,0.00,0
"La Quinta heating and cooling near me",0,0.00,0
"heating and cooling near me Cathedral City",0,0.00,0
"Cathedral City heating and cooling near me",0,0.00,0
"heating and cooling near me Indio",0,0.00,0
"Indio heating and cooling near me",0,0.00,0
"heating and cooling near me Coachella",0,0.00,0
"Coachella heating and cooling near me",0,0.00,0
"heating and cooling near me Palm Springs",0,0.00,0
"Palm Springs heating and cooling near me",0,0.00,0
"heating and cooling near me Pinyon Pines",0,0.00,0
"Pinyon Pines heating and cooling near me",0,0.00,0
"heating and cooling near me Desert Hot Springs",0,0.00,0
"Desert Hot Springs heating and cooling near me",0,0.00,0
"ac installation near me Palm Desert",0,0.00,0
"Palm Desert ac installation near me",0,0.00,0
"ac installation near me Rancho Mirage",0,0.00,0
"Rancho Mirage ac installation near me",0,0.00,0
"ac installation near me La Quinta",0,0.00,0
"La Quinta ac installation near me",0,0.00,0
"ac installation near me Cathedral City",0,0.00,0
"Cathedral City ac installation near me",0,0.00,0
"ac installation near me Indio",0,0.00,0
"Indio ac installation near me",0,0.00,0
"ac installation near me Coachella",0,0.00,0
"Coachella ac installation near me",0,0.00,0
"ac installation near me Palm Springs",0,0.00,0
"Palm Springs ac installation near me",0,0.00,0
"ac installation near me Pinyon Pines",0,0.00,0
"Pinyon Pines ac installation near me",0,0.00,0
"ac installation near me Desert Hot Springs",0,0.00,0
"Desert Hot Springs ac installation near me",0,0.00,0
"emergency hvac repair Palm Desert",0,0.00,0
"Palm Desert emergency hvac repair",0,0.00,0
"emergency hvac repair Rancho Mirage",0,0.00,0
"Rancho Mirage emergency hvac repair",0,0.00,0
"emergency hvac repair La Quinta",0,0.00,0
"La Quinta emergency hvac repair",0,0.00,0
"emergency hvac repair Cathedral City",0,0.00,0
"Cathedral City emergency hvac repair",0,0.00,0
"emergency hvac repair Indio",0,0.00,0
"Indio emergency hvac repair",0,0.00,0
"emergency hvac repair Coachella",0,0.00,0
"Coachella emergency hvac repair",0,0.00,0
"emergency hvac repair Palm Springs",0,0.00,0
"Palm Springs emergency hvac repair",0,0.00,0
"emergency hvac repair Pinyon Pines",0,0.00,0
"Pinyon Pines emergency hvac repair",0,0.00,0
"emergency hvac repair Desert Hot Springs",0,0.00,0
"Desert Hot Springs emergency hvac repair",0,0.00,0
"24/7 hvac repair Palm Desert",0,0.00,0
"Palm Desert 24/7 hvac repair",0,0.00,0
"24/7 hvac repair Rancho Mirage",0,0.00,0
"Rancho Mirage 24/7 hvac repair",0,0.00,0
"24/7 hvac repair La Quinta",0,0.00,0
"La Quinta 24/7 hvac repair",0,0.00,0
"24/7 hvac repair Cathedral City",0,0.00,0
"Cathedral City 24/7 hvac repair",0,0.00,0
"24/7 hvac repair Indio",0,0.00,0
"Indio 24/7 hvac repair",0,0.00,0
"24/7 hvac repair Coachella",0,0.00,0
"Coachella 24/7 hvac repair",0,0.00,0
"24/7 hvac repair Palm Springs",0,0.00,0
"Palm Springs 24/7 hvac repair",0,0.00,0
"24/7 hvac repair Pinyon Pines",0,0.00,0
"Pinyon Pines 24/7 hvac repair",0,0.00,0
"24/7 hvac repair Desert Hot Springs",0,0.00,0
"Desert Hot Springs 24/7 hvac repair",0,0.00,0
"same-day hvac service Palm Desert",0,0.00,0
"Palm Desert same-day hvac service",0,0.00,0
"same-day hvac service Rancho Mirage",0,0.00,0
"Rancho Mirage same-day hvac service",0,0.00,0
"same-day hvac service La Quinta",0,0.00,0
"La Quinta same-day hvac service",0,0.00,0
"same-day hvac service Cathedral City",0,0.00,0
"Cathedral City same-day hvac service",0,0.00,0
"same-day hvac service Indio",0,0.00,0
"Indio same-day hvac service",0,0.00,0
"same-day hvac service Coachella",0,0.00,0
"Coachella same-day hvac service",0,0.00,0
"same-day hvac service Palm Springs",0,0.00,0
"Palm Springs same-day hvac service",0,0.00,0
"same-day hvac service Pinyon Pines",0,0.00,0
"Pinyon Pines same-day hvac service",0,0.00,0
"same-day hvac service Desert Hot Springs",0,0.00,0
"Desert Hot Springs same-day hvac service",0,0.00,0
"after-hours hvac repair Palm Desert",0,0.00,0
"Palm Desert after-hours hvac repair",0,0.00,0
"after-hours hvac repair Rancho Mirage",0,0.00,0
"Rancho Mirage after-hours hvac repair",0,0.00,0
"after-hours hvac repair La Quinta",0,0.00,0
"La Quinta after-hours hvac repair",0,0.00,0
"after-hours hvac repair Cathedral City",0,0.00,0
"Cathedral City after-hours hvac repair",0,0.00,0
"after-hours hvac repair Indio",0,0.00,0
"Indio after-hours hvac repair",0,0.00,0
"after-hours hvac repair Coachella",0,0.00,0
"Coachella after-hours hvac repair",0,0.00,0
"after-hours hvac repair Palm Springs",0,0.00,0
"Palm Springs after-hours hvac repair",0,0.00,0
"after-hours hvac repair Pinyon Pines",0,0.00,0
"Pinyon Pines after-hours hvac repair",0,0.00,0
"after-hours hvac repair Desert Hot Springs",0,0.00,0
"Desert Hot Springs after-hours hvac repair",0,0.00,0
"furnace installation Palm Desert",0,0.00,0
"Palm Desert furnace installation",0,0.00,0
"furnace installation Rancho Mirage",0,0.00,0
"Rancho Mirage furnace installation",0,0.00,0
"furnace installation La Quinta",0,0.00,0
"La Quinta furnace installation",0,0.00,0
"furnace installation Cathedral City",0,0.00,0
"Cathedral City furnace installation",0,0.00,0
"furnace installation Indio",0,0.00,0
"Indio furnace installation",0,0.00,0
"furnace installation Coachella",0,0.00,0
"Coachella furnace installation",0,0.00,0
"furnace installation Palm Springs",0,0.00,0
"Palm Springs furnace installation",0,0.00,0
"furnace installation Pinyon Pines",0,0.00,0
"Pinyon Pines furnace installation",0,0.00,0
"furnace installation Desert Hot Springs",0,0.00,0
"Desert Hot Springs furnace installation",0,0.00,0
"hvac system replacement Palm Desert",0,0.00,0
"Palm Desert hvac system replacement",0,0.00,0
"hvac system replacement Rancho Mirage",0,0.00,0
"Rancho Mirage hvac system replacement",0,0.00,0
"hvac system replacement La Quinta",0,0.00,0
"La Quinta hvac system replacement",0,0.00,0
"hvac system replacement Cathedral City",0,0.00,0
"Cathedral City hvac system replacement",0,0.00,0
"hvac system replacement Indio",0,0.00,0
"Indio hvac system replacement",0,0.00,0
"hvac system replacement Coachella",0,0.00,0
"Coachella hvac system replacement",0,0.00,0
"hvac system replacement Palm Springs",0,0.00,0
"Palm Springs hvac system replacement",0,0.00,0
"hvac system replacement Pinyon Pines",0,0.00,0
"Pinyon Pines hvac system replacement",0,0.00,0
"hvac system replacement Desert Hot Springs",0,0.00,0
"Desert Hot Springs hvac system replacement",0,0.00,0
"central air installation Palm Desert",0,0.00,0
"Palm Desert central air installation",0,0.00,0
"central air installation Rancho Mirage",0,0.00,0
"Rancho Mirage central air installation",0,0.00,0
"central air installation La Quinta",0,0.00,0
"La Quinta central air installation",0,0.00,0
"central air installation Cathedral City",0,0.00,0
"Cathedral City central air installation",0,0.00,0
"central air installation Indio",0,0.00,0
"Indio central air installation",0,0.00,0
"central air installation Coachella",0,0.00,0
"Coachella central air installation",0,0.00,0
"central air installation Palm Springs",0,0.00,0
"Palm Springs central air installation",0,0.00,0
"central air installation Pinyon Pines",0,0.00,0
"Pinyon Pines central air installation",0,0.00,0
"central air installation Desert Hot Springs",0,0.00,0
"Desert Hot Springs central air installation",0,0.00,0
"hvac maintenance Palm Desert",0,0.00,0
"Palm Desert hvac maintenance",0,0.00,0
"hvac maintenance Rancho Mirage",0,0.00,0
"Rancho Mirage hvac maintenance",0,0.00,0
"hvac maintenance La Quinta",0,0.00,0
"La Quinta hvac maintenance",0,0.00,0
"hvac maintenance Cathedral City",0,0.00,0
"Cathedral City hvac maintenance",0,0.00,0
"hvac maintenance Indio",0,0.00,0
"Indio hvac maintenance",0,0.00,0
"hvac maintenance Coachella",0,0.00,0
"Coachella hvac maintenance",0,0.00,0
"hvac maintenance Palm Springs",0,0.00,0
"Palm Springs hvac maintenance",0,0.00,0
"hvac maintenance Pinyon Pines",0,0.00,0
"Pinyon Pines hvac maintenance",0,0.00,0
"hvac maintenance Desert Hot Springs",0,0.00,0
"Desert Hot Springs hvac maintenance",0,0.00,0
"furnace maintenance Palm Desert",0,0.00,0
"Palm Desert furnace maintenance",0,0.00,0
"furnace maintenance Rancho Mirage",0,0.00,0
"Rancho Mirage furnace maintenance",0,0.00,0
"furnace maintenance La Quinta",0,0.00,0
"La Quinta furnace maintenance",0,0.00,0
"furnace maintenance Cathedral City",0,0.00,0
"Cathedral City furnace maintenance",0,0.00,0
"furnace maintenance Indio",0,0.00,0
"Indio furnace maintenance",0,0.00,0
"furnace maintenance Coachella",0,0.00,0
"Coachella furnace maintenance",0,0.00,0
"furnace maintenance Palm Springs",0,0.00,0
"Palm Springs furnace maintenance",0,0.00,0
"furnace maintenance Pinyon Pines",0,0.00,0
"Pinyon Pines furnace maintenance",0,0.00,0
"furnace maintenance Desert Hot Springs",0,0.00,0
"Desert Hot Springs furnace maintenance",0,0.00,0
"ac tune-up Palm Desert",0,0.00,0
"Palm Desert ac tune-up",0,0.00,0
"ac tune-up Rancho Mirage",0,0.00,0
"Rancho Mirage ac tune-up",0,0.00,0
"ac tune-up La Quinta",0,0.00,0
"La Quinta ac tune-up",0,0.00,0
"ac tune-up Cathedral City",0,0.00,0
"Cathedral City ac tune-up",0,0.00,0
"ac tune-up Indio",0,0.00,0
"Indio ac tune-up",0,0.00,0
"ac tune-up Coachella",0,0.00,0
"Coachella ac tune-up",0,0.00,0
"ac tune-up Palm Springs",0,0.00,0
"Palm Springs ac tune-up",0,0.00,0
"ac tune-up Pinyon Pines",0,0.00,0
"Pinyon Pines ac tune-up",0,0.00,0
"ac tune-up Desert Hot Springs",0,0.00,0
"Desert Hot Springs ac tune-up",0,0.00,0
"spring hvac maintenance Palm Desert",0,0.00,0
"Palm Desert spring hvac maintenance",0,0.00,0
"spring hvac maintenance Rancho Mirage",0,0.00,0
"Rancho Mirage spring hvac maintenance",0,0.00,0
"spring hvac maintenance La Quinta",0,0.00,0
"La Quinta spring hvac maintenance",0,0.00,0
"spring hvac maintenance Cathedral City",0,0.00,0
"Cathedral City spring hvac maintenance",0,0.00,0
"spring hvac maintenance Indio",0,0.00,0
"Indio spring hvac maintenance",0,0.00,0
"spring hvac maintenance Coachella",0,0.00,0
"Coachella spring hvac maintenance",0,0.00,0
"spring hvac maintenance Palm Springs",0,0.00,0
"Palm Springs spring hvac maintenance",0,0.00,0
"spring hvac maintenance Pinyon Pines",0,0.00,0
"Pinyon Pines spring hvac maintenance",0,0.00,0
"spring hvac maintenance Desert Hot Springs",0,0.00,0
"Desert Hot Springs spring hvac maintenance",0,0.00,0
"ac not cooling Palm Desert",0,0.00,0
"Palm Desert ac not cooling",0,0.00,0
"ac not cooling Rancho Mirage",0,0.00,0
"Rancho Mirage ac not cooling",0,0.00,0
"ac not cooling La Quinta",0,0.00,0
"La Quinta ac not cooling",0,0.00,0
"ac not cooling Cathedral City",0,0.00,0
"Cathedral City ac not cooling",0,0.00,0
"ac not cooling Indio",0,0.00,0
"Indio ac not cooling",0,0.00,0
"ac not cooling Coachella",0,0.00,0
"Coachella ac not cooling",0,0.00,0
"ac not cooling Palm Springs",0,0.00,0
"Palm Springs ac not cooling",0,0.00,0
"ac not cooling Pinyon Pines",0,0.00,0
"Pinyon Pines ac not cooling",0,0.00,0
"ac not cooling Desert Hot Springs",0,0.00,0
"Desert Hot Springs ac not cooling",0,0.00,0
"heater not working Palm Desert",0,0.00,0
"Palm Desert heater not working",0,0.00,0
"heater not working Rancho Mirage",0,0.00,0
"Rancho Mirage heater not working",0,0.00,0
"heater not working La Quinta",0,0.00,0
"La Quinta heater not working",0,0.00,0
"heater not working Cathedral City",0,0.00,0
"Cathedral City heater not working",0,0.00,0
"heater not working Indio",0,0.00,0
"Indio heater not working",0,0.00,0
"heater not working Coachella",0,0.00,0
"Coachella heater not working",0,0.00,0
"heater not working Palm Springs",0,0.00,0
"Palm Springs heater not working",0,0.00,0
"heater not working Pinyon Pines",0,0.00,0
"Pinyon Pines heater not working",0,0.00,0
"heater not working Desert Hot Springs",0,0.00,0
"Desert Hot Springs heater not working",0,0.00,0
"why is my ac blowing warm air Palm Desert",0,0.00,0
"Palm Desert why is my ac blowing warm air",0,0.00,0
"why is my ac blowing warm air Rancho Mirage",0,0.00,0
"Rancho Mirage why is my ac blowing warm air",0,0.00,0
"why is my ac blowing warm air La Quinta",0,0.00,0
"La Quinta why is my ac blowing warm air",0,0.00,0
"why is my ac blowing warm air Cathedral City",0,0.00,0
"Cathedral City why is my ac blowing warm air",0,0.00,0
"why is my ac blowing warm air Indio",0,0.00,0
"Indio why is my ac blowing warm air",0,0.00,0
"why is my ac blowing warm air Coachella",0,0.00,0
"Coachella why is my ac blowing warm air",0,0.00,0
"why is my ac blowing warm air Palm Springs",0,0.00,0
"Palm Springs why is my ac blowing warm air",0,0.00,0
"why is my ac blowing warm air Pinyon Pines",0,0.00,0
"Pinyon Pines why is my ac blowing warm air",0,0.00,0
"why is my ac blowing warm air Desert Hot Springs",0,0.00,0
"Desert Hot Springs why is my ac blowing warm air",0,0.00,0
"HVAC repair Palm Desert",0,0.00,0
"Palm Desert HVAC repair",0,0.00,0
"HVAC repair Rancho Mirage",0,0.00,0
"Rancho Mirage HVAC repair",0,0.00,0
"HVAC repair La Quinta",0,0.00,0
"La Quinta HVAC repair",0,0.00,0
"HVAC repair Cathedral City",0,0.00,0
"Cathedral City HVAC repair",0,0.00,0
"HVAC repair Indio",0,0.00,0
"Indio HVAC repair",0,0.00,0
"HVAC repair Coachella",0,0.00,0
"Coachella HVAC repair",0,0.00,0
"HVAC repair Palm Springs",0,0.00,0
"Palm Springs HVAC repair",0,0.00,0
"HVAC repair Pinyon Pines",0,0.00,0
"Pinyon Pines HVAC repair",0,0.00,0
"HVAC repair Desert Hot Springs",0,0.00,0
"Desert Hot Springs HVAC repair",0,0.00,0
"ac repair Palm Desert",0,0.00,0
"Palm Desert ac repair",0,0.00,0
"ac repair Rancho Mirage",0,0.00,0
"Rancho Mirage ac repair",0,0.00,0
"ac repair La Quinta",0,0.00,0
"La Quinta ac repair",0,0.00,0
"ac repair Cathedral City",0,0.00,0
"Cathedral City ac repair",0,0.00,0
"ac repair Indio",0,0.00,0
"Indio ac repair",0,0.00,0
"ac repair Coachella",0,0.00,0
"Coachella ac repair",0,0.00,0
"ac repair Palm Springs",0,0.00,0
"Palm Springs ac repair",0,0.00,0
"ac repair Pinyon Pines",0,0.00,0
"Pinyon Pines ac repair",0,0.00,0
"ac repair Desert Hot Springs",0,0.00,0
"Desert Hot Springs ac repair",0,0.00,0
"air conditioner service Palm Desert",0,0.00,0
"Palm Desert air conditioner service",0,0.00,0
"air conditioner service Rancho Mirage",0,0.00,0
"Rancho Mirage air conditioner service",0,0.00,0
"air conditioner service La Quinta",0,0.00,0
"La Quinta air conditioner service",0,0.00,0
"air conditioner service Cathedral City",0,0.00,0
"Cathedral City air conditioner service",0,0.00,0
"air conditioner service Indio",0,0.00,0
