Keyword,Search Volume,CPC ($),PPC Budget Cost ($/mo)
"Palm Springs heating contractor",0,0.00,0
"heating contractor Pinyon Pines",0,0.00,0
"Pinyon Pines heating contractor",0,0.00,0
"heating contractor Desert Hot Springs",0,0.00,0
"Desert Hot Springs heating contractor",0,0.00,0
"air conditioning unit Palm Desert",0,0.00,0
"Palm Desert air conditioning unit",0,0.00,0
"air conditioning unit Rancho Mirage",0,0.00,0
"Rancho Mirage air conditioning unit",0,0.00,0
"air conditioning unit La Quinta",0,0.00,0
"La Quinta air conditioning unit",0,0.00,0
"air conditioning unit Cathedral City",0,0.00,0
"Cathedral City air conditioning unit",0,0.00,0
"air conditioning unit Indio",0,0.00,0
"Indio air conditioning unit",0,0.00,0
"air conditioning unit Coachella",0,0.00,0
"Coachella air conditioning unit",0,0.00,0
"air conditioning unit Palm Springs",0,0.00,0
"Palm Springs air conditioning unit",0,0.00,0
"air conditioning unit Pinyon Pines",0,0.00,0
"Pinyon Pines air conditioning unit",0,0.00,0
"air conditioning unit Desert Hot Springs",0,0.00,0
"Desert Hot Springs air conditioning unit",0,0.00,0
"hvac repair services Palm Desert",0,0.00,0
"Palm Desert hvac repair services",0,0.00,0
"hvac repair services Rancho Mirage",0,0.00,0
"Rancho Mirage hvac repair services",0,0.00,0
"hvac repair services La Quinta",0,0.00,0
"La Quinta hvac repair services",0,0.00,0
"hvac repair services Cathedral City",0,0.00,0
"Cathedral City hvac repair services",0,0.00,0
"hvac repair services Indio",0,0.00,0
"Indio hvac repair services",0,0.00,0
"hvac repair services Coachella",0,0.00,0
"Coachella hvac repair services",0,0.00,0
"hvac repair services Palm Springs",0,0.00,0
"Palm Springs hvac repair services",0,0.00,0
"hvac repair services Pinyon Pines",0,0.00,0
"Pinyon Pines hvac repair services",0,0.00,0
"hvac repair services Desert Hot Springs",0,0.00,0
"Desert Hot Springs hvac repair services",0,0.00,0