Keyword,Search Volume,CPC ($),PPC Budget Cost ($/mo)
"Pinyon Pines furnace not working during snowstorm",0,0.00,0
"furnace not working during snowstorm Desert Hot Springs",0,0.00,0
"Desert Hot Springs furnace not working during snowstorm",0,0.00,0
"emergency air conditioning repair heat wave Palm Desert",0,0.00,0
"Palm Desert emergency air conditioning repair heat wave",0,0.00,0
"emergency air conditioning repair heat wave Rancho Mirage",0,0.00,0
"Rancho Mirage emergency air conditioning repair heat wave",0,0.00,0
"emergency air conditioning repair heat wave La Quinta",0,0.00,0
"La Quinta emergency air conditioning repair heat wave",0,0.00,0
"emergency air conditioning repair heat wave Cathedral City",0,0.00,0
"Cathedral City emergency air conditioning repair heat wave",0,0.00,0
"emergency air conditioning repair heat wave Indio",0,0.00,0
"Indio emergency air conditioning repair heat wave",0,0.00,0
"emergency air conditioning repair heat wave Coachella",0,0.00,0
"Coachella emergency air conditioning repair heat wave",0,0.00,0
"emergency air conditioning repair heat wave Palm Springs",0,0.00,0
"Palm Springs emergency air conditioning repair heat wave",0,0.00,0
"emergency air conditioning repair heat wave Pinyon Pines",0,0.00,0
"Pinyon Pines emergency air conditioning repair heat wave",0,0.00,0
"emergency air conditioning repair heat wave Desert Hot Springs",0,0.00,0
"Desert Hot Springs emergency air conditioning repair heat wave",0,0.00,0
"emergency heating repair in Palm Desert",0,0.00,0
"Palm Desert emergency heating repair in",0,0.00,0
"emergency heating repair in Rancho Mirage",0,0.00,0
"Rancho Mirage emergency heating repair in",0,0.00,0
"emergency heating repair in La Quinta",0,0.00,0
"La Quinta emergency heating repair in",0,0.00,0
"emergency heating repair in Cathedral City",0,0.00,0
"Cathedral City emergency heating repair in",0,0.00,0
"emergency heating repair in Indio",0,0.00,0
"Indio emergency heating repair in",0,0.00,0
"emergency heating repair in Coachella",0,0.00,0
"Coachella emergency heating repair in",0,0.00,0
"emergency heating repair in Palm Springs",0,0.00,0
"Palm Springs emergency heating repair in",0,0.00,0
"emergency heating repair in Pinyon Pines",0,0.00,0
"Pinyon Pines emergency heating repair in",0,0.00,0
"emergency heating repair in Desert Hot Springs",0,0.00,0
"Desert Hot Springs emergency heating repair in",0,0.00,0
"24/7 HVAC service near me Palm Desert",0,0.00,0
"Palm Desert 24/7 HVAC service near me",0,0.00,0
"24/7 HVAC service near me Rancho Mirage",0,0.00,0
"Rancho Mirage 24/7 HVAC service near me",0,0.00,0
"24/7 HVAC service near me La Quinta",0,0.00,0
"La Quinta 24/7 HVAC service near me",0,0.00,0
"24/7 HVAC service near me Cathedral City",0,0.00,0
"Cathedral City 24/7 HVAC service near me",0,0.00,0
"24/7 HVAC service near me Indio",0,0.00,0
"Indio 24/7 HVAC service near me",0,0.00,0
"24/7 HVAC service near me Coachella",0,0.00,0
"Coachella 24/7 HVAC service near me",0,0.00,0
"24/7 HVAC service near me Palm Springs",0,0.00,0
"Palm Springs 24/7 HVAC service near me",0,0.00,0
"24/7 HVAC service near me Pinyon Pines",0,0.00,0
"Pinyon Pines 24/7 HVAC service near me",0,0.00,0
"24/7 HVAC service near me Desert Hot Springs",0,0.00,0
"Desert Hot Springs 24/7 HVAC service near me",0,0.00,0
"same day air conditioning repair Palm Desert",0,0.00,0
"Palm Desert same day air conditioning repair",0,0.00,0
"same day air conditioning repair Rancho Mirage",0,0.00,0
"Rancho Mirage same day air conditioning repair",0,0.00,0
"same day air conditioning repair La Quinta",0,0.00,0
"La Quinta same day air conditioning repair",0,0.00,0
"same day air conditioning repair Cathedral City",0,0.00,0
"Cathedral City same day air conditioning repair",0,0.00,0
"same day air conditioning repair Indio",0,0.00,0
"Indio same day air conditioning repair",0,0.00,0
"same day air conditioning repair Coachella",0,0.00,0
"Coachella same day air conditioning repair",0,0.00,0
"same day air conditioning repair Palm Springs",0,0.00,0
"Palm Springs same day air conditioning repair",0,0.00,0
"same day air conditioning repair Pinyon Pines",0,0.00,0
"Pinyon Pines same day air conditioning repair",0,0.00,0
"same day air conditioning repair Desert Hot Springs",0,0.00,0
"Desert Hot Springs same day air conditioning repair",0,0.00,0
"urgent furnace repair Palm Desert",0,0.00,0
"Palm Desert urgent furnace repair",0,0.00,0
"urgent furnace repair Rancho Mirage",0,0.00,0
"Rancho Mirage urgent furnace repair",0,0.00,0
"urgent furnace repair La Quinta",0,0.00,0
"La Quinta urgent furnace repair",0,0.00,0
"urgent furnace repair Cathedral City",0,0.00,0
"Cathedral City urgent furnace repair",0,0.00,0
"urgent furnace repair Indio",0,0.00,0
"Indio urgent furnace repair",0,0.00,0
"urgent furnace repair Coachella",0,0.00,0
"Coachella urgent furnace repair",0,0.00,0
"urgent furnace repair Palm Springs",0,0.00,0
"Palm Springs urgent furnace repair",0,0.00,0
"urgent furnace repair Pinyon Pines",0,0.00,0
"Pinyon Pines urgent furnace repair",0,0.00,0
"urgent furnace repair Desert Hot Springs",0,0.00,0
"Desert Hot Springs urgent furnace repair",0,0.00,0
"immediate AC service Palm Desert",0,0.00,0
"Palm Desert immediate AC service",0,0.00,0
"immediate AC service Rancho Mirage",0,0.00,0
"Rancho Mirage immediate AC service",0,0.00,0
"immediate AC service La Quinta",0,0.00,0
"La Quinta immediate AC service",0,0.00,0
"immediate AC service Cathedral City",0,0.00,0
"Cathedral City immediate AC service",0,0.00,0
"immediate AC service Indio",0,0.00,0
"Indio immediate AC service",0,0.00,0
"immediate AC service Coachella",0,0.00,0
"Coachella immediate AC service",0,0.00,0
"immediate AC service Palm Springs",0,0.00,0
"Palm Springs immediate AC service",0,0.00,0
"immediate AC service Pinyon Pines",0,0.00,0
"Pinyon Pines immediate AC service",0,0.00,0
"immediate AC service Desert Hot Springs",0,0.00,0
"Desert Hot Springs immediate AC service",0,0.00,0
"emergency HVAC contractor Palm Desert",0,0.00,0
"Palm Desert emergency HVAC contractor",0,0.00,0
"emergency HVAC contractor Rancho Mirage",0,0.00,0
"Rancho Mirage emergency HVAC contractor",0,0.00,0
"emergency HVAC contractor La Quinta",0,0.00,0
"La Quinta emergency HVAC contractor",0,0.00,0
"emergency HVAC contractor Cathedral City",0,0.00,0
"Cathedral City emergency HVAC contractor",0,0.00,0
"emergency HVAC contractor Indio",0,0.00,0
"Indio emergency HVAC contractor",0,0.00,0
"emergency HVAC contractor Coachella",0,0.00,0
"Coachella emergency HVAC contractor",0,0.00,0
"emergency HVAC contractor Palm Springs",0,0.00,0
"Palm Springs emergency HVAC contractor",0,0.00,0
"emergency HVAC contractor Pinyon Pines",0,0.00,0
"Pinyon Pines emergency HVAC contractor",0,0.00,0
"emergency HVAC contractor Desert Hot Springs",0,0.00,0
"Desert Hot Springs emergency HVAC contractor",0,0.00,0
"emergency HVAC repair near me Palm Desert",0,0.00,0
"Palm Desert emergency HVAC repair near me",0,0.00,0
"emergency HVAC repair near me Rancho Mirage",0,0.00,0
"Rancho Mirage emergency HVAC repair near me",0,0.00,0
"emergency HVAC repair near me La Quinta",0,0.00,0
"La Quinta emergency HVAC repair near me",0,0.00,0
"emergency HVAC repair near me Cathedral City",0,0.00,0
"Cathedral City emergency HVAC repair near me",0,0.00,0
"emergency HVAC repair near me Indio",0,0.00,0
"Indio emergency HVAC repair near me",0,0.00,0
"emergency HVAC repair near me Coachella",0,0.00,0
"Coachella emergency HVAC repair near me",0,0.00,0
"emergency HVAC repair near me Palm Springs",0,0.00,0
"Palm Springs emergency HVAC repair near me",0,0.00,0
"emergency HVAC repair near me Pinyon Pines",0,0.00,0
"Pinyon Pines emergency HVAC repair near me",0,0.00,0
"emergency HVAC repair near me Desert Hot Springs",0,0.00,0
"Desert Hot Springs emergency HVAC repair near me",0,0.00,0
"after hours furnace repair Palm Desert",0,0.00,0
"Palm Desert after hours furnace repair",0,0.00,0
"after hours furnace repair Rancho Mirage",0,0.00,0
"Rancho Mirage after hours furnace repair",0,0.00,0
"after hours furnace repair La Quinta",0,0.00,0
"La Quinta after hours furnace repair",0,0.00,0
"after hours furnace repair Cathedral City",0,0.00,0
"Cathedral City after hours furnace repair",0,0.00,0
"after hours furnace repair Indio",0,0.00,0
"Indio after hours furnace repair",0,0.00,0
"after hours furnace repair Coachella",0,0.00,0
"Coachella after hours furnace repair",0,0.00,0
"after hours furnace repair Palm Springs",0,0.00,0
"Palm Springs after hours furnace repair",0,0.00,0
"after hours furnace repair Pinyon Pines",0,0.00,0
"Pinyon Pines after hours furnace repair",0,0.00,0
"after hours furnace repair Desert Hot Springs",0,0.00,0
"Desert Hot Springs after hours furnace repair",0,0.00,0
"HVAC repair open now Palm Desert",0,0.00,0
"Palm Desert HVAC repair open now",0,0.00,0
"HVAC repair open now Rancho Mirage",0,0.00,0
"Rancho Mirage HVAC repair open now",0,0.00,0
"HVAC repair open now La Quinta",0,0.00,0
"La Quinta HVAC repair open now",0,0.00,0
"HVAC repair open now Cathedral City",0,0.00,0
"Cathedral City HVAC repair open now",0,0.00,0
"HVAC repair open now Indio",0,0.00,0
"Indio HVAC repair open now",0,0.00,0
"HVAC repair open now Coachella",0,0.00,0
"Coachella HVAC repair open now",0,0.00,0
"HVAC repair open now Palm Springs",0,0.00,0
"Palm Springs HVAC repair open now",0,0.00,0
"HVAC repair open now Pinyon Pines",0,0.00,0
"Pinyon Pines HVAC repair open now",0,0.00,0
"HVAC repair open now Desert Hot Springs",0,0.00,0
"Desert Hot Springs HVAC repair open now",0,0.00,0
"no heat emergency service Palm Desert",0,0.00,0
"Palm Desert no heat emergency service",0,0.00,0
"no heat emergency service Rancho Mirage",0,0.00,0
"Rancho Mirage no heat emergency service",0,0.00,0
"no heat emergency service La Quinta",0,0.00,0
"La Quinta no heat emergency service",0,0.00,0
"no heat emergency service Cathedral City",0,0.00,0
"Cathedral City no heat emergency service",0,0.00,0
"no heat emergency service Indio",0,0.00,0
"Indio no heat emergency service",0,0.00,0
"no heat emergency service Coachella",0,0.00,0
"Coachella no heat emergency service",0,0.00,0
"no heat emergency service Palm Springs",0,0.00,0
"Palm Springs no heat emergency service",0,0.00,0
"no heat emergency service Pinyon Pines",0,0.00,0
"Pinyon Pines no heat emergency service",0,0.00,0
"no heat emergency service Desert Hot Springs",0,0.00,0
"Desert Hot Springs no heat emergency service",0,0.00,0
"AC stopped working Palm Desert",0,0.00,0
"Palm Desert AC stopped working",0,0.00,0
"AC stopped working Rancho Mirage",0,0.00,0
"Rancho Mirage AC stopped working",0,0.00,0
"AC stopped working La Quinta",0,0.00,0
"La Quinta AC stopped working",0,0.00,0
"AC stopped working Cathedral City",0,0.00,0
"Cathedral City AC stopped working",0,0.00,0
"AC stopped working Indio",0,0.00,0
"Indio AC stopped working",0,0.00,0
"AC stopped working Coachella",0,0.00,0
"Coachella AC stopped working",0,0.00,0
"AC stopped working Palm Springs",0,0.00,0
"Palm Springs AC stopped working",0,0.00,0
"AC stopped working Pinyon Pines",0,0.00,0
"Pinyon Pines AC stopped working",0,0.00,0
"AC stopped working Desert Hot Springs",0,0.00,0
"Desert Hot Springs AC stopped working",0,0.00,0
"furnace repair during snowstorm Palm Desert",0,0.00,0
"Palm Desert furnace repair during snowstorm",0,0.00,0
"furnace repair during snowstorm Rancho Mirage",0,0.00,0
"Rancho Mirage furnace repair during snowstorm",0,0.00,0
"furnace repair during snowstorm La Quinta",0,0.00,0
"La Quinta furnace repair during snowstorm",0,0.00,0
"furnace repair during snowstorm Cathedral City",0,0.00,0
"Cathedral City furnace repair during snowstorm",0,0.00,0
"furnace repair during snowstorm Indio",0,0.00,0
"Indio furnace repair during snowstorm",0,0.00,0
"furnace repair during snowstorm Coachella",0,0.00,0
"Coachella furnace repair during snowstorm",0,0.00,0
"furnace repair during snowstorm Palm Springs",0,0.00,0
"Palm Springs furnace repair during snowstorm",0,0.00,0
"furnace repair during snowstorm Pinyon Pines",0,0.00,0
"Pinyon Pines furnace repair during snowstorm",0,0.00,0
"furnace repair during snowstorm Desert Hot Springs",0,0.00,0
"Desert Hot Springs furnace repair during snowstorm",0,0.00,0
"quick AC repair near me Palm Desert",0,0.00,0
"Palm Desert quick AC repair near me",0,0.00,0
"quick AC repair near me Rancho Mirage",0,0.00,0
"Rancho Mirage quick AC repair near me",0,0.00,0
"quick AC repair near me La Quinta",0,0.00,0
"La Quinta quick AC repair near me",0,0.00,0
"quick AC repair near me Cathedral City",0,0.00,0
"Cathedral City quick AC repair near me",0,0.00,0
"quick AC repair near me Indio",0,0.00,0
"Indio quick AC repair near me",0,0.00,0
"quick AC repair near me Coachella",0,0.00,0
"Coachella quick AC repair near me",0,0.00,0
"quick AC repair near me Palm Springs",0,0.00,0
"Palm Springs quick AC repair near me",0,0.00,0
"quick AC repair near me Pinyon Pines",0,0.00,0
"Pinyon Pines quick AC repair near me",0,0.00,0
"quick AC repair near me Desert Hot Springs",0,0.00,0
"Desert Hot Springs quick AC repair near me",0,0.00,0
"heating repair Palm Desert",0,0.00,0
"Palm Desert heating repair",0,0.00,0
"heating repair Rancho Mirage",0,0.00,0
"Rancho Mirage heating repair",0,0.00,0
"heating repair La Quinta",0,0.00,0
"La Quinta heating repair",0,0.00,0
"heating repair Cathedral City",0,0.00,0
"Cathedral City heating repair",0,0.00,0
"heating repair Indio",0,0.00,0
"Indio heating repair",0,0.00,0
"heating repair Coachella",0,0.00,0
"Coachella heating repair",0,0.00,0
"heating repair Palm Springs",0,0.00,0
"Palm Springs heating repair",0,0.00,0
"heating repair Pinyon Pines",0,0.00,0
"Pinyon Pines heating repair",0,0.00,0
"heating repair Desert Hot Springs",0,0.00,0
"Desert Hot Springs heating repair",0,0.00,0
"HVAC installation Palm Desert",0,0.00,0
"Palm Desert HVAC installation",0,0.00,0
"HVAC installation Rancho Mirage",0,0.00,0
"Rancho Mirage HVAC installation",0,0.00,0
"HVAC installation La Quinta",0,0.00,0
"La Quinta HVAC installation",0,0.00,0
"HVAC installation Cathedral City",0,0.00,0
"Cathedral City HVAC installation",0,0.00,0
"HVAC installation Indio",0,0.00,0
"Indio HVAC installation",0,0.00,0
"HVAC installation Coachella",0,0.00,0
"Coachella HVAC installation",0,0.00,0
"HVAC installation Palm Springs",0,0.00,0
"Palm Springs HVAC installation",0,0.00,0
"HVAC installation Pinyon Pines",0,0.00,0
"Pinyon Pines HVAC installation",0,0.00,0
"HVAC installation Desert Hot Springs",0,0.00,0
"Desert Hot Springs HVAC installation",0,0.00,0
"air conditioning installation Palm Desert",0,0.00,0
"Palm Desert air conditioning installation",0,0.00,0
"air conditioning installation Rancho Mirage",0,0.00,0
"Rancho Mirage air conditioning installation",0,0.00,0
"air conditioning installation La Quinta",0,0.00,0
"La Quinta air conditioning installation",0,0.00,0
"air conditioning installation Cathedral City",0,0.00,0
"Cathedral City air conditioning installation",0,0.00,0
"air conditioning installation Indio",0,0.00,0
"Indio air conditioning installation",0,0.00,0
"air conditioning installation Coachella",0,0.00,0
"Coachella air conditioning installation",0,0.00,0
"air conditioning installation Palm Springs",0,0.00,0
"Palm Springs air conditioning installation",0,0.00,0
"air conditioning installation Pinyon Pines",0,0.00,0
"Pinyon Pines air conditioning installation",0,0.00,0
"air conditioning installation Desert Hot Springs",0,0.00,0
"Desert Hot Springs air conditioning installation",0,0.00,0
"heating installation Palm Desert",0,0.00,0
"Palm Desert heating installation",0,0.00,0
"heating installation Rancho Mirage",0,0.00,0
"Rancho Mirage heating installation",0,0.00,0
"heating installation La Quinta",0,0.00,0
"La Quinta heating installation",0,0.00,0
"heating installation Cathedral City",0,0.00,0
"Cathedral City heating installation",0,0.00,0
"heating installation Indio",0,0.00,0
"Indio heating installation",0,0.00,0
"heating installation Coachella",0,0.00,0
"Coachella heating installation",0,0.00,0
"heating installation Palm Springs",0,0.00,0
"Palm Springs heating installation",0,0.00,0
"heating installation Pinyon Pines",0,0.00,0
"Pinyon Pines heating installation",0,0.00,0
"heating installation Desert Hot Springs",0,0.00,0
"Desert Hot Springs heating installation",0,0.00,0
"HVAC service Palm Desert",0,0.00,0
"Palm Desert HVAC service",0,0.00,0
"HVAC service Rancho Mirage",0,0.00,0
"Rancho Mirage HVAC service",0,0.00,0
"HVAC service La Quinta",0,0.00,0
"La Quinta HVAC service",0,0.00,0
"HVAC service Cathedral City",0,0.00,0
"Cathedral City HVAC service",0,0.00,0
"HVAC service Indio",0,0.00,0
"Indio HVAC service",0,0.00,0
"HVAC service Coachella",0,0.00,0
"Coachella HVAC service",0,0.00,0
"HVAC service Palm Springs",0,0.00,0
"Palm Springs HVAC service",0,0.00,0
"HVAC service Pinyon Pines",0,0.00,0
"Pinyon Pines HVAC service",0,0.00,0
"HVAC service Desert Hot Springs",0,0.00,0
"Desert Hot Springs HVAC service",0,0.00,0
"heating service Palm Desert",0,0.00,0
"Palm Desert heating service",0,0.00,0
"heating service Rancho Mirage",0,0.00,0
"Rancho Mirage heating service",0,0.00,0
"heating service La Quinta",0,0.00,0
"La Quinta heating service",0,0.00,0
"heating service Cathedral City",0,0.00,0
"Cathedral City heating service",0,0.00,0
"heating service Indio",0,0.00,0
"Indio heating service",0,0.00,0
"heating service Coachella",0,0.00,0
"Coachella heating service",0,0.00,0
"heating service Palm Springs",0,0.00,0
"Palm Springs heating service",0,0.00,0
"heating service Pinyon Pines",0,0.00,0
"Pinyon Pines heating service",0,0.00,0
"heating service Desert Hot Springs",0,0.00,0
"Desert Hot Springs heating service",0,0.00,0
"thermal air conditioning Palm Desert",0,0.00,0
"Palm Desert thermal air conditioning",0,0.00,0
"thermal air conditioning Rancho Mirage",0,0.00,0
"Rancho Mirage thermal air conditioning",0,0.00,0
"thermal air conditioning La Quinta",0,0.00,0
"La Quinta thermal air conditioning",0,0.00,0
"thermal air conditioning Cathedral City",0,0.00,0
"Cathedral City thermal air conditioning",0,0.00,0
"thermal air conditioning Indio",0,0.00,0
"Indio thermal air conditioning",0,0.00,0
"thermal air conditioning Coachella",0,0.00,0
"Coachella thermal air conditioning",0,0.00,0
"thermal air conditioning Palm Springs",0,0.00,0
"Palm Springs thermal air conditioning",0,0.00,0
"thermal air conditioning Pinyon Pines",0,0.00,0
"Pinyon Pines thermal air conditioning",0,0.00,0
"thermal air conditioning Desert Hot Springs",0,0.00,0
"Desert Hot Springs thermal air conditioning",0,0.00,0
"commercial hvac Palm Desert",0,0.00,0
"Palm Desert commercial hvac",0,0.00,0
"commercial hvac Rancho Mirage",0,0.00,0
"Rancho Mirage commercial hvac",0,0.00,0
"commercial hvac La Quinta",0,0.00,0
"La Quinta commercial hvac",0,0.00,0
"commercial hvac Cathedral City",0,0.00,0
"Cathedral City commercial hvac",0,0.00,0
"commercial hvac Indio",0,0.00,0
"Indio commercial hvac",0,0.00,0
"commercial hvac Coachella",0,0.00,0
"Coachella commercial hvac",0,0.00,0
"commercial hvac Palm Springs",0,0.00,0
"Palm Springs commercial hvac",0,0.00,0
"commercial hvac Pinyon Pines",0,0.00,0
"Pinyon Pines commercial hvac",0,0.00,0
"commercial hvac Desert Hot Springs",0,0.00,0
"Desert Hot Springs commercial hvac",0,0.00,0
"hvac financing Palm Desert",0,0.00,0
"Palm Desert hvac financing",0,0.00,0
"hvac financing Rancho Mirage",0,0.00,0
"Rancho Mirage hvac financing",0,0.00,0
"hvac financing La Quinta",0,0.00,0
"La Quinta hvac financing",0,0.00,0
"hvac financing Cathedral City",0,0.00,0
"Cathedral City hvac financing",0,0.00,0
"hvac financing Indio",0,0.00,0
"Indio hvac financing",0,0.00,0
"hvac financing Coachella",0,0.00,0
"Coachella hvac financing",0,0.00,0
"hvac financing Palm Springs",0,0.00,0
"Palm Springs hvac financing",0,0.00,0
"hvac financing Pinyon Pines",0,0.00,0
"Pinyon Pines hvac financing",0,0.00,0
"hvac financing Desert Hot Springs",0,0.00,0
"Desert Hot Springs hvac financing",0,0.00,0
"heat pump repair Palm Desert",0,0.00,0
"Palm Desert heat pump repair",0,0.00,0
"heat pump repair Rancho Mirage",0,0.00,0
"Rancho Mirage heat pump repair",0,0.00,0
"heat pump repair La Quinta",0,0.00,0
"La Quinta heat pump repair",0,0.00,0
"heat pump repair Cathedral City",0,0.00,0
"Cathedral City heat pump repair",0,0.00,0
"heat pump repair Indio",0,0.00,0
"Indio heat pump repair",0,0.00,0
"heat pump repair Coachella",0,0.00,0
"Coachella heat pump repair",0,0.00,0
"heat pump repair Palm Springs",0,0.00,0
"Palm Springs heat pump repair",0,0.00,0
"heat pump repair Pinyon Pines",0,0.00,0
"Pinyon Pines heat pump repair",0,0.00,0
"heat pump repair Desert Hot Springs",0,0.00,0
"Desert Hot Springs heat pump repair",0,0.00,0
"hvac estimate Palm Desert",0,0.00,0
"Palm Desert hvac estimate",0,0.00,0
"hvac estimate Rancho Mirage",0,0.00,0
"Rancho Mirage hvac estimate",0,0.00,0
"hvac estimate La Quinta",0,0.00,0
"La Quinta hvac estimate",0,0.00,0
"hvac estimate Cathedral City",0,0.00,0
"Cathedral City hvac estimate",0,0.00,0
"hvac estimate Indio",0,0.00,0
"Indio hvac estimate",0,0.00,0
"hvac estimate Coachella",0,0.00,0
"Coachella hvac estimate",0,0.00,0
"hvac estimate Palm Springs",0,0.00,0
"Palm Springs hvac estimate",0,0.00,0
"hvac estimate Pinyon Pines",0,0.00,0
"Pinyon Pines hvac estimate",0,0.00,0
"hvac estimate Desert Hot Springs",0,0.00,0
"Desert Hot Springs hvac estimate",0,0.00,0
"hvac quotes Palm Desert",0,0.00,0
"Palm Desert hvac quotes",0,0.00,0
"hvac quotes Rancho Mirage",0,0.00,0
"Rancho Mirage hvac quotes",0,0.00,0
"hvac quotes La Quinta",0,0.00,0
"La Quinta hvac quotes",0,0.00,0
"hvac quotes Cathedral City",0,0.00,0
"Cathedral City hvac quotes",0,0.00,0
"hvac quotes Indio",0,0.00,0
"Indio hvac quotes",0,0.00,0
"hvac quotes Coachella",0,0.00,0
"Coachella hvac quotes",0,0.00,0
"hvac quotes Palm Springs",0,0.00,0
"Palm Springs hvac quotes",0,0.00,0
"hvac quotes Pinyon Pines",0,0.00,0
"Pinyon Pines hvac quotes",0,0.00,0
"hvac quotes Desert Hot Springs",0,0.00,0
"Desert Hot Springs hvac quotes",0,0.00,0
"residential hvac Palm Desert",0,0.00,0
"Palm Desert residential hvac",0,0.00,0
"residential hvac Rancho Mirage",0,0.00,0
"Rancho Mirage residential hvac",0,0.00,0
"residential hvac La Quinta",0,0.00,0
"La Quinta residential hvac",0,0.00,0
"residential hvac Cathedral City",0,0.00,0
"Cathedral City residential hvac",0,0.00,0
"residential hvac Indio",0,0.00,0
"Indio residential hvac",0,0.00,0
"residential hvac Coachella",0,0.00,0
"Coachella residential hvac",0,0.00,0
"residential hvac Palm Springs",0,0.00,0
"Palm Springs residential hvac",0,0.00,0
"residential hvac Pinyon Pines",0,0.00,0
"Pinyon Pines residential hvac",0,0.00,0
"residential hvac Desert Hot Springs",0,0.00,0
"Desert Hot Springs residential hvac",0,0.00,0
"hvac technician Palm Desert",0,0.00,0
"Palm Desert hvac technician",0,0.00,0
"hvac technician Rancho Mirage",0,0.00,0
"Rancho Mirage hvac technician",0,0.00,0
"hvac technician La Quinta",0,0.00,0
"La Quinta hvac technician",0,0.00,0
"hvac technician Cathedral City",0,0.00,0
"Cathedral City hvac technician",0,0.00,0
"hvac technician Indio",0,0.00,0
"Indio hvac technician",0,0.00,0
"hvac technician Coachella",0,0.00,0
"Coachella hvac technician",0,0.00,0
"hvac technician Palm Springs",0,0.00,0
"Palm Springs hvac technician",0,0.00,0
"hvac technician Pinyon Pines",0,0.00,0
"Pinyon Pines hvac technician",0,0.00,0
"hvac technician Desert Hot Springs",0,0.00,0
"Desert Hot Springs hvac technician",0,0.00,0
"central heating Palm Desert",0,0.00,0
"Palm Desert central heating",0,0.00,0
"central heating Rancho Mirage",0,0.00,0
"Rancho Mirage central heating",0,0.00,0
"central heating La Quinta",0,0.00,0
"La Quinta central heating",0,0.00,0
"central heating Cathedral City",0,0.00,0
"Cathedral City central heating",0,0.00,0
"central heating Indio",0,0.00,0
"Indio central heating",0,0.00,0
"central heating Coachella",0,0.00,0
"Coachella central heating",0,0.00,0
"central heating Palm Springs",0,0.00,0
"Palm Springs central heating",0,0.00,0
"central heating Pinyon Pines",0,0.00,0
"Pinyon Pines central heating",0,0.00,0
"central heating Desert Hot Springs",0,0.00,0
"Desert Hot Springs central heating",0,0.00,0
"cooling system Palm Desert",0,0.00,0
"Palm Desert cooling system",0,0.00,0
"cooling system Rancho Mirage",0,0.00,0
"Rancho Mirage cooling system",0,0.00,0
"cooling system La Quinta",0,0.00,0
"La Quinta cooling system",0,0.00,0
"cooling system Cathedral City",0,0.00,0
"Cathedral City cooling system",0,0.00,0
"cooling system Indio",0,0.00,0
"Indio cooling system",0,0.00,0
"cooling system Coachella",0,0.00,0
"Coachella cooling system",0,0.00,0
"cooling system Palm Springs",0,0.00,0
"Palm Springs cooling system",0,0.00,0
"cooling system Pinyon Pines",0,0.00,0
"Pinyon Pines cooling system",0,0.00,0
"cooling system Desert Hot Springs",0,0.00,0
"Desert Hot Springs cooling system",0,0.00,0
"hvac replacement Palm Desert",0,0.00,0
"Palm Desert hvac replacement",0,0.00,0
"hvac replacement Rancho Mirage",0,0.00,0
"Rancho Mirage hvac replacement",0,0.00,0
"hvac replacement La Quinta",0,0.00,0
"La Quinta hvac replacement",0,0.00,0
"hvac replacement Cathedral City",0,0.00,0
"Cathedral City hvac replacement",0,0.00,0
"hvac replacement Indio",0,0.00,0
"Indio hvac replacement",0,0.00,0
"hvac replacement Coachella",0,0.00,0
"Coachella hvac replacement",0,0.00,0
"hvac replacement Palm Springs",0,0.00,0
"Palm Springs hvac replacement",0,0.00,0
"hvac replacement Pinyon Pines",0,0.00,0
"Pinyon Pines hvac replacement",0,0.00,0
"hvac replacement Desert Hot Springs",0,0.00,0
"Desert Hot Springs hvac replacement",0,0.00,0
"heating contractor Palm Desert",0,0.00,0
"Palm Desert heating contractor",0,0.00,0
"heating contractor Rancho Mirage",0,0.00,0
"Rancho Mirage heating contractor",0,0.00,0
"heating contractor La Quinta",0,0.00,0
"La Quinta heating contractor",0,0.00,0
"heating contractor Cathedral City",0,0.00,0
"Cathedral City heating contractor",0,0.00,0
"heating contractor Indio",0,0.00,0
"Indio heating contractor",0,0.00,0
"heating contractor Coachella",0,0.00,0
"Coachella heating contractor",0,0.00,0
"heating contractor Palm Springs",0,0.00,0
