Keyword,Search Volume,CPC ($),PPC Budget Cost ($/mo)
"Indio air conditioner service",0,0.00,0
"air conditioner service Coachella",0,0.00,0
"Coachella air conditioner service",0,0.00,0
"air conditioner service Palm Springs",0,0.00,0
"Palm Springs air conditioner service",0,0.00,0
"air conditioner service Pinyon Pines",0,0.00,0
"Pinyon Pines air conditioner service",0,0.00,0
"air conditioner service Desert Hot Springs",0,0.00,0
"Desert Hot Springs air conditioner service",0,0.00,0
"air conditioner repair Palm Desert",0,0.00,0
"Palm Desert air conditioner repair",0,0.00,0
"air conditioner repair Rancho Mirage",0,0.00,0
"Rancho Mirage air conditioner repair",0,0.00,0
"air conditioner repair La Quinta",0,0.00,0
"La Quinta air conditioner repair",0,0.00,0
"air conditioner repair Cathedral City",0,0.00,0
"Cathedral City air conditioner repair",0,0.00,0
"air conditioner repair Indio",0,0.00,0
"Indio air conditioner repair",0,0.00,0
"air conditioner repair Coachella",0,0.00,0
"Coachella air conditioner repair",0,0.00,0
"air conditioner repair Palm Springs",0,0.00,0
"Palm Springs air conditioner repair",0,0.00,0
"air conditioner repair Pinyon Pines",0,0.00,0
"Pinyon Pines air conditioner repair",0,0.00,0
"air conditioner repair Desert Hot Springs",0,0.00,0
"Desert Hot Springs air conditioner repair",0,0.00,0
"duct cleaning Palm Desert",0,0.00,0
"Palm Desert duct cleaning",0,0.00,0
"duct cleaning Rancho Mirage",0,0.00,0
"Rancho Mirage duct cleaning",0,0.00,0
"duct cleaning La Quinta",0,0.00,0
"La Quinta duct cleaning",0,0.00,0
"duct cleaning Cathedral City",0,0.00,0
"Cathedral City duct cleaning",0,0.00,0
"duct cleaning Indio",0,0.00,0
"Indio duct cleaning",0,0.00,0
"duct cleaning Coachella",0,0.00,0
"Coachella duct cleaning",0,0.00,0
"duct cleaning Palm Springs",0,0.00,0
"Palm Springs duct cleaning",0,0.00,0
"duct cleaning Pinyon Pines",0,0.00,0
"Pinyon Pines duct cleaning",0,0.00,0
"duct cleaning Desert Hot Springs",0,0.00,0
"Desert Hot Springs duct cleaning",0,0.00,0
"furnace repair Palm Desert",0,0.00,0
"Palm Desert furnace repair",0,0.00,0
"furnace repair Rancho Mirage",0,0.00,0
"Rancho Mirage furnace repair",0,0.00,0
"furnace repair La Quinta",0,0.00,0
"La Quinta furnace repair",0,0.00,0
"furnace repair Cathedral City",0,0.00,0
"Cathedral City furnace repair",0,0.00,0
"furnace repair Indio",0,0.00,0
"Indio furnace repair",0,0.00,0
"furnace repair Coachella",0,0.00,0
"Coachella furnace repair",0,0.00,0
"furnace repair Palm Springs",0,0.00,0
"Palm Springs furnace repair",0,0.00,0
"furnace repair Pinyon Pines",0,0.00,0
"Pinyon Pines furnace repair",0,0.00,0
"furnace repair Desert Hot Springs",0,0.00,0
"Desert Hot Springs furnace repair",0,0.00,0
"emergency HVAC services Palm Desert",0,0.00,0
"Palm Desert emergency HVAC services",0,0.00,0
"emergency HVAC services Rancho Mirage",0,0.00,0
"Rancho Mirage emergency HVAC services",0,0.00,0
"emergency HVAC services La Quinta",0,0.00,0
"La Quinta emergency HVAC services",0,0.00,0
"emergency HVAC services Cathedral City",0,0.00,0
"Cathedral City emergency HVAC services",0,0.00,0
"emergency HVAC services Indio",0,0.00,0
"Indio emergency HVAC services",0,0.00,0
"emergency HVAC services Coachella",0,0.00,0
"Coachella emergency HVAC services",0,0.00,0
"emergency HVAC services Palm Springs",0,0.00,0
"Palm Springs emergency HVAC services",0,0.00,0
"emergency HVAC services Pinyon Pines",0,0.00,0
"Pinyon Pines emergency HVAC services",0,0.00,0
"emergency HVAC services Desert Hot Springs",0,0.00,0
"Desert Hot Springs emergency HVAC services",0,0.00,0
"emergency AC repair Palm Desert",0,0.00,0
"Palm Desert emergency AC repair",0,0.00,0
"emergency AC repair Rancho Mirage",0,0.00,0
"Rancho Mirage emergency AC repair",0,0.00,0
"emergency AC repair La Quinta",0,0.00,0
"La Quinta emergency AC repair",0,0.00,0
"emergency AC repair Cathedral City",0,0.00,0
"Cathedral City emergency AC repair",0,0.00,0
"emergency AC repair Indio",0,0.00,0
"Indio emergency AC repair",0,0.00,0
"emergency AC repair Coachella",0,0.00,0
"Coachella emergency AC repair",0,0.00,0
"emergency AC repair Palm Springs",0,0.00,0
"Palm Springs emergency AC repair",0,0.00,0
"emergency AC repair Pinyon Pines",0,0.00,0
"Pinyon Pines emergency AC repair",0,0.00,0
"emergency AC repair Desert Hot Springs",0,0.00,0
"Desert Hot Springs emergency AC repair",0,0.00,0
"emergency heating repair Palm Desert",0,0.00,0
"Palm Desert emergency heating repair",0,0.00,0
"emergency heating repair Rancho Mirage",0,0.00,0
"Rancho Mirage emergency heating repair",0,0.00,0
"emergency heating repair La Quinta",0,0.00,0
"La Quinta emergency heating repair",0,0.00,0
"emergency heating repair Cathedral City",0,0.00,0
"Cathedral City emergency heating repair",0,0.00,0
"emergency heating repair Indio",0,0.00,0
"Indio emergency heating repair",0,0.00,0
"emergency heating repair Coachella",0,0.00,0
"Coachella emergency heating repair",0,0.00,0
"emergency heating repair Palm Springs",0,0.00,0
"Palm Springs emergency heating repair",0,0.00,0
"emergency heating repair Pinyon Pines",0,0.00,0
"Pinyon Pines emergency heating repair",0,0.00,0
"emergency heating repair Desert Hot Springs",0,0.00,0
"Desert Hot Springs emergency heating repair",0,0.00,0
"emergency air conditioning repair Palm Desert",0,0.00,0
"Palm Desert emergency air conditioning repair",0,0.00,0
"emergency air conditioning repair Rancho Mirage",0,0.00,0
"Rancho Mirage emergency air conditioning repair",0,0.00,0
"emergency air conditioning repair La Quinta",0,0.00,0
"La Quinta emergency air conditioning repair",0,0.00,0
"emergency air conditioning repair Cathedral City",0,0.00,0
"Cathedral City emergency air conditioning repair",0,0.00,0
"emergency air conditioning repair Indio",0,0.00,0
"Indio emergency air conditioning repair",0,0.00,0
"emergency air conditioning repair Coachella",0,0.00,0
"Coachella emergency air conditioning repair",0,0.00,0
"emergency air conditioning repair Palm Springs",0,0.00,0
"Palm Springs emergency air conditioning repair",0,0.00,0
"emergency air conditioning repair Pinyon Pines",0,0.00,0
"Pinyon Pines emergency air conditioning repair",0,0.00,0
"emergency air conditioning repair Desert Hot Springs",0,0.00,0
"Desert Hot Springs emergency air conditioning repair",0,0.00,0
"same day AC repair Palm Desert",0,0.00,0
"Palm Desert same day AC repair",0,0.00,0
"same day AC repair Rancho Mirage",0,0.00,0
"Rancho Mirage same day AC repair",0,0.00,0
"same day AC repair La Quinta",0,0.00,0
"La Quinta same day AC repair",0,0.00,0
"same day AC repair Cathedral City",0,0.00,0
"Cathedral City same day AC repair",0,0.00,0
"same day AC repair Indio",0,0.00,0
"Indio same day AC repair",0,0.00,0
"same day AC repair Coachella",0,0.00,0
"Coachella same day AC repair",0,0.00,0
"same day AC repair Palm Springs",0,0.00,0
"Palm Springs same day AC repair",0,0.00,0
"same day AC repair Pinyon Pines",0,0.00,0
"Pinyon Pines same day AC repair",0,0.00,0
"same day AC repair Desert Hot Springs",0,0.00,0
"Desert Hot Springs same day AC repair",0,0.00,0
"24/7 HVAC service Palm Desert",0,0.00,0
"Palm Desert 24/7 HVAC service",0,0.00,0
"24/7 HVAC service Rancho Mirage",0,0.00,0
"Rancho Mirage 24/7 HVAC service",0,0.00,0
"24/7 HVAC service La Quinta",0,0.00,0
"La Quinta 24/7 HVAC service",0,0.00,0
"24/7 HVAC service Cathedral City",0,0.00,0
"Cathedral City 24/7 HVAC service",0,0.00,0
"24/7 HVAC service Indio",0,0.00,0
"Indio 24/7 HVAC service",0,0.00,0
"24/7 HVAC service Coachella",0,0.00,0
"Coachella 24/7 HVAC service",0,0.00,0
"24/7 HVAC service Palm Springs",0,0.00,0
"Palm Springs 24/7 HVAC service",0,0.00,0
"24/7 HVAC service Pinyon Pines",0,0.00,0
"Pinyon Pines 24/7 HVAC service",0,0.00,0
"24/7 HVAC service Desert Hot Springs",0,0.00,0
"Desert Hot Springs 24/7 HVAC service",0,0.00,0
"24-hour emergency HVAC service Palm Desert",0,0.00,0
"Palm Desert 24-hour emergency HVAC service",0,0.00,0
"24-hour emergency HVAC service Rancho Mirage",0,0.00,0
"Rancho Mirage 24-hour emergency HVAC service",0,0.00,0
"24-hour emergency HVAC service La Quinta",0,0.00,0
"La Quinta 24-hour emergency HVAC service",0,0.00,0
"24-hour emergency HVAC service Cathedral City",0,0.00,0
"Cathedral City 24-hour emergency HVAC service",0,0.00,0
"24-hour emergency HVAC service Indio",0,0.00,0
"Indio 24-hour emergency HVAC service",0,0.00,0
"24-hour emergency HVAC service Coachella",0,0.00,0
"Coachella 24-hour emergency HVAC service",0,0.00,0
"24-hour emergency HVAC service Palm Springs",0,0.00,0
"Palm Springs 24-hour emergency HVAC service",0,0.00,0
"24-hour emergency HVAC service Pinyon Pines",0,0.00,0
"Pinyon Pines 24-hour emergency HVAC service",0,0.00,0
"24-hour emergency HVAC service Desert Hot Springs",0,0.00,0
"Desert Hot Springs 24-hour emergency HVAC service",0,0.00,0
"urgent HVAC repair Palm Desert",0,0.00,0
"Palm Desert urgent HVAC repair",0,0.00,0
"urgent HVAC repair Rancho Mirage",0,0.00,0
"Rancho Mirage urgent HVAC repair",0,0.00,0
"urgent HVAC repair La Quinta",0,0.00,0
"La Quinta urgent HVAC repair",0,0.00,0
"urgent HVAC repair Cathedral City",0,0.00,0
"Cathedral City urgent HVAC repair",0,0.00,0
"urgent HVAC repair Indio",0,0.00,0
"Indio urgent HVAC repair",0,0.00,0
"urgent HVAC repair Coachella",0,0.00,0
"Coachella urgent HVAC repair",0,0.00,0
"urgent HVAC repair Palm Springs",0,0.00,0
"Palm Springs urgent HVAC repair",0,0.00,0
"urgent HVAC repair Pinyon Pines",0,0.00,0
"Pinyon Pines urgent HVAC repair",0,0.00,0
"urgent HVAC repair Desert Hot Springs",0,0.00,0
"Desert Hot Springs urgent HVAC repair",0,0.00,0
"after-hours furnace repair Palm Desert",0,0.00,0
"Palm Desert after-hours furnace repair",0,0.00,0
"after-hours furnace repair Rancho Mirage",0,0.00,0
"Rancho Mirage after-hours furnace repair",0,0.00,0
"after-hours furnace repair La Quinta",0,0.00,0
"La Quinta after-hours furnace repair",0,0.00,0
"after-hours furnace repair Cathedral City",0,0.00,0
"Cathedral City after-hours furnace repair",0,0.00,0
"after-hours furnace repair Indio",0,0.00,0
"Indio after-hours furnace repair",0,0.00,0
"after-hours furnace repair Coachella",0,0.00,0
"Coachella after-hours furnace repair",0,0.00,0
"after-hours furnace repair Palm Springs",0,0.00,0
"Palm Springs after-hours furnace repair",0,0.00,0
"after-hours furnace repair Pinyon Pines",0,0.00,0
"Pinyon Pines after-hours furnace repair",0,0.00,0
"after-hours furnace repair Desert Hot Springs",0,0.00,0
"Desert Hot Springs after-hours furnace repair",0,0.00,0
"Immediate air conditioner fix Palm Desert",0,0.00,0
"Palm Desert Immediate air conditioner fix",0,0.00,0
"Immediate air conditioner fix Rancho Mirage",0,0.00,0
"Rancho Mirage Immediate air conditioner fix",0,0.00,0
"Immediate air conditioner fix La Quinta",0,0.00,0
"La Quinta Immediate air conditioner fix",0,0.00,0
"Immediate air conditioner fix Cathedral City",0,0.00,0
"Cathedral City Immediate air conditioner fix",0,0.00,0
"Immediate air conditioner fix Indio",0,0.00,0
"Indio Immediate air conditioner fix",0,0.00,0
"Immediate air conditioner fix Coachella",0,0.00,0
"Coachella Immediate air conditioner fix",0,0.00,0
"Immediate air conditioner fix Palm Springs",0,0.00,0
"Palm Springs Immediate air conditioner fix",0,0.00,0
"Immediate air conditioner fix Pinyon Pines",0,0.00,0
"Pinyon Pines Immediate air conditioner fix",0,0.00,0
"Immediate air conditioner fix Desert Hot Springs",0,0.00,0
"Desert Hot Springs Immediate air conditioner fix",0,0.00,0
"fast HVAC service Palm Desert",0,0.00,0
"Palm Desert fast HVAC service",0,0.00,0
"fast HVAC service Rancho Mirage",0,0.00,0
"Rancho Mirage fast HVAC service",0,0.00,0
"fast HVAC service La Quinta",0,0.00,0
"La Quinta fast HVAC service",0,0.00,0
"fast HVAC service Cathedral City",0,0.00,0
"Cathedral City fast HVAC service",0,0.00,0
"fast HVAC service Indio",0,0.00,0
"Indio fast HVAC service",0,0.00,0
"fast HVAC service Coachella",0,0.00,0
"Coachella fast HVAC service",0,0.00,0
"fast HVAC service Palm Springs",0,0.00,0
"Palm Springs fast HVAC service",0,0.00,0
"fast HVAC service Pinyon Pines",0,0.00,0
"Pinyon Pines fast HVAC service",0,0.00,0
"fast HVAC service Desert Hot Springs",0,0.00,0
"Desert Hot Springs fast HVAC service",0,0.00,0
"weekend furnace repair Palm Desert",0,0.00,0
"Palm Desert weekend furnace repair",0,0.00,0
"weekend furnace repair Rancho Mirage",0,0.00,0
"Rancho Mirage weekend furnace repair",0,0.00,0
"weekend furnace repair La Quinta",0,0.00,0
"La Quinta weekend furnace repair",0,0.00,0
"weekend furnace repair Cathedral City",0,0.00,0
"Cathedral City weekend furnace repair",0,0.00,0
"weekend furnace repair Indio",0,0.00,0
"Indio weekend furnace repair",0,0.00,0
"weekend furnace repair Coachella",0,0.00,0
"Coachella weekend furnace repair",0,0.00,0
"weekend furnace repair Palm Springs",0,0.00,0
"Palm Springs weekend furnace repair",0,0.00,0
"weekend furnace repair Pinyon Pines",0,0.00,0
"Pinyon Pines weekend furnace repair",0,0.00,0
"weekend furnace repair Desert Hot Springs",0,0.00,0
"Desert Hot Springs weekend furnace repair",0,0.00,0
"emergency HVAC near me Palm Desert",0,0.00,0
"Palm Desert emergency HVAC near me",0,0.00,0
"emergency HVAC near me Rancho Mirage",0,0.00,0
"Rancho Mirage emergency HVAC near me",0,0.00,0
"emergency HVAC near me La Quinta",0,0.00,0
"La Quinta emergency HVAC near me",0,0.00,0
"emergency HVAC near me Cathedral City",0,0.00,0
"Cathedral City emergency HVAC near me",0,0.00,0
"emergency HVAC near me Indio",0,0.00,0
"Indio emergency HVAC near me",0,0.00,0
"emergency HVAC near me Coachella",0,0.00,0
"Coachella emergency HVAC near me",0,0.00,0
"emergency HVAC near me Palm Springs",0,0.00,0
"Palm Springs emergency HVAC near me",0,0.00,0
"emergency HVAC near me Pinyon Pines",0,0.00,0
"Pinyon Pines emergency HVAC near me",0,0.00,0
"emergency HVAC near me Desert Hot Springs",0,0.00,0
"Desert Hot Springs emergency HVAC near me",0,0.00,0
"emergency HVAC contractor Palm Desert",0,0.00,0
"Palm Desert emergency HVAC contractor",0,0.00,0
"emergency HVAC contractor Rancho Mirage",0,0.00,0
"Rancho Mirage emergency HVAC contractor",0,0.00,0
"emergency HVAC contractor La Quinta",0,0.00,0
"La Quinta emergency HVAC contractor",0,0.00,0
"emergency HVAC contractor Cathedral City",0,0.00,0
"Cathedral City emergency HVAC contractor",0,0.00,0
"emergency HVAC contractor Indio",0,0.00,0
"Indio emergency HVAC contractor",0,0.00,0
"emergency HVAC contractor Coachella",0,0.00,0
"Coachella emergency HVAC contractor",0,0.00,0
"emergency HVAC contractor Palm Springs",0,0.00,0
"Palm Springs emergency HVAC contractor",0,0.00,0
"emergency HVAC contractor Pinyon Pines",0,0.00,0
"Pinyon Pines emergency HVAC contractor",0,0.00,0
"emergency HVAC contractor Desert Hot Springs",0,0.00,0
"Desert Hot Springs emergency HVAC contractor",0,0.00,0
"HVAC emergency service Palm Desert",0,0.00,0
"Palm Desert HVAC emergency service",0,0.00,0
"HVAC emergency service Rancho Mirage",0,0.00,0
"Rancho Mirage HVAC emergency service",0,0.00,0
"HVAC emergency service La Quinta",0,0.00,0
"La Quinta HVAC emergency service",0,0.00,0
"HVAC emergency service Cathedral City",0,0.00,0
"Cathedral City HVAC emergency service",0,0.00,0
"HVAC emergency service Indio",0,0.00,0
"Indio HVAC emergency service",0,0.00,0
"HVAC emergency service Coachella",0,0.00,0
"Coachella HVAC emergency service",0,0.00,0
"HVAC emergency service Palm Springs",0,0.00,0
"Palm Springs HVAC emergency service",0,0.00,0
"HVAC emergency service Pinyon Pines",0,0.00,0
"Pinyon Pines HVAC emergency service",0,0.00,0
"HVAC emergency service Desert Hot Springs",0,0.00,0
"Desert Hot Springs HVAC emergency service",0,0.00,0
"late-night emergency AC service Palm Desert",0,0.00,0
"Palm Desert late-night emergency AC service",0,0.00,0
"late-night emergency AC service Rancho Mirage",0,0.00,0
"Rancho Mirage late-night emergency AC service",0,0.00,0
"late-night emergency AC service La Quinta",0,0.00,0
"La Quinta late-night emergency AC service",0,0.00,0
"late-night emergency AC service Cathedral City",0,0.00,0
"Cathedral City late-night emergency AC service",0,0.00,0
"late-night emergency AC service Indio",0,0.00,0
"Indio late-night emergency AC service",0,0.00,0
"late-night emergency AC service Coachella",0,0.00,0
"Coachella late-night emergency AC service",0,0.00,0
"late-night emergency AC service Palm Springs",0,0.00,0
"Palm Springs late-night emergency AC service",0,0.00,0
"late-night emergency AC service Pinyon Pines",0,0.00,0
"Pinyon Pines late-night emergency AC service",0,0.00,0
"late-night emergency AC service Desert Hot Springs",0,0.00,0
"Desert Hot Springs late-night emergency AC service",0,0.00,0
"same day AC repair Palm Desert",0,0.00,0
"Palm Desert same day AC repair",0,0.00,0
"same day AC repair Rancho Mirage",0,0.00,0
"Rancho Mirage same day AC repair",0,0.00,0
"same day AC repair La Quinta",0,0.00,0
"La Quinta same day AC repair",0,0.00,0
"same day AC repair Cathedral City",0,0.00,0
"Cathedral City same day AC repair",0,0.00,0
"same day AC repair Indio",0,0.00,0
"Indio same day AC repair",0,0.00,0
"same day AC repair Coachella",0,0.00,0
"Coachella same day AC repair",0,0.00,0
"same day AC repair Palm Springs",0,0.00,0
"Palm Springs same day AC repair",0,0.00,0
"same day AC repair Pinyon Pines",0,0.00,0
"Pinyon Pines same day AC repair",0,0.00,0
"same day AC repair Desert Hot Springs",0,0.00,0
"Desert Hot Springs same day AC repair",0,0.00,0
"urgent furnace repair Palm Desert",0,0.00,0
"Palm Desert urgent furnace repair",0,0.00,0
"urgent furnace repair Rancho Mirage",0,0.00,0
"Rancho Mirage urgent furnace repair",0,0.00,0
"urgent furnace repair La Quinta",0,0.00,0
"La Quinta urgent furnace repair",0,0.00,0
"urgent furnace repair Cathedral City",0,0.00,0
"Cathedral City urgent furnace repair",0,0.00,0
"urgent furnace repair Indio",0,0.00,0
"Indio urgent furnace repair",0,0.00,0
"urgent furnace repair Coachella",0,0.00,0
"Coachella urgent furnace repair",0,0.00,0
"urgent furnace repair Palm Springs",0,0.00,0
"Palm Springs urgent furnace repair",0,0.00,0
"urgent furnace repair Pinyon Pines",0,0.00,0
"Pinyon Pines urgent furnace repair",0,0.00,0
"urgent furnace repair Desert Hot Springs",0,0.00,0
"Desert Hot Springs urgent furnace repair",0,0.00,0
"immediate HVAC service Palm Desert",0,0.00,0
"Palm Desert immediate HVAC service",0,0.00,0
"immediate HVAC service Rancho Mirage",0,0.00,0
"Rancho Mirage immediate HVAC service",0,0.00,0
"immediate HVAC service La Quinta",0,0.00,0
"La Quinta immediate HVAC service",0,0.00,0
"immediate HVAC service Cathedral City",0,0.00,0
"Cathedral City immediate HVAC service",0,0.00,0
"immediate HVAC service Indio",0,0.00,0
"Indio immediate HVAC service",0,0.00,0
"immediate HVAC service Coachella",0,0.00,0
"Coachella immediate HVAC service",0,0.00,0
"immediate HVAC service Palm Springs",0,0.00,0
"Palm Springs immediate HVAC service",0,0.00,0
"immediate HVAC service Pinyon Pines",0,0.00,0
"Pinyon Pines immediate HVAC service",0,0.00,0
"immediate HVAC service Desert Hot Springs",0,0.00,0
"Desert Hot Springs immediate HVAC service",0,0.00,0
"fast air conditioning repair near me Palm Desert",0,0.00,0
"Palm Desert fast air conditioning repair near me",0,0.00,0
"fast air conditioning repair near me Rancho Mirage",0,0.00,0
"Rancho Mirage fast air conditioning repair near me",0,0.00,0
"fast air conditioning repair near me La Quinta",0,0.00,0
"La Quinta fast air conditioning repair near me",0,0.00,0
"fast air conditioning repair near me Cathedral City",0,0.00,0
"Cathedral City fast air conditioning repair near me",0,0.00,0
"fast air conditioning repair near me Indio",0,0.00,0
"Indio fast air conditioning repair near me",0,0.00,0
"fast air conditioning repair near me Coachella",0,0.00,0
"Coachella fast air conditioning repair near me",0,0.00,0
"fast air conditioning repair near me Palm Springs",0,0.00,0
"Palm Springs fast air conditioning repair near me",0,0.00,0
"fast air conditioning repair near me Pinyon Pines",0,0.00,0
"Pinyon Pines fast air conditioning repair near me",0,0.00,0
"fast air conditioning repair near me Desert Hot Springs",0,0.00,0
"Desert Hot Springs fast air conditioning repair near me",0,0.00,0
"no heat emergency service Palm Desert",0,0.00,0
"Palm Desert no heat emergency service",0,0.00,0
"no heat emergency service Rancho Mirage",0,0.00,0
"Rancho Mirage no heat emergency service",0,0.00,0
"no heat emergency service La Quinta",0,0.00,0
"La Quinta no heat emergency service",0,0.00,0
"no heat emergency service Cathedral City",0,0.00,0
"Cathedral City no heat emergency service",0,0.00,0
"no heat emergency service Indio",0,0.00,0
"Indio no heat emergency service",0,0.00,0
"no heat emergency service Coachella",0,0.00,0
"Coachella no heat emergency service",0,0.00,0
"no heat emergency service Palm Springs",0,0.00,0
"Palm Springs no heat emergency service",0,0.00,0
"no heat emergency service Pinyon Pines",0,0.00,0
"Pinyon Pines no heat emergency service",0,0.00,0
"no heat emergency service Desert Hot Springs",0,0.00,0
"Desert Hot Springs no heat emergency service",0,0.00,0
"AC stopped working in Palm Desert",0,0.00,0
"Palm Desert AC stopped working in",0,0.00,0
"AC stopped working in Rancho Mirage",0,0.00,0
"Rancho Mirage AC stopped working in",0,0.00,0
"AC stopped working in La Quinta",0,0.00,0
"La Quinta AC stopped working in",0,0.00,0
"AC stopped working in Cathedral City",0,0.00,0
"Cathedral City AC stopped working in",0,0.00,0
"AC stopped working in Indio",0,0.00,0
"Indio AC stopped working in",0,0.00,0
"AC stopped working in Coachella",0,0.00,0
"Coachella AC stopped working in",0,0.00,0
"AC stopped working in Palm Springs",0,0.00,0
"Palm Springs AC stopped working in",0,0.00,0
"AC stopped working in Pinyon Pines",0,0.00,0
"Pinyon Pines AC stopped working in",0,0.00,0
"AC stopped working in Desert Hot Springs",0,0.00,0
"Desert Hot Springs AC stopped working in",0,0.00,0
"after hours AC service Palm Desert",0,0.00,0
"Palm Desert after hours AC service",0,0.00,0
"after hours AC service Rancho Mirage",0,0.00,0
"Rancho Mirage after hours AC service",0,0.00,0
"after hours AC service La Quinta",0,0.00,0
"La Quinta after hours AC service",0,0.00,0
"after hours AC service Cathedral City",0,0.00,0
"Cathedral City after hours AC service",0,0.00,0
"after hours AC service Indio",0,0.00,0
"Indio after hours AC service",0,0.00,0
"after hours AC service Coachella",0,0.00,0
"Coachella after hours AC service",0,0.00,0
"after hours AC service Palm Springs",0,0.00,0
"Palm Springs after hours AC service",0,0.00,0
"after hours AC service Pinyon Pines",0,0.00,0
"Pinyon Pines after hours AC service",0,0.00,0
"after hours AC service Desert Hot Springs",0,0.00,0
"Desert Hot Springs after hours AC service",0,0.00,0
"HVAC repair open now Palm Desert",0,0.00,0
"Palm Desert HVAC repair open now",0,0.00,0
"HVAC repair open now Rancho Mirage",0,0.00,0
"Rancho Mirage HVAC repair open now",0,0.00,0
"HVAC repair open now La Quinta",0,0.00,0
"La Quinta HVAC repair open now",0,0.00,0
"HVAC repair open now Cathedral City",0,0.00,0
"Cathedral City HVAC repair open now",0,0.00,0
"HVAC repair open now Indio",0,0.00,0
"Indio HVAC repair open now",0,0.00,0
"HVAC repair open now Coachella",0,0.00,0
"Coachella HVAC repair open now",0,0.00,0
"HVAC repair open now Palm Springs",0,0.00,0
"Palm Springs HVAC repair open now",0,0.00,0
"HVAC repair open now Pinyon Pines",0,0.00,0
"Pinyon Pines HVAC repair open now",0,0.00,0
"HVAC repair open now Desert Hot Springs",0,0.00,0
"Desert Hot Springs HVAC repair open now",0,0.00,0
"quick furnace repair Palm Desert",0,0.00,0
"Palm Desert quick furnace repair",0,0.00,0
"quick furnace repair Rancho Mirage",0,0.00,0
"Rancho Mirage quick furnace repair",0,0.00,0
"quick furnace repair La Quinta",0,0.00,0
"La Quinta quick furnace repair",0,0.00,0
"quick furnace repair Cathedral City",0,0.00,0
"Cathedral City quick furnace repair",0,0.00,0
"quick furnace repair Indio",0,0.00,0
"Indio quick furnace repair",0,0.00,0
"quick furnace repair Coachella",0,0.00,0
"Coachella quick furnace repair",0,0.00,0
"quick furnace repair Palm Springs",0,0.00,0
"Palm Springs quick furnace repair",0,0.00,0
"quick furnace repair Pinyon Pines",0,0.00,0
"Pinyon Pines quick furnace repair",0,0.00,0
"quick furnace repair Desert Hot Springs",0,0.00,0
"Desert Hot Springs quick furnace repair",0,0.00,0
"HVAC repair for storm damage Palm Desert",0,0.00,0
"Palm Desert HVAC repair for storm damage",0,0.00,0
"HVAC repair for storm damage Rancho Mirage",0,0.00,0
"Rancho Mirage HVAC repair for storm damage",0,0.00,0
"HVAC repair for storm damage La Quinta",0,0.00,0
"La Quinta HVAC repair for storm damage",0,0.00,0
"HVAC repair for storm damage Cathedral City",0,0.00,0
"Cathedral City HVAC repair for storm damage",0,0.00,0
"HVAC repair for storm damage Indio",0,0.00,0
"Indio HVAC repair for storm damage",0,0.00,0
"HVAC repair for storm damage Coachella",0,0.00,0
"Coachella HVAC repair for storm damage",0,0.00,0
"HVAC repair for storm damage Palm Springs",0,0.00,0
"Palm Springs HVAC repair for storm damage",0,0.00,0
"HVAC repair for storm damage Pinyon Pines",0,0.00,0
"Pinyon Pines HVAC repair for storm damage",0,0.00,0
"HVAC repair for storm damage Desert Hot Springs",0,0.00,0
"Desert Hot Springs HVAC repair for storm damage",0,0.00,0
"furnace not working during snowstorm Palm Desert",0,0.00,0
"Palm Desert furnace not working during snowstorm",0,0.00,0
"furnace not working during snowstorm Rancho Mirage",0,0.00,0
"Rancho Mirage furnace not working during snowstorm",0,0.00,0
"furnace not working during snowstorm La Quinta",0,0.00,0
"La Quinta furnace not working during snowstorm",0,0.00,0
"furnace not working during snowstorm Cathedral City",0,0.00,0
"Cathedral City furnace not working during snowstorm",0,0.00,0
"furnace not working during snowstorm Indio",0,0.00,0
"Indio furnace not working during snowstorm",0,0.00,0
"furnace not working during snowstorm Coachella",0,0.00,0
"Coachella furnace not working during snowstorm",0,0.00,0
"furnace not working during snowstorm Palm Springs",0,0.00,0
"Palm Springs furnace not working during snowstorm",0,0.00,0
"furnace not working during snowstorm Pinyon Pines",0,0.00,0
